id,name,price,short_description,description,rating_average,review_count,image_base_url,image_large_url,image_medium_url,image_small_url,image_thumbnail_url,stock,quantity_sold
273872631,PC Case Galax Revolution 03 - HÀNG CHÍNH HÃNG,1150000,"THÔNG SỐ KỸ THUẬTHệ số hình thức (Midi, Micro, Mini ITX, Full) M-ATX / ITX Khung SPCC + Kính cường lực Yếu tố hình thức PSU ATX / MATX Yếu tố hình thức M / B M-ATX / ITX ...","THÔNG SỐ KỸ THUẬT Hệ số hình thức (Midi, Micro, Mini ITX, Full) M-ATX / ITX Khung SPCC + Kính cường lực Yếu tố hình thức PSU ATX / MATX Yếu tố hình thức M / B M-ATX / ITX Bảng điều khiển phía trước Vỏ kim loại Bảng điều khiển trên cùng Vỏ kim loại Bảng điều khiển bên Trái Vỏ kim loại Đúng Vỏ kim loại Vịnh Drive bên ngoài 5,25 ""(ODD) * 0 3,5 "" * 0 Vịnh Drive nội bộ 3.5 ""(HDD) * 3 2,5 ""(SSD) * 3 I / O nút * 2 Cổng USB1.1 * 0 Cổng USB2.0 * 0 Cổng USB3.0 * 2 Cổng USB3.1 * 0 Hỗ trợ âm thanh HD * 1 Đầu đọc thẻ (Hỗ trợ) * 0 P-Lock * 0 Bộ điều khiển RGB * 0 Bộ điều khiển tối đa. người hâm mộ * 0 Bộ điều khiển RGB tối đa. Dải dẫn * 0 Điều khiển từ xa (IR hoặc RF) * 0 Hỗ trợ quạt làm mát Đằng trước 0 Đứng đầu 2x120mm (Tùy chọn quạt) Ở phía sau 2x80mm (tùy chọn quạt) Bên 2x120mm / 2x140mm (Tùy chọn quạt) (Yêu cầu giá đỡ quạt) Đáy 2x120mm (Tùy chọn quạt) Hỗ trợ làm mát bằng nước (Kích thước bộ tản nhiệt) Đằng trước 0 Đứng đầu 240mm * 1 (nếu được lắp đặt bo mạch chủ MATX) Ở phía sau 0 Bên 120 / 240mm (tối đa 280mm, độ dày phụ thuộc vào PSU / Bộ nhớ) Đáy 120mm * 1 Kích thước Kích thước mm (L) 391 * (W) 185 * (H) 303mm Trường hợp đầy đủ (bao gồm Fascia) mm Thùng carton mm Trọng lượng tịnh / kg) Kilôgam Tổng trọng lượng (kg) Kilôgam Chiều dài thẻ VGA mm lên đến 335mm (245mm nếu ATX PSU được lắp đặt theo chiều dọc) Chiều cao bộ làm mát CPU mm 155mm (88mm nếu lắp đặt card VGA dọc) Độ sâu quản lý cáp mm Giá sản phẩm trên Tiki đã bao gồm thuế theo luật hiện hành. Bên cạnh đó, tuỳ vào loại sản phẩm, hình thức và địa chỉ giao hàng mà có thể phát sinh thêm chi phí khác như phí vận chuyển, phụ phí hàng cồng kềnh, thuế nhập khẩu (đối với đơn hàng giao từ nước ngoài có giá trị trên 1 triệu đồng).....",0,0,"https://salt.tikicdn.com/ts/product/f5/9b/10/3ad283de33fa5dd121f43a77e857f352.jpg, https://salt.tikicdn.com/ts/product/26/fd/33/ca997acc9b78e71a8b6cb3412312446e.jpg, https://salt.tikicdn.com/ts/product/6e/fc/10/1b212e4245c1391858398873b708b10c.jpg, https://salt.tikicdn.com/ts/product/67/05/90/a5a383436b29d4aee804422e1910abbc.jpg, https://salt.tikicdn.com/ts/product/0a/70/fd/80c441486f8f2dd6db93a8c70d7481d2.jpg, https://salt.tikicdn.com/ts/product/f1/9a/9e/7cccd5b30ac46bef97917a70d34c8cba.png, https://salt.tikicdn.com/ts/product/0d/ef/ed/9e730e147aa91523df4ad12746e66846.png","https://salt.tikicdn.com/cache/w1200/ts/product/f5/9b/10/3ad283de33fa5dd121f43a77e857f352.jpg, https://salt.tikicdn.com/cache/w1200/ts/product/26/fd/33/ca997acc9b78e71a8b6cb3412312446e.jpg, https://salt.tikicdn.com/cache/w1200/ts/product/6e/fc/10/1b212e4245c1391858398873b708b10c.jpg, https://salt.tikicdn.com/cache/w1200/ts/product/67/05/90/a5a383436b29d4aee804422e1910abbc.jpg, https://salt.tikicdn.com/cache/w1200/ts/product/0a/70/fd/80c441486f8f2dd6db93a8c70d7481d2.jpg, https://salt.tikicdn.com/cache/w1200/ts/product/f1/9a/9e/7cccd5b30ac46bef97917a70d34c8cba.png, https://salt.tikicdn.com/cache/w1200/ts/product/0d/ef/ed/9e730e147aa91523df4ad12746e66846.png","https://salt.tikicdn.com/cache/w300/ts/product/f5/9b/10/3ad283de33fa5dd121f43a77e857f352.jpg, https://salt.tikicdn.com/cache/w300/ts/product/26/fd/33/ca997acc9b78e71a8b6cb3412312446e.jpg, https://salt.tikicdn.com/cache/w300/ts/product/6e/fc/10/1b212e4245c1391858398873b708b10c.jpg, https://salt.tikicdn.com/cache/w300/ts/product/67/05/90/a5a383436b29d4aee804422e1910abbc.jpg, https://salt.tikicdn.com/cache/w300/ts/product/0a/70/fd/80c441486f8f2dd6db93a8c70d7481d2.jpg, https://salt.tikicdn.com/cache/w300/ts/product/f1/9a/9e/7cccd5b30ac46bef97917a70d34c8cba.png, https://salt.tikicdn.com/cache/w300/ts/product/0d/ef/ed/9e730e147aa91523df4ad12746e66846.png","https://salt.tikicdn.com/cache/200x280/ts/product/f5/9b/10/3ad283de33fa5dd121f43a77e857f352.jpg, https://salt.tikicdn.com/cache/200x280/ts/product/26/fd/33/ca997acc9b78e71a8b6cb3412312446e.jpg, https://salt.tikicdn.com/cache/200x280/ts/product/6e/fc/10/1b212e4245c1391858398873b708b10c.jpg, https://salt.tikicdn.com/cache/200x280/ts/product/67/05/90/a5a383436b29d4aee804422e1910abbc.jpg, https://salt.tikicdn.com/cache/200x280/ts/product/0a/70/fd/80c441486f8f2dd6db93a8c70d7481d2.jpg, https://salt.tikicdn.com/cache/200x280/ts/product/f1/9a/9e/7cccd5b30ac46bef97917a70d34c8cba.png, https://salt.tikicdn.com/cache/200x280/ts/product/0d/ef/ed/9e730e147aa91523df4ad12746e66846.png","https://salt.tikicdn.com/cache/200x280/ts/product/f5/9b/10/3ad283de33fa5dd121f43a77e857f352.jpg, https://salt.tikicdn.com/cache/200x280/ts/product/26/fd/33/ca997acc9b78e71a8b6cb3412312446e.jpg, https://salt.tikicdn.com/cache/200x280/ts/product/6e/fc/10/1b212e4245c1391858398873b708b10c.jpg, https://salt.tikicdn.com/cache/200x280/ts/product/67/05/90/a5a383436b29d4aee804422e1910abbc.jpg, https://salt.tikicdn.com/cache/200x280/ts/product/0a/70/fd/80c441486f8f2dd6db93a8c70d7481d2.jpg, https://salt.tikicdn.com/cache/200x280/ts/product/f1/9a/9e/7cccd5b30ac46bef97917a70d34c8cba.png, https://salt.tikicdn.com/cache/200x280/ts/product/0d/ef/ed/9e730e147aa91523df4ad12746e66846.png",1000,0
270959045,Fan Case Xigmatek STARLINK ULTRA ARCTIC ARGB (EN40856) - Hàng Chính Hãng,650000,"Bộ 3 Fan Xigmatek Starlink Ultra ArcticBộ 3 Fan Xigmatek Starlink Ultra ArcticLED RGB cực đẹp, hiệu ứng gương vô cựcĐồng bộ với mainboardHỗ trợ hầu hết các hãng mainboard lớn...","Bộ 3 Fan Xigmatek Starlink Ultra Arctic Bộ 3 Fan Xigmatek Starlink Ultra Arctic LED RGB cực đẹp, hiệu ứng gương vô cực Đồng bộ với mainboard Hỗ trợ hầu hết các hãng mainboard lớn Giá sản phẩm trên Tiki đã bao gồm thuế theo luật hiện hành. Bên cạnh đó, tuỳ vào loại sản phẩm, hình thức và địa chỉ giao hàng mà có thể phát sinh thêm chi phí khác như phí vận chuyển, phụ phí hàng cồng kềnh, thuế nhập khẩu (đối với đơn hàng giao từ nước ngoài có giá trị trên 1 triệu đồng).....",0,0,https://salt.tikicdn.com/ts/product/a0/bc/83/d042364085564d61553d5d0ed6f16756.png,https://salt.tikicdn.com/cache/w1200/ts/product/a0/bc/83/d042364085564d61553d5d0ed6f16756.png,https://salt.tikicdn.com/cache/w300/ts/product/a0/bc/83/d042364085564d61553d5d0ed6f16756.png,https://salt.tikicdn.com/cache/200x280/ts/product/a0/bc/83/d042364085564d61553d5d0ed6f16756.png,https://salt.tikicdn.com/cache/200x280/ts/product/a0/bc/83/d042364085564d61553d5d0ed6f16756.png,1000,0
277859196,CASE MAGIC VILA ULTRA PRO (ATX) - Hàng chính hãng,2460000," Thông tin sản phẩm:• Thương hiệu: MAGIC• Bảo hành: 12 tháng• Màu sắc: Đen, Trắng – Lựa chọn màu sắc phù hợp với nhiều phong cách setup.• Loại sản phẩm: Vỏ case gaming• Kích thước case: 425300465 mm (...","Thông tin sản phẩm: • Thương hiệu: MAGIC • Bảo hành: 12 tháng • Màu sắc: Đen, Trắng – Lựa chọn màu sắc phù hợp với nhiều phong cách setup. • Loại sản phẩm: Vỏ case gaming • Kích thước case: 425300465 mm (LWH) – Thiết kế gọn gàng, phù hợp với không gian làm việc và gaming. • Chất liệu: Kim loại và kính cường lực – Tạo vẻ ngoài sang trọng, chắc chắn và bền bỉ. • Hỗ trợ mainboard: ATX, MATX, ITX – Tương thích với nhiều loại bo mạch chủ phổ biến. • Hỗ trợ ổ cứng: o 3.5″ HDD x2 o 2.5″ SSD x2 o Không hỗ trợ ODD o Hỗ trợ ATX PSU (nguồn ATX) • Support max VGA: 390mm – Phù hợp cho các card đồ họa cao cấp, đáp ứng nhu cầu chơi game mạnh mẽ. • Hỗ trợ Vertical VGA: Lắp card đồ họa theo chiều dọc, tăng tính thẩm mỹ và khả năng làm mát. • Support max CPU Cooler: 180mm – Hỗ trợ tản nhiệt CPU hiệu quả, giữ cho hệ thống luôn mát mẻ. • Hỗ trợ làm mát: o Radiator nước: 120/240/360mm o Quạt LED: 3 quạt mặt bên, 3 quạt mặt trên, 1 quạt mặt sau, 3 quạt mặt dưới – Tạo hiệu ứng ánh sáng đẹp mắt và làm mát hiệu quả. Ưu điểm nổi bật: Thiết kế tối ưu cho gaming: Phù hợp với mọi cấu hình máy tính từ cơ bản đến cao cấp, dễ dàng lắp đặt các linh kiện mạnh mẽ. Chất liệu bền bỉ: Kim loại và kính cường lực tạo nên vẻ ngoài sang trọng, chắc chắn, đồng thời tăng khả năng tản nhiệt. Hệ thống làm mát hoàn hảo: Hỗ trợ nhiều quạt LED và hệ thống tản nhiệt nước, giúp duy trì nhiệt độ máy tính ổn định, ngay cả khi hoạt động với công suất cao. Tương thích linh kiện cao: Hỗ trợ nhiều loại bo mạch chủ và card đồ họa, đem lại khả năng nâng cấp dễ dàng. Vỏ Case MAGIC VILA PRO là sự lựa chọn tuyệt vời cho những người đam mê game và những ai cần một hệ thống máy tính mạnh mẽ, hiệu suất cao với thiết kế ấn tượng. Đặt hàng ngay hôm nay để sở hữu một không gian làm việc, giải trí đỉnh cao! ——————————————————— Cam kết Hàng chính hãng Hình ảnh sản phẩm thực tế Giá cả phù hợp nhất trên thị trường Giao hàng nhanh chóng Hỗ trợ đổi hàng nhanh nhất cho khách hàng #VoCaseMAGIC #MAGICVilaPro #VoCaseGaming #CaseATX #LinhKienPC #GamingPC #RGBFan #VerticalVGA Giá sản phẩm trên Tiki đã bao gồm thuế theo luật hiện hành. Bên cạnh đó, tuỳ vào loại sản phẩm, hình thức và địa chỉ giao hàng mà có thể phát sinh thêm chi phí khác như phí vận chuyển, phụ phí hàng cồng kềnh, thuế nhập khẩu (đối với đơn hàng giao từ nước ngoài có giá trị trên 1 triệu đồng).....",0,0,"https://salt.tikicdn.com/ts/product/2b/52/8a/862120e501f23e46960ba98aa824714c.png, https://salt.tikicdn.com/ts/product/85/e5/b0/cd0c117a0f0b3cbb5656cf728b91b0b4.png, https://salt.tikicdn.com/ts/product/1d/62/e2/d70c6d8e25ddf8241c430c4c418a88ff.png, https://salt.tikicdn.com/ts/product/7d/17/f3/943eeccbce0939f4dbc61dcf2b569f2f.png, https://salt.tikicdn.com/ts/product/05/7d/eb/fd7452990297e9cfd12c61acee46619e.png, https://salt.tikicdn.com/ts/product/4a/9e/f4/f55e0673eaba6ed3ad873bf2e8b185fa.jpg, https://salt.tikicdn.com/ts/product/d4/33/f6/1c13c0bd1a47d2c864f2083c09bf2ed6.jpg, https://salt.tikicdn.com/ts/product/79/ea/af/6210a216b807fc9570e161b4d4cfca0f.jpg, https://salt.tikicdn.com/ts/product/2b/5e/dd/e297d0fc7bcccbec3562c62b5cf430cc.jpg, https://salt.tikicdn.com/ts/product/7e/2e/8b/df6a57f452594a28da217d77a23ad1bf.jpg, https://salt.tikicdn.com/ts/product/96/f0/f8/a7593fe6f8e578d77c111df4835a6ce5.jpg, https://salt.tikicdn.com/ts/product/9c/7e/31/37231cb11ddf8ba5e17829088860a8b8.jpg, https://salt.tikicdn.com/ts/product/16/2e/9d/5d9049f0048dd7ed60ae2d6a4c7dc91c.jpg, https://salt.tikicdn.com/ts/product/d9/64/0c/f5bc6e2b333849caff2d1cab7d89bbc4.jpg","https://salt.tikicdn.com/cache/w1200/ts/product/2b/52/8a/862120e501f23e46960ba98aa824714c.png, https://salt.tikicdn.com/cache/w1200/ts/product/85/e5/b0/cd0c117a0f0b3cbb5656cf728b91b0b4.png, https://salt.tikicdn.com/cache/w1200/ts/product/1d/62/e2/d70c6d8e25ddf8241c430c4c418a88ff.png, https://salt.tikicdn.com/cache/w1200/ts/product/7d/17/f3/943eeccbce0939f4dbc61dcf2b569f2f.png, https://salt.tikicdn.com/cache/w1200/ts/product/05/7d/eb/fd7452990297e9cfd12c61acee46619e.png, https://salt.tikicdn.com/cache/w1200/ts/product/4a/9e/f4/f55e0673eaba6ed3ad873bf2e8b185fa.jpg, https://salt.tikicdn.com/cache/w1200/ts/product/d4/33/f6/1c13c0bd1a47d2c864f2083c09bf2ed6.jpg, https://salt.tikicdn.com/cache/w1200/ts/product/79/ea/af/6210a216b807fc9570e161b4d4cfca0f.jpg, https://salt.tikicdn.com/cache/w1200/ts/product/2b/5e/dd/e297d0fc7bcccbec3562c62b5cf430cc.jpg, https://salt.tikicdn.com/cache/w1200/ts/product/7e/2e/8b/df6a57f452594a28da217d77a23ad1bf.jpg, https://salt.tikicdn.com/cache/w1200/ts/product/96/f0/f8/a7593fe6f8e578d77c111df4835a6ce5.jpg, https://salt.tikicdn.com/cache/w1200/ts/product/9c/7e/31/37231cb11ddf8ba5e17829088860a8b8.jpg, https://salt.tikicdn.com/cache/w1200/ts/product/16/2e/9d/5d9049f0048dd7ed60ae2d6a4c7dc91c.jpg, https://salt.tikicdn.com/cache/w1200/ts/product/d9/64/0c/f5bc6e2b333849caff2d1cab7d89bbc4.jpg","https://salt.tikicdn.com/cache/w300/ts/product/2b/52/8a/862120e501f23e46960ba98aa824714c.png, https://salt.tikicdn.com/cache/w300/ts/product/85/e5/b0/cd0c117a0f0b3cbb5656cf728b91b0b4.png, https://salt.tikicdn.com/cache/w300/ts/product/1d/62/e2/d70c6d8e25ddf8241c430c4c418a88ff.png, https://salt.tikicdn.com/cache/w300/ts/product/7d/17/f3/943eeccbce0939f4dbc61dcf2b569f2f.png, https://salt.tikicdn.com/cache/w300/ts/product/05/7d/eb/fd7452990297e9cfd12c61acee46619e.png, https://salt.tikicdn.com/cache/w300/ts/product/4a/9e/f4/f55e0673eaba6ed3ad873bf2e8b185fa.jpg, https://salt.tikicdn.com/cache/w300/ts/product/d4/33/f6/1c13c0bd1a47d2c864f2083c09bf2ed6.jpg, https://salt.tikicdn.com/cache/w300/ts/product/79/ea/af/6210a216b807fc9570e161b4d4cfca0f.jpg, https://salt.tikicdn.com/cache/w300/ts/product/2b/5e/dd/e297d0fc7bcccbec3562c62b5cf430cc.jpg, https://salt.tikicdn.com/cache/w300/ts/product/7e/2e/8b/df6a57f452594a28da217d77a23ad1bf.jpg, https://salt.tikicdn.com/cache/w300/ts/product/96/f0/f8/a7593fe6f8e578d77c111df4835a6ce5.jpg, https://salt.tikicdn.com/cache/w300/ts/product/9c/7e/31/37231cb11ddf8ba5e17829088860a8b8.jpg, https://salt.tikicdn.com/cache/w300/ts/product/16/2e/9d/5d9049f0048dd7ed60ae2d6a4c7dc91c.jpg, https://salt.tikicdn.com/cache/w300/ts/product/d9/64/0c/f5bc6e2b333849caff2d1cab7d89bbc4.jpg","https://salt.tikicdn.com/cache/200x280/ts/product/2b/52/8a/862120e501f23e46960ba98aa824714c.png, https://salt.tikicdn.com/cache/200x280/ts/product/85/e5/b0/cd0c117a0f0b3cbb5656cf728b91b0b4.png, https://salt.tikicdn.com/cache/200x280/ts/product/1d/62/e2/d70c6d8e25ddf8241c430c4c418a88ff.png, https://salt.tikicdn.com/cache/200x280/ts/product/7d/17/f3/943eeccbce0939f4dbc61dcf2b569f2f.png, https://salt.tikicdn.com/cache/200x280/ts/product/05/7d/eb/fd7452990297e9cfd12c61acee46619e.png, https://salt.tikicdn.com/cache/200x280/ts/product/4a/9e/f4/f55e0673eaba6ed3ad873bf2e8b185fa.jpg, https://salt.tikicdn.com/cache/200x280/ts/product/d4/33/f6/1c13c0bd1a47d2c864f2083c09bf2ed6.jpg, https://salt.tikicdn.com/cache/200x280/ts/product/79/ea/af/6210a216b807fc9570e161b4d4cfca0f.jpg, https://salt.tikicdn.com/cache/200x280/ts/product/2b/5e/dd/e297d0fc7bcccbec3562c62b5cf430cc.jpg, https://salt.tikicdn.com/cache/200x280/ts/product/7e/2e/8b/df6a57f452594a28da217d77a23ad1bf.jpg, https://salt.tikicdn.com/cache/200x280/ts/product/96/f0/f8/a7593fe6f8e578d77c111df4835a6ce5.jpg, https://salt.tikicdn.com/cache/200x280/ts/product/9c/7e/31/37231cb11ddf8ba5e17829088860a8b8.jpg, https://salt.tikicdn.com/cache/200x280/ts/product/16/2e/9d/5d9049f0048dd7ed60ae2d6a4c7dc91c.jpg, https://salt.tikicdn.com/cache/200x280/ts/product/d9/64/0c/f5bc6e2b333849caff2d1cab7d89bbc4.jpg","https://salt.tikicdn.com/cache/200x280/ts/product/2b/52/8a/862120e501f23e46960ba98aa824714c.png, https://salt.tikicdn.com/cache/200x280/ts/product/85/e5/b0/cd0c117a0f0b3cbb5656cf728b91b0b4.png, https://salt.tikicdn.com/cache/200x280/ts/product/1d/62/e2/d70c6d8e25ddf8241c430c4c418a88ff.png, https://salt.tikicdn.com/cache/200x280/ts/product/7d/17/f3/943eeccbce0939f4dbc61dcf2b569f2f.png, https://salt.tikicdn.com/cache/200x280/ts/product/05/7d/eb/fd7452990297e9cfd12c61acee46619e.png, https://salt.tikicdn.com/cache/200x280/ts/product/4a/9e/f4/f55e0673eaba6ed3ad873bf2e8b185fa.jpg, https://salt.tikicdn.com/cache/200x280/ts/product/d4/33/f6/1c13c0bd1a47d2c864f2083c09bf2ed6.jpg, https://salt.tikicdn.com/cache/200x280/ts/product/79/ea/af/6210a216b807fc9570e161b4d4cfca0f.jpg, https://salt.tikicdn.com/cache/200x280/ts/product/2b/5e/dd/e297d0fc7bcccbec3562c62b5cf430cc.jpg, https://salt.tikicdn.com/cache/200x280/ts/product/7e/2e/8b/df6a57f452594a28da217d77a23ad1bf.jpg, https://salt.tikicdn.com/cache/200x280/ts/product/96/f0/f8/a7593fe6f8e578d77c111df4835a6ce5.jpg, https://salt.tikicdn.com/cache/200x280/ts/product/9c/7e/31/37231cb11ddf8ba5e17829088860a8b8.jpg, https://salt.tikicdn.com/cache/200x280/ts/product/16/2e/9d/5d9049f0048dd7ed60ae2d6a4c7dc91c.jpg, https://salt.tikicdn.com/cache/200x280/ts/product/d9/64/0c/f5bc6e2b333849caff2d1cab7d89bbc4.jpg",1000,0
275928108,vỏ máy tính laptop - Mặt B vỏ laptop Elitebook 8460p - 8470p - Viền màn hình Elitebook 8460p - 8470p - Hàng chính hãng,305000,"vỏ máy tính laptop - Mặt B vỏ laptop Elitebook 8460p - 8470p - Viền màn hình Elitebook 8460p - 8470p - Hàng chính hãng- Tên sản phẩm: Mặt B (viền màn hình) laptop Elitebook 8460p, 8470p- Tình trạng: ...","vỏ máy tính laptop - Mặt B vỏ laptop Elitebook 8460p - 8470p - Viền màn hình Elitebook 8460p - 8470p - Hàng chính hãng - Tên sản phẩm: Mặt B (viền màn hình) laptop Elitebook 8460p, 8470p - Tình trạng: New 100% - Sản phẩm dùng thay thế mặt B đã hư, cũ cho laptop Elitebook 8460p, 8470p - Mặt B viền màn hình có lỗ webcam (camera) sẵn. - Mặt B: là mặt viềm màn hình, lắp ghép với mặt A để giữ màn hình (thông thường nguyên 1 bộ vỏ laptop sẽ gồm 4 mặt A, B, C, D). Và sản phẩm mà shop đang bán chỉ là mặt B (viền màn hình) thôi nhé. - Mặt B Elitebook 8460p và 8470p xài chung với nhau được Giá sản phẩm trên Tiki đã bao gồm thuế theo luật hiện hành. Bên cạnh đó, tuỳ vào loại sản phẩm, hình thức và địa chỉ giao hàng mà có thể phát sinh thêm chi phí khác như phí vận chuyển, phụ phí hàng cồng kềnh, thuế nhập khẩu (đối với đơn hàng giao từ nước ngoài có giá trị trên 1 triệu đồng).....",0,0,"https://salt.tikicdn.com/ts/product/54/e7/20/73b6b5153e4ae7f5e6d3243f790c95f8.jpg, https://salt.tikicdn.com/ts/product/f1/4d/40/cf8dee5793af7793ddc3e5d906593e4b.jpg, https://salt.tikicdn.com/ts/product/a2/00/0d/9cc36eba04bcbf5b2fcd51be24861e85.jpg","https://salt.tikicdn.com/cache/w1200/ts/product/54/e7/20/73b6b5153e4ae7f5e6d3243f790c95f8.jpg, https://salt.tikicdn.com/cache/w1200/ts/product/f1/4d/40/cf8dee5793af7793ddc3e5d906593e4b.jpg, https://salt.tikicdn.com/cache/w1200/ts/product/a2/00/0d/9cc36eba04bcbf5b2fcd51be24861e85.jpg","https://salt.tikicdn.com/cache/w300/ts/product/54/e7/20/73b6b5153e4ae7f5e6d3243f790c95f8.jpg, https://salt.tikicdn.com/cache/w300/ts/product/f1/4d/40/cf8dee5793af7793ddc3e5d906593e4b.jpg, https://salt.tikicdn.com/cache/w300/ts/product/a2/00/0d/9cc36eba04bcbf5b2fcd51be24861e85.jpg","https://salt.tikicdn.com/cache/200x280/ts/product/54/e7/20/73b6b5153e4ae7f5e6d3243f790c95f8.jpg, https://salt.tikicdn.com/cache/200x280/ts/product/f1/4d/40/cf8dee5793af7793ddc3e5d906593e4b.jpg, https://salt.tikicdn.com/cache/200x280/ts/product/a2/00/0d/9cc36eba04bcbf5b2fcd51be24861e85.jpg","https://salt.tikicdn.com/cache/200x280/ts/product/54/e7/20/73b6b5153e4ae7f5e6d3243f790c95f8.jpg, https://salt.tikicdn.com/cache/200x280/ts/product/f1/4d/40/cf8dee5793af7793ddc3e5d906593e4b.jpg, https://salt.tikicdn.com/cache/200x280/ts/product/a2/00/0d/9cc36eba04bcbf5b2fcd51be24861e85.jpg",1000,0
275930387,"Vỏ máy tính laptop - Mặt B vỏ laptop latitude E7240, E7250, E7270, E7280 - Viền màn hình Latitude E7240, E7250, E7270, E7280 - Hàng chính hãng",305000,"Vỏ máy tính laptop - Mặt B vỏ laptop latitude E7240, E7250, E7270, E7280 - Viền màn hình Latitude E7240, E7250, E7270, E7280 - Hàng chính hãng- Tên sản phẩm: Mặt B (viền màn hình) laptop  latitude E...","Vỏ máy tính laptop - Mặt B vỏ laptop latitude E7240, E7250, E7270, E7280 - Viền màn hình Latitude E7240, E7250, E7270, E7280 - Hàng chính hãng - Tên sản phẩm: Mặt B (viền màn hình) laptop  latitude E7240, E7250, E7270, E7280 (quý khách vui lòng chọn trong phần phân loại) - Tình trạng: New 100% - Sản phẩm dùng thay thế mặt B đã hư, cũ cho laptop Latitude E7240, E7250, E7270, E7280 - Mặt B viền màn hình có lỗ webcam (camera) sẵn. - Mặt B: là mặt viềm màn hình, lắp ghép với mặt A để giữ màn hình (thông thường nguyên 1 bộ vỏ laptop sẽ gồm 4 mặt A, B, C, D). Và sản phẩm mà shop đang bán chỉ là mặt B (viền màn hình) thôi nhé. - Lưu ý: Mặt B của laptop không dùng chung được với nhau, nên quý khách vui lòng chọn đúng model máy của mình trong phần phân loại nhé Giá sản phẩm trên Tiki đã bao gồm thuế theo luật hiện hành. Bên cạnh đó, tuỳ vào loại sản phẩm, hình thức và địa chỉ giao hàng mà có thể phát sinh thêm chi phí khác như phí vận chuyển, phụ phí hàng cồng kềnh, thuế nhập khẩu (đối với đơn hàng giao từ nước ngoài có giá trị trên 1 triệu đồng).....",0,0,"https://salt.tikicdn.com/ts/product/f8/e4/82/f2a5b1124b6ef51db126591510d26e69.jpg, https://salt.tikicdn.com/ts/product/5b/bb/d4/a657b4f0d601a117d5b0c8218941cb09.jpg, https://salt.tikicdn.com/ts/product/4d/e9/44/805ef93f76b8ca82df86bf1616172151.jpg","https://salt.tikicdn.com/cache/w1200/ts/product/f8/e4/82/f2a5b1124b6ef51db126591510d26e69.jpg, https://salt.tikicdn.com/cache/w1200/ts/product/5b/bb/d4/a657b4f0d601a117d5b0c8218941cb09.jpg, https://salt.tikicdn.com/cache/w1200/ts/product/4d/e9/44/805ef93f76b8ca82df86bf1616172151.jpg","https://salt.tikicdn.com/cache/w300/ts/product/f8/e4/82/f2a5b1124b6ef51db126591510d26e69.jpg, https://salt.tikicdn.com/cache/w300/ts/product/5b/bb/d4/a657b4f0d601a117d5b0c8218941cb09.jpg, https://salt.tikicdn.com/cache/w300/ts/product/4d/e9/44/805ef93f76b8ca82df86bf1616172151.jpg","https://salt.tikicdn.com/cache/200x280/ts/product/f8/e4/82/f2a5b1124b6ef51db126591510d26e69.jpg, https://salt.tikicdn.com/cache/200x280/ts/product/5b/bb/d4/a657b4f0d601a117d5b0c8218941cb09.jpg, https://salt.tikicdn.com/cache/200x280/ts/product/4d/e9/44/805ef93f76b8ca82df86bf1616172151.jpg","https://salt.tikicdn.com/cache/200x280/ts/product/f8/e4/82/f2a5b1124b6ef51db126591510d26e69.jpg, https://salt.tikicdn.com/cache/200x280/ts/product/5b/bb/d4/a657b4f0d601a117d5b0c8218941cb09.jpg, https://salt.tikicdn.com/cache/200x280/ts/product/4d/e9/44/805ef93f76b8ca82df86bf1616172151.jpg",1000,0
