id,name,price,short_description,description,rating_average,review_count,image_base_url,image_large_url,image_medium_url,image_small_url,image_thumbnail_url,stock,quantity_sold
277857812,CASE MAGIC CUBI-M PRO(Full M-ATX) - Hàng chính hãng,895000,"Thông số kỹ thuật: Thương hiệu: MAGIC Màu sắc: Đen, Trắng Bảo hành: 12 tháng• Hỗ trợ Mainboard: M-ATX, mini-ITX.• Hỗ trợ lưu trữ:2 khe SSD, 1 khe HDD, không hỗ trợ ODD.Nguồn chuẩn ATX PSU dễ dàng lắp ...","Thông số kỹ thuật: Thương hiệu: MAGIC Màu sắc: Đen, Trắng Bảo hành: 12 tháng • Hỗ trợ Mainboard: M-ATX, mini-ITX. • Hỗ trợ lưu trữ: 2 khe SSD, 1 khe HDD, không hỗ trợ ODD. Nguồn chuẩn ATX PSU dễ dàng lắp đặt. • Dung lượng hỗ trợ: VGA tối đa: 400mm. Tản nhiệt CPU tối đa: 165mm. • Hỗ trợ làm mát tối ưu: Tản nhiệt nước 360mm ở mặt trên. Hỗ trợ quạt LED: 2 quạt mặt bên. 2 quạt mặt bên phía sau. 3 quạt mặt trên. 1 quạt mặt sau. 3 quạt mặt dưới. Đặc điểm nổi bật: Thiết kế sang trọng, hiện đại: Với sự kết hợp giữa kim loại cao cấp và kính cường lực, MAGIC CUBI-M PRO mang đến vẻ đẹp mạnh mẽ, phù hợp cho mọi góc setup gaming. Kích thước tối ưu: 425*280*350mm (L*W*H), đảm bảo vừa vặn và tương thích với nhiều loại bàn làm việc. MAGIC CUBI-M PRO là sự lựa chọn hoàn hảo cho game thủ và người dùng đòi hỏi hiệu năng cao. Đặt hàng ngay hôm nay để sở hữu sản phẩm chất lượng với giá tốt nhất! ——————————————————— Cam kết Hàng chính hãng Hình ảnh sản phẩm thực tế Giá cả phù hợp nhất trên thị trường Giao hàng nhanh chóng Hỗ trợ đổi hàng nhanh nhất cho khách hàng #VoCaseGaming #MAGICCUBIMPRO #VoCaseMATX #SetupGaming #VoCaseChatLuong #VoCaseDen #VoCaseTrang Giá sản phẩm trên Tiki đã bao gồm thuế theo luật hiện hành. Bên cạnh đó, tuỳ vào loại sản phẩm, hình thức và địa chỉ giao hàng mà có thể phát sinh thêm chi phí khác như phí vận chuyển, phụ phí hàng cồng kềnh, thuế nhập khẩu (đối với đơn hàng giao từ nước ngoài có giá trị trên 1 triệu đồng).....",0,0,https://salt.tikicdn.com/ts/product/ce/40/7a/1fe0253f61ba394fb691169a1631f03b.png,https://salt.tikicdn.com/cache/w1200/ts/product/ce/40/7a/1fe0253f61ba394fb691169a1631f03b.png,https://salt.tikicdn.com/cache/w300/ts/product/ce/40/7a/1fe0253f61ba394fb691169a1631f03b.png,https://salt.tikicdn.com/cache/200x280/ts/product/ce/40/7a/1fe0253f61ba394fb691169a1631f03b.png,https://salt.tikicdn.com/cache/200x280/ts/product/ce/40/7a/1fe0253f61ba394fb691169a1631f03b.png,1000,0
275928030,vỏ máy tính laptop -Mặt A vỏ laptop Latitude E7250 - Vỏ A Capo Latitude E7250 - Hàng chính hãng,575000,"vỏ máy tính laptop -Mặt A vỏ laptop Latitude E7250 - Vỏ A Capo Latitude E7250 - Hàng chính hãng- Tên sản phẩm: Mặt A Latitude E7250, mặt nắp trên cùng, mặt tiền của laptop, mặt quyết định độ xấu, đẹ...","vỏ máy tính laptop -Mặt A vỏ laptop Latitude E7250 - Vỏ A Capo Latitude E7250 - Hàng chính hãng - Tên sản phẩm: Mặt A Latitude E7250, mặt nắp trên cùng, mặt tiền của laptop, mặt quyết định độ xấu, đẹp laptop của bạn - Tình trạng: New 100% - Sản phẩm dùng thay thế mặt A đã hư, cũ cho laptop Latitude E7250 hoặc trong quá trình sử dụng, mặt A của laptop sẽ hay bị trầy xước nhiều, nứt, vỡ, bụi bám vào rất dơ và mất thẩm mỹ, đó là lúc bạn nên thay mặt A khác cho laptop để laptop được đẹp hơn. - Mặt A ko có dính kèm màn hình LCD - Mặt A: là mặt Capo trên cùng của máy (thông thường nguyên 1 bộ vỏ laptop sẽ gồm 4 mặt A, B, C, D). Và sản phẩm mà shop đang bán chỉ là mặt A thôi nhé. - Shop chỉ bán, ko bao gồm lắp đặt - Sản phẩm giống y như hình, quý khách vui lòng xem hình để hiểu rõ hơn. Lưu ý: Để lắp đặt mặt A vào laptop cần phải có kỹ thuật biết cách làm, nếu quý khách ko rành thì có thể nhờ các kỹ thuật viên hỗ trợ lắp ráp. Giá sản phẩm trên Tiki đã bao gồm thuế theo luật hiện hành. Bên cạnh đó, tuỳ vào loại sản phẩm, hình thức và địa chỉ giao hàng mà có thể phát sinh thêm chi phí khác như phí vận chuyển, phụ phí hàng cồng kềnh, thuế nhập khẩu (đối với đơn hàng giao từ nước ngoài có giá trị trên 1 triệu đồng).....",0,0,"https://salt.tikicdn.com/ts/product/a3/b5/e7/9b9de63bf1d2bae02f7425cf2c80d3fb.jpg, https://salt.tikicdn.com/ts/product/91/4d/8d/686d729eaad9e661ea686522901669e9.jpg, https://salt.tikicdn.com/ts/product/b5/3b/2b/f7809e78f5c0f6a1c594955018aba0b4.jpg, https://salt.tikicdn.com/ts/product/2a/57/95/e00e66713360d770b01e199d83b13c6b.jpg, https://salt.tikicdn.com/ts/product/d0/21/75/2da16c93971a75ac4443f63f75f359c9.jpg, https://salt.tikicdn.com/ts/product/b8/ef/21/d15d4f764de98bc8174199690b96dd72.jpg","https://salt.tikicdn.com/cache/w1200/ts/product/a3/b5/e7/9b9de63bf1d2bae02f7425cf2c80d3fb.jpg, https://salt.tikicdn.com/cache/w1200/ts/product/91/4d/8d/686d729eaad9e661ea686522901669e9.jpg, https://salt.tikicdn.com/cache/w1200/ts/product/b5/3b/2b/f7809e78f5c0f6a1c594955018aba0b4.jpg, https://salt.tikicdn.com/cache/w1200/ts/product/2a/57/95/e00e66713360d770b01e199d83b13c6b.jpg, https://salt.tikicdn.com/cache/w1200/ts/product/d0/21/75/2da16c93971a75ac4443f63f75f359c9.jpg, https://salt.tikicdn.com/cache/w1200/ts/product/b8/ef/21/d15d4f764de98bc8174199690b96dd72.jpg","https://salt.tikicdn.com/cache/w300/ts/product/a3/b5/e7/9b9de63bf1d2bae02f7425cf2c80d3fb.jpg, https://salt.tikicdn.com/cache/w300/ts/product/91/4d/8d/686d729eaad9e661ea686522901669e9.jpg, https://salt.tikicdn.com/cache/w300/ts/product/b5/3b/2b/f7809e78f5c0f6a1c594955018aba0b4.jpg, https://salt.tikicdn.com/cache/w300/ts/product/2a/57/95/e00e66713360d770b01e199d83b13c6b.jpg, https://salt.tikicdn.com/cache/w300/ts/product/d0/21/75/2da16c93971a75ac4443f63f75f359c9.jpg, https://salt.tikicdn.com/cache/w300/ts/product/b8/ef/21/d15d4f764de98bc8174199690b96dd72.jpg","https://salt.tikicdn.com/cache/200x280/ts/product/a3/b5/e7/9b9de63bf1d2bae02f7425cf2c80d3fb.jpg, https://salt.tikicdn.com/cache/200x280/ts/product/91/4d/8d/686d729eaad9e661ea686522901669e9.jpg, https://salt.tikicdn.com/cache/200x280/ts/product/b5/3b/2b/f7809e78f5c0f6a1c594955018aba0b4.jpg, https://salt.tikicdn.com/cache/200x280/ts/product/2a/57/95/e00e66713360d770b01e199d83b13c6b.jpg, https://salt.tikicdn.com/cache/200x280/ts/product/d0/21/75/2da16c93971a75ac4443f63f75f359c9.jpg, https://salt.tikicdn.com/cache/200x280/ts/product/b8/ef/21/d15d4f764de98bc8174199690b96dd72.jpg","https://salt.tikicdn.com/cache/200x280/ts/product/a3/b5/e7/9b9de63bf1d2bae02f7425cf2c80d3fb.jpg, https://salt.tikicdn.com/cache/200x280/ts/product/91/4d/8d/686d729eaad9e661ea686522901669e9.jpg, https://salt.tikicdn.com/cache/200x280/ts/product/b5/3b/2b/f7809e78f5c0f6a1c594955018aba0b4.jpg, https://salt.tikicdn.com/cache/200x280/ts/product/2a/57/95/e00e66713360d770b01e199d83b13c6b.jpg, https://salt.tikicdn.com/cache/200x280/ts/product/d0/21/75/2da16c93971a75ac4443f63f75f359c9.jpg, https://salt.tikicdn.com/cache/200x280/ts/product/b8/ef/21/d15d4f764de98bc8174199690b96dd72.jpg",1000,0
273872732,PC Case Galax Revolution 05W - HÀNG CHÍNH HÃNG,990000,"Hiện có màu trắng Bắc Cực, REV-05W là vỏ máy tính cao nhất trong dòng sản phẩm Revolution cho đến nay và tương thích với các bo mạch chủ ATX, M-ATX, ITX. Với chiều cao 470mm, nó cung cấp một không gia...","Hiện có màu trắng Bắc Cực, REV-05W là vỏ máy tính cao nhất trong dòng sản phẩm Revolution cho đến nay và tương thích với các bo mạch chủ ATX, M-ATX, ITX. Với chiều cao 470mm, nó cung cấp một không gian bên trong rộng rãi để tùy chỉnh, cho phép bạn lựa chọn giữa lắp đặt dọc hoặc ngang cho cạc đồ họa và tối đa hóa khả năng làm mát và nâng cấp. Giá sản phẩm trên Tiki đã bao gồm thuế theo luật hiện hành. Bên cạnh đó, tuỳ vào loại sản phẩm, hình thức và địa chỉ giao hàng mà có thể phát sinh thêm chi phí khác như phí vận chuyển, phụ phí hàng cồng kềnh, thuế nhập khẩu (đối với đơn hàng giao từ nước ngoài có giá trị trên 1 triệu đồng).....",0,0,https://salt.tikicdn.com/ts/product/52/8f/e8/0b64692a671b23cbf3208cf40cf7510f.png,https://salt.tikicdn.com/cache/w1200/ts/product/52/8f/e8/0b64692a671b23cbf3208cf40cf7510f.png,https://salt.tikicdn.com/cache/w300/ts/product/52/8f/e8/0b64692a671b23cbf3208cf40cf7510f.png,https://salt.tikicdn.com/cache/200x280/ts/product/52/8f/e8/0b64692a671b23cbf3208cf40cf7510f.png,https://salt.tikicdn.com/cache/200x280/ts/product/52/8f/e8/0b64692a671b23cbf3208cf40cf7510f.png,1000,0
277995292,VỎ CASE MÁY TÍNH DARKFLASH DY450 Pro (ATX) - Hàng chính hãng,3795000,"Thương hiệu: ️DARKFLASHTên sản phẩm: ️VỎ CASE MÁY TÍNH DARKFLASH DY450 Pro (ATX)Màu sắc: Đen, TrắngBảo hành: 12 thángVỎ CASE MÁY TÍNH DARKFLASH DY450 Pro (ATX)️ Loại sản phẩm: Vỏ case gaming️ Màu sắc:...","Thương hiệu: ️DARKFLASH Tên sản phẩm: ️VỎ CASE MÁY TÍNH DARKFLASH DY450 Pro (ATX) Màu sắc: Đen, Trắng Bảo hành: 12 tháng VỎ CASE MÁY TÍNH DARKFLASH DY450 Pro (ATX) ️ Loại sản phẩm: Vỏ case gaming ️ Màu sắc: Đen, Trắng ️ Kích thước case: 451*258*460mm (L*W*H) ️ Chất liệu: Kim loại/kính cường lực ️ Hỗ trợ mainboard: ATX, M-ATX, ITX ️ Hỗ trợ: 5 x SSD;5 x HDD; no ODD; ATX PSU ️ Support max VGA: 420mm ️ Support max CPU Cooler: 180mm ️ Radiator Support: Side：360mm280mm ️ Hỗ trợ Fan LED: Side：120mm*3/140mm*3, Rear：120mm*1/140mm*1, Bottom：120mm*3/140mm*3 Giá sản phẩm trên Tiki đã bao gồm thuế theo luật hiện hành. Bên cạnh đó, tuỳ vào loại sản phẩm, hình thức và địa chỉ giao hàng mà có thể phát sinh thêm chi phí khác như phí vận chuyển, phụ phí hàng cồng kềnh, thuế nhập khẩu (đối với đơn hàng giao từ nước ngoài có giá trị trên 1 triệu đồng).....",0,0,"https://salt.tikicdn.com/ts/product/0c/cd/78/cfafad2d5b29d04071138db60914de68.png, https://salt.tikicdn.com/ts/product/20/f4/62/3214637ab28b744c48f5c3fd07c28e95.png, https://salt.tikicdn.com/ts/product/1a/b6/a3/ef460d46e3eff3d331abdd678fc8125d.png, https://salt.tikicdn.com/ts/product/f2/df/70/955e7ac9fb624af6d2afc619b60e0801.png, https://salt.tikicdn.com/ts/product/b2/a9/43/53310f66e5c3df9e8697cbce67d09cfe.png, https://salt.tikicdn.com/ts/product/04/b6/3a/eac28ddd7d57706c0e367d3818d11e0f.png, https://salt.tikicdn.com/ts/product/e0/5f/71/d6cd386b5dee97ff88680e596cc013f0.png, https://salt.tikicdn.com/ts/product/9e/4e/4e/49e04240bcacfceb5d90ecfbed1d3de1.png, https://salt.tikicdn.com/ts/product/5e/08/f9/29052c038e4ff1e726283d7cf5d67202.png, https://salt.tikicdn.com/ts/product/4f/19/b0/048689fd3c973630bec40fea962a2d5c.png","https://salt.tikicdn.com/cache/w1200/ts/product/0c/cd/78/cfafad2d5b29d04071138db60914de68.png, https://salt.tikicdn.com/cache/w1200/ts/product/20/f4/62/3214637ab28b744c48f5c3fd07c28e95.png, https://salt.tikicdn.com/cache/w1200/ts/product/1a/b6/a3/ef460d46e3eff3d331abdd678fc8125d.png, https://salt.tikicdn.com/cache/w1200/ts/product/f2/df/70/955e7ac9fb624af6d2afc619b60e0801.png, https://salt.tikicdn.com/cache/w1200/ts/product/b2/a9/43/53310f66e5c3df9e8697cbce67d09cfe.png, https://salt.tikicdn.com/cache/w1200/ts/product/04/b6/3a/eac28ddd7d57706c0e367d3818d11e0f.png, https://salt.tikicdn.com/cache/w1200/ts/product/e0/5f/71/d6cd386b5dee97ff88680e596cc013f0.png, https://salt.tikicdn.com/cache/w1200/ts/product/9e/4e/4e/49e04240bcacfceb5d90ecfbed1d3de1.png, https://salt.tikicdn.com/cache/w1200/ts/product/5e/08/f9/29052c038e4ff1e726283d7cf5d67202.png, https://salt.tikicdn.com/cache/w1200/ts/product/4f/19/b0/048689fd3c973630bec40fea962a2d5c.png","https://salt.tikicdn.com/cache/w300/ts/product/0c/cd/78/cfafad2d5b29d04071138db60914de68.png, https://salt.tikicdn.com/cache/w300/ts/product/20/f4/62/3214637ab28b744c48f5c3fd07c28e95.png, https://salt.tikicdn.com/cache/w300/ts/product/1a/b6/a3/ef460d46e3eff3d331abdd678fc8125d.png, https://salt.tikicdn.com/cache/w300/ts/product/f2/df/70/955e7ac9fb624af6d2afc619b60e0801.png, https://salt.tikicdn.com/cache/w300/ts/product/b2/a9/43/53310f66e5c3df9e8697cbce67d09cfe.png, https://salt.tikicdn.com/cache/w300/ts/product/04/b6/3a/eac28ddd7d57706c0e367d3818d11e0f.png, https://salt.tikicdn.com/cache/w300/ts/product/e0/5f/71/d6cd386b5dee97ff88680e596cc013f0.png, https://salt.tikicdn.com/cache/w300/ts/product/9e/4e/4e/49e04240bcacfceb5d90ecfbed1d3de1.png, https://salt.tikicdn.com/cache/w300/ts/product/5e/08/f9/29052c038e4ff1e726283d7cf5d67202.png, https://salt.tikicdn.com/cache/w300/ts/product/4f/19/b0/048689fd3c973630bec40fea962a2d5c.png","https://salt.tikicdn.com/cache/200x280/ts/product/0c/cd/78/cfafad2d5b29d04071138db60914de68.png, https://salt.tikicdn.com/cache/200x280/ts/product/20/f4/62/3214637ab28b744c48f5c3fd07c28e95.png, https://salt.tikicdn.com/cache/200x280/ts/product/1a/b6/a3/ef460d46e3eff3d331abdd678fc8125d.png, https://salt.tikicdn.com/cache/200x280/ts/product/f2/df/70/955e7ac9fb624af6d2afc619b60e0801.png, https://salt.tikicdn.com/cache/200x280/ts/product/b2/a9/43/53310f66e5c3df9e8697cbce67d09cfe.png, https://salt.tikicdn.com/cache/200x280/ts/product/04/b6/3a/eac28ddd7d57706c0e367d3818d11e0f.png, https://salt.tikicdn.com/cache/200x280/ts/product/e0/5f/71/d6cd386b5dee97ff88680e596cc013f0.png, https://salt.tikicdn.com/cache/200x280/ts/product/9e/4e/4e/49e04240bcacfceb5d90ecfbed1d3de1.png, https://salt.tikicdn.com/cache/200x280/ts/product/5e/08/f9/29052c038e4ff1e726283d7cf5d67202.png, https://salt.tikicdn.com/cache/200x280/ts/product/4f/19/b0/048689fd3c973630bec40fea962a2d5c.png","https://salt.tikicdn.com/cache/200x280/ts/product/0c/cd/78/cfafad2d5b29d04071138db60914de68.png, https://salt.tikicdn.com/cache/200x280/ts/product/20/f4/62/3214637ab28b744c48f5c3fd07c28e95.png, https://salt.tikicdn.com/cache/200x280/ts/product/1a/b6/a3/ef460d46e3eff3d331abdd678fc8125d.png, https://salt.tikicdn.com/cache/200x280/ts/product/f2/df/70/955e7ac9fb624af6d2afc619b60e0801.png, https://salt.tikicdn.com/cache/200x280/ts/product/b2/a9/43/53310f66e5c3df9e8697cbce67d09cfe.png, https://salt.tikicdn.com/cache/200x280/ts/product/04/b6/3a/eac28ddd7d57706c0e367d3818d11e0f.png, https://salt.tikicdn.com/cache/200x280/ts/product/e0/5f/71/d6cd386b5dee97ff88680e596cc013f0.png, https://salt.tikicdn.com/cache/200x280/ts/product/9e/4e/4e/49e04240bcacfceb5d90ecfbed1d3de1.png, https://salt.tikicdn.com/cache/200x280/ts/product/5e/08/f9/29052c038e4ff1e726283d7cf5d67202.png, https://salt.tikicdn.com/cache/200x280/ts/product/4f/19/b0/048689fd3c973630bec40fea962a2d5c.png",1000,0
