id,name,price,short_description,description,rating_average,review_count,image_base_url,image_large_url,image_medium_url,image_small_url,image_thumbnail_url,stock,quantity_sold
191975880,USB 3.2 Gen 1 Acer UP300 dung lượng USB 8GB - 1TB - Hàng chính hãng ,470000,"CHẤT LƯỢNG CAO CẤPĐược xây dựng với bộ điều khiển chính cao cấp và các vi mạch chất lượng cao, ổ đĩa flash USB Acer UP300 đạt được tốc độ đọc lên đến 120 MB / s. Tốc độ ấn tượng (và một loạt các kiểu...","CHẤT LƯỢNG CAO CẤP Được xây dựng với bộ điều khiển chính cao cấp và các vi mạch chất lượng cao, ổ đĩa flash USB Acer UP300 đạt được tốc độ đọc lên đến 120 MB / s. Tốc độ ấn tượng (và một loạt các kiểu máy dung lượng cao) khiến chiếc USB này trở thành lựa chọn ưu tiên để lưu trữ di động, đặc biệt là đối với các tệp đa phương tiện lớn hơn. USB 3.2 GEN 1 CHO TƯƠNG THÍCH RỘNG RÃI Với giao diện USB 3.2 Gen 1, USB Acer UP300 tương thích với máy tính, máy tính bảng, điện thoại di động, thiết bị âm thanh, TV thông minh và âm thanh trên xe hơi. Ngoài ra, USB Acer UP300 hỗ trợ hệ điều hành Windows và Mac. TRỌNG LƯỢNG SIÊU NHẸ VÀ PHONG CÁCH NHỎ GỌN Được làm bằng ABS để có trọng lượng nhẹ hơn và kết cấu thoải mái, thiết kế của USB Acer UP300 có các sọc lồi lõm (để phân biệt mặt trước của USB với mặt đối diện). Có các màu trắng, đen và xanh lá. DUNG LƯỢNG LỚN CHO TẤT CẢ Với nhiều mức dung lượng từ 8 GB đến 1 TB, USB Acer UP300 có thể lưu trữ nhiều tệp tin khác nhau tùy ý. Bạn có thể lựa chọn công suất phù hợp nhất với nhu cầu của mình. LÀM CHỦ THẾ GIỚI SỐ CỦA BẠN USB Acer UP300 với giao diện USB 3.2 Gen 1 hỗ trợ plug-and-play mà không cần bất kỳ trình điều khiển hoặc nguồn điện nào và đọc dễ dàng với tốc độ cao. Đây là chiếc USB hoàn hảo để chia sẻ hoặc lưu trữ công việc, cuộc vui hay học tập của bạn. Thiết kế cung cấp một chìa khóa để tạo sự tiện lợi. CHẤT LƯỢNG ĐƯỢC KIỂM TRA VÀ HỖ TRỢ BỞI CÁC CHUYÊN GIA Ổ đĩa flash USB UP300 của Acer vượt qua 33 bài kiểm tra chất lượng trước khi đến tay khách hàng. Thử nghiệm đặc biệt nghiêm ngặt này đảm bảo cho khác hàng rằng UP300 sẵn sàng xử lý dữ liệu của bạn một cách đáng tin cậy và an toàn. Được chế tạo với độ bền đặc biệt, UP300 đi kèm với bảo hành có giới hạn 5 năm cũng như dịch vụ miễn phí. Acer UP300 Ổ đĩa flash USB 3.2 Gen 1 thế hệ mới Một giải pháp lưu trữ di động thiết yếu với hiệu suất SuperSpeed ​​và dung lượng cao Tốc độ đọc lên đến 120 MB / s Bộ điều khiển và IC cao cấp Lựa chọn ba màu Giá sản phẩm trên Tiki đã bao gồm thuế theo luật hiện hành. Bên cạnh đó, tuỳ vào loại sản phẩm, hình thức và địa chỉ giao hàng mà có thể phát sinh thêm chi phí khác như phí vận chuyển, phụ phí hàng cồng kềnh, thuế nhập khẩu (đối với đơn hàng giao từ nước ngoài có giá trị trên 1 triệu đồng).....",4.6,154,"https://salt.tikicdn.com/ts/product/9d/98/86/d055a78cd317d70f31a6da0a680c6153.jpg, https://salt.tikicdn.com/ts/product/4a/e9/77/4dabd10f3d105ffed00698c0266e4737.jpg, https://salt.tikicdn.com/ts/product/f0/07/f8/4bda2dc725a00f187001811f978d3a47.jpg, https://salt.tikicdn.com/ts/product/69/be/94/07022d9a6fa3f768a1a3b45abef446bb.jpg, https://salt.tikicdn.com/ts/product/79/bb/0d/427d93692e586b83ea15f1ca2a628a84.jpg, https://salt.tikicdn.com/ts/product/0b/37/27/b33c84e30a0483c1f5ebbe27b752b2a1.jpg, https://salt.tikicdn.com/ts/product/bf/05/6b/253ec200623f59e38fbc3e58e9774517.jpg, https://salt.tikicdn.com/ts/product/f3/c4/e0/8a82b7f338e31da54f3d22665044ba56.jpg","https://salt.tikicdn.com/cache/w1200/ts/product/9d/98/86/d055a78cd317d70f31a6da0a680c6153.jpg, https://salt.tikicdn.com/cache/w1200/ts/product/4a/e9/77/4dabd10f3d105ffed00698c0266e4737.jpg, https://salt.tikicdn.com/cache/w1200/ts/product/f0/07/f8/4bda2dc725a00f187001811f978d3a47.jpg, https://salt.tikicdn.com/cache/w1200/ts/product/69/be/94/07022d9a6fa3f768a1a3b45abef446bb.jpg, https://salt.tikicdn.com/cache/w1200/ts/product/79/bb/0d/427d93692e586b83ea15f1ca2a628a84.jpg, https://salt.tikicdn.com/cache/w1200/ts/product/0b/37/27/b33c84e30a0483c1f5ebbe27b752b2a1.jpg, https://salt.tikicdn.com/cache/w1200/ts/product/bf/05/6b/253ec200623f59e38fbc3e58e9774517.jpg, https://salt.tikicdn.com/cache/w1200/ts/product/f3/c4/e0/8a82b7f338e31da54f3d22665044ba56.jpg","https://salt.tikicdn.com/cache/w300/ts/product/9d/98/86/d055a78cd317d70f31a6da0a680c6153.jpg, https://salt.tikicdn.com/cache/w300/ts/product/4a/e9/77/4dabd10f3d105ffed00698c0266e4737.jpg, https://salt.tikicdn.com/cache/w300/ts/product/f0/07/f8/4bda2dc725a00f187001811f978d3a47.jpg, https://salt.tikicdn.com/cache/w300/ts/product/69/be/94/07022d9a6fa3f768a1a3b45abef446bb.jpg, https://salt.tikicdn.com/cache/w300/ts/product/79/bb/0d/427d93692e586b83ea15f1ca2a628a84.jpg, https://salt.tikicdn.com/cache/w300/ts/product/0b/37/27/b33c84e30a0483c1f5ebbe27b752b2a1.jpg, https://salt.tikicdn.com/cache/w300/ts/product/bf/05/6b/253ec200623f59e38fbc3e58e9774517.jpg, https://salt.tikicdn.com/cache/w300/ts/product/f3/c4/e0/8a82b7f338e31da54f3d22665044ba56.jpg","https://salt.tikicdn.com/cache/200x280/ts/product/9d/98/86/d055a78cd317d70f31a6da0a680c6153.jpg, https://salt.tikicdn.com/cache/200x280/ts/product/4a/e9/77/4dabd10f3d105ffed00698c0266e4737.jpg, https://salt.tikicdn.com/cache/200x280/ts/product/f0/07/f8/4bda2dc725a00f187001811f978d3a47.jpg, https://salt.tikicdn.com/cache/200x280/ts/product/69/be/94/07022d9a6fa3f768a1a3b45abef446bb.jpg, https://salt.tikicdn.com/cache/200x280/ts/product/79/bb/0d/427d93692e586b83ea15f1ca2a628a84.jpg, https://salt.tikicdn.com/cache/200x280/ts/product/0b/37/27/b33c84e30a0483c1f5ebbe27b752b2a1.jpg, https://salt.tikicdn.com/cache/200x280/ts/product/bf/05/6b/253ec200623f59e38fbc3e58e9774517.jpg, https://salt.tikicdn.com/cache/200x280/ts/product/f3/c4/e0/8a82b7f338e31da54f3d22665044ba56.jpg","https://salt.tikicdn.com/cache/200x280/ts/product/9d/98/86/d055a78cd317d70f31a6da0a680c6153.jpg, https://salt.tikicdn.com/cache/200x280/ts/product/4a/e9/77/4dabd10f3d105ffed00698c0266e4737.jpg, https://salt.tikicdn.com/cache/200x280/ts/product/f0/07/f8/4bda2dc725a00f187001811f978d3a47.jpg, https://salt.tikicdn.com/cache/200x280/ts/product/69/be/94/07022d9a6fa3f768a1a3b45abef446bb.jpg, https://salt.tikicdn.com/cache/200x280/ts/product/79/bb/0d/427d93692e586b83ea15f1ca2a628a84.jpg, https://salt.tikicdn.com/cache/200x280/ts/product/0b/37/27/b33c84e30a0483c1f5ebbe27b752b2a1.jpg, https://salt.tikicdn.com/cache/200x280/ts/product/bf/05/6b/253ec200623f59e38fbc3e58e9774517.jpg, https://salt.tikicdn.com/cache/200x280/ts/product/f3/c4/e0/8a82b7f338e31da54f3d22665044ba56.jpg",1000,154
189460846,USB Acer UP300 tốc độ đọc/ghi lên đến 120 MB/s - Hàng chính hãng bảo hành 5 năm - Thiết bị lưu trữ dung lượng 8GB - 1TB,470000,"CHẤT LƯỢNG CAO CẤPĐược xây dựng với bộ điều khiển chính cao cấp và các vi mạch chất lượng cao, ổ đĩa flash USB Acer UP300 đạt được tốc độ đọc lên đến 120 MB / s. Tốc độ ấn tượng (và một loạt các kiểu...","CHẤT LƯỢNG CAO CẤP Được xây dựng với bộ điều khiển chính cao cấp và các vi mạch chất lượng cao, ổ đĩa flash USB Acer UP300 đạt được tốc độ đọc lên đến 120 MB / s. Tốc độ ấn tượng (và một loạt các kiểu máy dung lượng cao) khiến chiếc USB này trở thành lựa chọn ưu tiên để lưu trữ di động, đặc biệt là đối với các tệp đa phương tiện lớn hơn. USB 3.2 GEN 1 CHO TƯƠNG THÍCH RỘNG RÃI Với giao diện USB 3.2 Gen 1, USB Acer UP300 tương thích với máy tính, máy tính bảng, điện thoại di động, thiết bị âm thanh, TV thông minh và âm thanh trên xe hơi. Ngoài ra, USB Acer UP300 hỗ trợ hệ điều hành Windows và Mac. TRỌNG LƯỢNG SIÊU NHẸ VÀ PHONG CÁCH NHỎ GỌN Được làm bằng ABS để có trọng lượng nhẹ hơn và kết cấu thoải mái, thiết kế của USB Acer UP300 có các sọc lồi lõm (để phân biệt mặt trước của USB với mặt đối diện). Có các màu trắng, đen và xanh lá. DUNG LƯỢNG LỚN CHO TẤT CẢ Với nhiều mức dung lượng từ 8 GB đến 1 TB, USB Acer UP300 có thể lưu trữ nhiều tệp tin khác nhau tùy ý. Bạn có thể lựa chọn công suất phù hợp nhất với nhu cầu của mình. LÀM CHỦ THẾ GIỚI SỐ CỦA BẠN USB Acer UP300 với giao diện USB 3.2 Gen 1 hỗ trợ plug-and-play mà không cần bất kỳ trình điều khiển hoặc nguồn điện nào và đọc dễ dàng với tốc độ cao. Đây là chiếc USB hoàn hảo để chia sẻ hoặc lưu trữ công việc, cuộc vui hay học tập của bạn. Thiết kế cung cấp một chìa khóa để tạo sự tiện lợi. CHẤT LƯỢNG ĐƯỢC KIỂM TRA VÀ HỖ TRỢ BỞI CÁC CHUYÊN GIA Ổ đĩa flash USB UP300 của Acer vượt qua 33 bài kiểm tra chất lượng trước khi đến tay khách hàng. Thử nghiệm đặc biệt nghiêm ngặt này đảm bảo cho khác hàng rằng UP300 sẵn sàng xử lý dữ liệu của bạn một cách đáng tin cậy và an toàn. Được chế tạo với độ bền đặc biệt, UP300 đi kèm với bảo hành có giới hạn 5 năm cũng như dịch vụ miễn phí. Giá sản phẩm trên Tiki đã bao gồm thuế theo luật hiện hành. Bên cạnh đó, tuỳ vào loại sản phẩm, hình thức và địa chỉ giao hàng mà có thể phát sinh thêm chi phí khác như phí vận chuyển, phụ phí hàng cồng kềnh, thuế nhập khẩu (đối với đơn hàng giao từ nước ngoài có giá trị trên 1 triệu đồng).....",4.5,11,https://salt.tikicdn.com/ts/product/9c/0f/0a/49d078b3b1f4c910b9827383a58e2934.jpg,https://salt.tikicdn.com/cache/w1200/ts/product/9c/0f/0a/49d078b3b1f4c910b9827383a58e2934.jpg,https://salt.tikicdn.com/cache/w300/ts/product/9c/0f/0a/49d078b3b1f4c910b9827383a58e2934.jpg,https://salt.tikicdn.com/cache/200x280/ts/product/9c/0f/0a/49d078b3b1f4c910b9827383a58e2934.jpg,https://salt.tikicdn.com/cache/200x280/ts/product/9c/0f/0a/49d078b3b1f4c910b9827383a58e2934.jpg,1000,11
188040084,USB Kingston DataTraveler Exodia M USB Flash Drive 32G / 64G / 128G / 256G - Hàng Chính Hãng,365000,"USB Kingston DataTraveler Exodia M USB Flash Drivevới nắp di chuyển nhiều màuKingston DataTraveler Exodia  M có hiệu năng USB 3.2 Thế hệ 1 để dễ dàng truy cập vào máy tính xách tay, PC để bàn, màn h...","USB Kingston DataTraveler Exodia M USB Flash Drive với nắp di chuyển nhiều màu Kingston DataTraveler Exodia  M có hiệu năng USB 3.2 Thế hệ 1 để dễ dàng truy cập vào máy tính xách tay, PC để bàn, màn hình và các thiết bị kỹ thuật số khác. DT Exodia M cho phép chuyển nhanh chóng và lưu trữ thuận tiện tài liệu, nhạc, video và hơn thế nữa. Nó có sẵn trong nhiều tùy chọn màu sắc thời trang tương ứng với dung lượng lên đến 256GB . Thiết kế thực tế của nó làm cho nó trở thành một giải pháp lưu trữ lý tưởng khi di chuyển cho dù ở cơ quan, nhà riêng hay trường học. DT Exodia M được bảo hành năm năm, hỗ trợ kỹ thuật miễn phí và độ tin cậy huyền thoại của Kingston. * Thiết kế nắp di chuyển bảo vệ đầu nối USB * Nhiều lựa chọn màu sắc theo dung lượng * Vòng lặp dễ dàng gắn vào các vòng chìa khóa Các tính năng chính Thiết kế chức năng Thiết kế nắp di chuyển bảo vệ đầu nối USB và dữ liệu của bạn khi không sử dụng. Thuận tiện trong tầm tay của bạn Giải pháp lưu trữ tương thích USB 3.2 Thế hệ 1 nhẹ giúp truyền tệp nhanh chóng. Tính di động cao nhất Phạm vi công suất với nắp nhiều màu sắc và một vòng lặp dễ dàng gắn vào các vòng chìa khóa. Thông số kỹ thuật Dung lượng 32GB, 64GB, 128GB, 256GB Tốc độ USB 3.2 Gen 1 Kích thước 67,4mm x 21,8mm x 11,6mm Trọng lượng 10g Nhiệt độ hoạt động 0 ° C ~ 60 ° C Nhiệt độ bảo quản -20 ° C ~ 85 ° C Sự bảo đảm Bảo hành 5 năm, hỗ trợ kỹ thuật miễn phí Tương thích với Windows 11, 10, 8.1, macOS (v.10.14.x +), Linux (v. 2.6.x +), Chrome OS Giá sản phẩm trên Tiki đã bao gồm thuế theo luật hiện hành. Bên cạnh đó, tuỳ vào loại sản phẩm, hình thức và địa chỉ giao hàng mà có thể phát sinh thêm chi phí khác như phí vận chuyển, phụ phí hàng cồng kềnh, thuế nhập khẩu (đối với đơn hàng giao từ nước ngoài có giá trị trên 1 triệu đồng).....",4.6,32,"https://salt.tikicdn.com/ts/product/e5/8f/f0/b1387e8ba101d700c69c1ba82ce1dec7.png, https://salt.tikicdn.com/ts/product/c5/6f/e4/60476db11bd606d960015687dfc01e29.png, https://salt.tikicdn.com/ts/product/ab/87/46/a04b0ba3edfd62e3f2c0295582ccaf9d.jpg, https://salt.tikicdn.com/ts/product/6d/03/00/bf094f54cfa176758362491d71067519.jpg","https://salt.tikicdn.com/cache/w1200/ts/product/e5/8f/f0/b1387e8ba101d700c69c1ba82ce1dec7.png, https://salt.tikicdn.com/cache/w1200/ts/product/c5/6f/e4/60476db11bd606d960015687dfc01e29.png, https://salt.tikicdn.com/cache/w1200/ts/product/ab/87/46/a04b0ba3edfd62e3f2c0295582ccaf9d.jpg, https://salt.tikicdn.com/cache/w1200/ts/product/6d/03/00/bf094f54cfa176758362491d71067519.jpg","https://salt.tikicdn.com/cache/w300/ts/product/e5/8f/f0/b1387e8ba101d700c69c1ba82ce1dec7.png, https://salt.tikicdn.com/cache/w300/ts/product/c5/6f/e4/60476db11bd606d960015687dfc01e29.png, https://salt.tikicdn.com/cache/w300/ts/product/ab/87/46/a04b0ba3edfd62e3f2c0295582ccaf9d.jpg, https://salt.tikicdn.com/cache/w300/ts/product/6d/03/00/bf094f54cfa176758362491d71067519.jpg","https://salt.tikicdn.com/cache/200x280/ts/product/e5/8f/f0/b1387e8ba101d700c69c1ba82ce1dec7.png, https://salt.tikicdn.com/cache/200x280/ts/product/c5/6f/e4/60476db11bd606d960015687dfc01e29.png, https://salt.tikicdn.com/cache/200x280/ts/product/ab/87/46/a04b0ba3edfd62e3f2c0295582ccaf9d.jpg, https://salt.tikicdn.com/cache/200x280/ts/product/6d/03/00/bf094f54cfa176758362491d71067519.jpg","https://salt.tikicdn.com/cache/200x280/ts/product/e5/8f/f0/b1387e8ba101d700c69c1ba82ce1dec7.png, https://salt.tikicdn.com/cache/200x280/ts/product/c5/6f/e4/60476db11bd606d960015687dfc01e29.png, https://salt.tikicdn.com/cache/200x280/ts/product/ab/87/46/a04b0ba3edfd62e3f2c0295582ccaf9d.jpg, https://salt.tikicdn.com/cache/200x280/ts/product/6d/03/00/bf094f54cfa176758362491d71067519.jpg",1000,32
174029994,USB Kingston 64GB DataTraveler Exodia(DTX/64GB) - Hàng chính hãng,235000,USB Kingston 32GB DataTraveler Exodia(DTX/64GB)- Thương hiệu: Kingston- Dung lượng: 64GB- Chuẩn giao tiếp: USB 3.2- Tốc độ đọc: ~100MB/s- Tốc độ ghi: ~10MB/s- Bảo hành: 60 tháng- Xuất xứ: Chín...,"USB Kingston 32GB DataTraveler Exodia(DTX/64GB) - Thương hiệu: Kingston - Dung lượng: 64GB - Chuẩn giao tiếp: USB 3.2 - Tốc độ đọc: ~100MB/s - Tốc độ ghi: ~10MB/s - Bảo hành: 60 tháng - Xuất xứ: Chính hãng Ổ USB Flash DataTraveler Exodia với nắp bảo vệ và móc khóa nhiều màu sắc DataTraveler Exodia của Kingston là giải pháp lưu trữ tương thích với USB 3.2 Gen 1 dành cho máy tính xách tay, máy tính để bàn, màn hình và các thiết bị kỹ thuật số khác. DT Exodia cho phép truyền nhanh và lưu trữ tiện lợi tài liệu, nhạc, video và nhiều hơn nữa. Thiết kế tiện lợi và màu sắc thời trang lý tưởng để sử dụng hàng ngày tại nơi làm việc, ở nhà, trường học hay bất cứ đâu bạn cần mang theo dữ liệu bên mình DT Exodia có nhiều mức dung lượng lên đến 256GB 1 và được bảo hành năm năm, hỗ trợ kỹ thuật miễn phí và được đảm bảo bởi độ tin cậy nổi tiếng của Kingston. Tiện lợi khi di chuyển Nhiều mức dung lượng với vòng đeo đầy màu sắc dễ dàng gắn vào móc khóa Nhanh chóng và tiện lợi Giải pháp lưu trữ tương thích USB 3.2 Gen 1 thật gọn nhẹ để bạn dễ dàng mang theo bên mình. Giá sản phẩm trên Tiki đã bao gồm thuế theo luật hiện hành. Bên cạnh đó, tuỳ vào loại sản phẩm, hình thức và địa chỉ giao hàng mà có thể phát sinh thêm chi phí khác như phí vận chuyển, phụ phí hàng cồng kềnh, thuế nhập khẩu (đối với đơn hàng giao từ nước ngoài có giá trị trên 1 triệu đồng).....",4.8,12,"https://salt.tikicdn.com/ts/product/47/d2/fe/e6a16c1802b857d1e8173c7f66e7daf7.png, https://salt.tikicdn.com/ts/product/3d/05/7a/a5950690c1821f3606071253c6d3c534.jpg, https://salt.tikicdn.com/ts/product/56/ed/92/860e16028da424247d4342e906083305.jpg","https://salt.tikicdn.com/cache/w1200/ts/product/47/d2/fe/e6a16c1802b857d1e8173c7f66e7daf7.png, https://salt.tikicdn.com/cache/w1200/ts/product/3d/05/7a/a5950690c1821f3606071253c6d3c534.jpg, https://salt.tikicdn.com/cache/w1200/ts/product/56/ed/92/860e16028da424247d4342e906083305.jpg","https://salt.tikicdn.com/cache/w300/ts/product/47/d2/fe/e6a16c1802b857d1e8173c7f66e7daf7.png, https://salt.tikicdn.com/cache/w300/ts/product/3d/05/7a/a5950690c1821f3606071253c6d3c534.jpg, https://salt.tikicdn.com/cache/w300/ts/product/56/ed/92/860e16028da424247d4342e906083305.jpg","https://salt.tikicdn.com/cache/200x280/ts/product/47/d2/fe/e6a16c1802b857d1e8173c7f66e7daf7.png, https://salt.tikicdn.com/cache/200x280/ts/product/3d/05/7a/a5950690c1821f3606071253c6d3c534.jpg, https://salt.tikicdn.com/cache/200x280/ts/product/56/ed/92/860e16028da424247d4342e906083305.jpg","https://salt.tikicdn.com/cache/200x280/ts/product/47/d2/fe/e6a16c1802b857d1e8173c7f66e7daf7.png, https://salt.tikicdn.com/cache/200x280/ts/product/3d/05/7a/a5950690c1821f3606071253c6d3c534.jpg, https://salt.tikicdn.com/cache/200x280/ts/product/56/ed/92/860e16028da424247d4342e906083305.jpg",1000,12
143714177,USB 128GB Kingston DTX- Hàng chính hãng,364000,"  THÔNG SỐ KỸ THUẬT Dung lượng128GBGiao tiếpUSB 3.2 Gen 1Hệ điều hành hỗ trợWindows 10, 8.1, 8, Mac OS (v.10.10.x +), Linux (v. 2.6.x +), Chrome OSKích thước67,3mm x 21,...","THÔNG SỐ KỸ THUẬT Dung lượng 128GB Giao tiếp USB 3.2 Gen 1 Hệ điều hành hỗ trợ Windows 10, 8.1, 8, Mac OS (v.10.10.x +), Linux (v. 2.6.x +), Chrome OS Kích thước 67,3mm x 21,04mm x 10,14mm Khối lượng 11g Bảo hành 12 tháng MÔ TẢ TÍNH NĂNG DataTraveler Exodia của Kingston trang bị hiệu năng USB 3.2 Gen 1 để dễ dàng truy cập máy tính xách tay, máy tính để bàn, màn hình và các thiết bị kỹ thuật số khác. DT Exodia cho phép truyền nhanh và lưu trữ tiện lợi tài liệu, nhạc, video và nhiều hơn nữa. USB 128GB Kingston DTX thiết kế tiện lợi và màu sắc thời trang lý tưởng để sử dụng hàng ngày tại nơi làm việc, ở nhà, trường học hay bất cứ đâu bạn cần mang theo dữ liệu bên mình DT Exodia có nhiều mức dung lượng lên đến 128GB và được bảo hành 01 năm và được đảm bảo bởi độ tin cậy nổi tiếng của Kingston. ***LƯU Ý : Vỏ hộp được khui ra để dán tem bảo hành trên sản phẩm . Giá sản phẩm trên Tiki đã bao gồm thuế theo luật hiện hành. Bên cạnh đó, tuỳ vào loại sản phẩm, hình thức và địa chỉ giao hàng mà có thể phát sinh thêm chi phí khác như phí vận chuyển, phụ phí hàng cồng kềnh, thuế nhập khẩu (đối với đơn hàng giao từ nước ngoài có giá trị trên 1 triệu đồng).....",4.8,41,"https://salt.tikicdn.com/ts/product/67/a1/f6/528bd061a18f40d7676e72b2387592b3.PNG, https://salt.tikicdn.com/ts/product/53/aa/ed/365c3407537c84b19dac9809e3e7f3c1.jpg, https://salt.tikicdn.com/ts/product/7b/0e/dc/72de7bcb17f0768eee894314e5a6b8f3.PNG","https://salt.tikicdn.com/cache/w1200/ts/product/67/a1/f6/528bd061a18f40d7676e72b2387592b3.PNG, https://salt.tikicdn.com/cache/w1200/ts/product/53/aa/ed/365c3407537c84b19dac9809e3e7f3c1.jpg, https://salt.tikicdn.com/cache/w1200/ts/product/7b/0e/dc/72de7bcb17f0768eee894314e5a6b8f3.PNG","https://salt.tikicdn.com/cache/w300/ts/product/67/a1/f6/528bd061a18f40d7676e72b2387592b3.PNG, https://salt.tikicdn.com/cache/w300/ts/product/53/aa/ed/365c3407537c84b19dac9809e3e7f3c1.jpg, https://salt.tikicdn.com/cache/w300/ts/product/7b/0e/dc/72de7bcb17f0768eee894314e5a6b8f3.PNG","https://salt.tikicdn.com/cache/200x280/ts/product/67/a1/f6/528bd061a18f40d7676e72b2387592b3.PNG, https://salt.tikicdn.com/cache/200x280/ts/product/53/aa/ed/365c3407537c84b19dac9809e3e7f3c1.jpg, https://salt.tikicdn.com/cache/200x280/ts/product/7b/0e/dc/72de7bcb17f0768eee894314e5a6b8f3.PNG","https://salt.tikicdn.com/cache/200x280/ts/product/67/a1/f6/528bd061a18f40d7676e72b2387592b3.PNG, https://salt.tikicdn.com/cache/200x280/ts/product/53/aa/ed/365c3407537c84b19dac9809e3e7f3c1.jpg, https://salt.tikicdn.com/cache/200x280/ts/product/7b/0e/dc/72de7bcb17f0768eee894314e5a6b8f3.PNG",1000,41
143714075,USB 64GB Kingston DTX- Hàng chính hãng,234000,Dung lượng: 64GBGiao tiếp: USB 3.2 Gen 1USB 64GB Kingston DTX là USB nhỏ gọn tốc độ cao có thể dễ dàng mang theo bên người. Sản phẩm với nhiều mức dung lượng với vòng đeo đầy màu sắc dễ dàng gắn vào...,"Dung lượng: 64GB Giao tiếp: USB 3.2 Gen 1 USB 64GB Kingston DTX là USB nhỏ gọn tốc độ cao có thể dễ dàng mang theo bên người. Sản phẩm với nhiều mức dung lượng với vòng đeo đầy màu sắc dễ dàng gắn vào móc khóa. USB 32GB Kingston DTX trang bị hiệu năng USB 3.2 Gen 1 để dễ dàng truy cập máy tính xách tay, máy tính để bàn, màn hình và các thiết bị kỹ thuật số khác. DT Exodia cho phép truyền nhanh và lưu trữ tiện lợi tài liệu, nhạc, video và nhiều hơn nữa. Thiết kế tiện lợi và màu sắc thời trang lý tưởng để sử dụng hàng ngày tại nơi làm việc, ở nhà, trường học hay bất cứ đâu bạn cần mang theo dữ liệu bên mình. Giá sản phẩm trên Tiki đã bao gồm thuế theo luật hiện hành. Bên cạnh đó, tuỳ vào loại sản phẩm, hình thức và địa chỉ giao hàng mà có thể phát sinh thêm chi phí khác như phí vận chuyển, phụ phí hàng cồng kềnh, thuế nhập khẩu (đối với đơn hàng giao từ nước ngoài có giá trị trên 1 triệu đồng).....",4.2,6,"https://salt.tikicdn.com/ts/product/00/95/2d/89d2a3a5d4654f8b9bf0e909418c0a30.PNG, https://salt.tikicdn.com/ts/product/40/d0/c0/f38c30fc54c4dd9181eb8838ca8d69cf.jpg, https://salt.tikicdn.com/ts/product/92/c9/9a/ebc3b8ada91bc10cd4b687d4e50a9fe4.PNG","https://salt.tikicdn.com/cache/w1200/ts/product/00/95/2d/89d2a3a5d4654f8b9bf0e909418c0a30.PNG, https://salt.tikicdn.com/cache/w1200/ts/product/40/d0/c0/f38c30fc54c4dd9181eb8838ca8d69cf.jpg, https://salt.tikicdn.com/cache/w1200/ts/product/92/c9/9a/ebc3b8ada91bc10cd4b687d4e50a9fe4.PNG","https://salt.tikicdn.com/cache/w300/ts/product/00/95/2d/89d2a3a5d4654f8b9bf0e909418c0a30.PNG, https://salt.tikicdn.com/cache/w300/ts/product/40/d0/c0/f38c30fc54c4dd9181eb8838ca8d69cf.jpg, https://salt.tikicdn.com/cache/w300/ts/product/92/c9/9a/ebc3b8ada91bc10cd4b687d4e50a9fe4.PNG","https://salt.tikicdn.com/cache/200x280/ts/product/00/95/2d/89d2a3a5d4654f8b9bf0e909418c0a30.PNG, https://salt.tikicdn.com/cache/200x280/ts/product/40/d0/c0/f38c30fc54c4dd9181eb8838ca8d69cf.jpg, https://salt.tikicdn.com/cache/200x280/ts/product/92/c9/9a/ebc3b8ada91bc10cd4b687d4e50a9fe4.PNG","https://salt.tikicdn.com/cache/200x280/ts/product/00/95/2d/89d2a3a5d4654f8b9bf0e909418c0a30.PNG, https://salt.tikicdn.com/cache/200x280/ts/product/40/d0/c0/f38c30fc54c4dd9181eb8838ca8d69cf.jpg, https://salt.tikicdn.com/cache/200x280/ts/product/92/c9/9a/ebc3b8ada91bc10cd4b687d4e50a9fe4.PNG",1000,6
