id,name,price,short_description,description,rating_average,review_count,image_base_url,image_large_url,image_medium_url,image_small_url,image_thumbnail_url,stock,quantity_sold
278627348,USB DATO chuẩn 3.0 dung lượng 128GB Bảo hành 5 năm - Hàng chính hãng,205000,"Lưu trữ tiện lợi – Thiết kế tinh tế – Giá dễ tiếp cận Chuẩn USB 2.0 ổn định, tương thích với mọi thiết bị: máy tính, laptop, loa ô tô, tivi… Dung lượng 128GB – Đủ cho nhu cầu học tập, làm việc: Lư...","Lưu trữ tiện lợi – Thiết kế tinh tế – Giá dễ tiếp cận Chuẩn USB 2.0 ổn định, tương thích với mọi thiết bị: máy tính, laptop, loa ô tô, tivi… Dung lượng 128GB – Đủ cho nhu cầu học tập, làm việc: Lưu tài liệu, giáo trình, hình ảnh, nhạc MP3, clip… Nhiều màu thanh lịch, thời trang, nhỏ gọn, dễ dàng cất túi, mang theo học, làm hay đi công tác đều tiện Bền bỉ, đáng tin cậy, không lo lỗi vặt – USB Dato là thương hiệu được nhiều người tin dùng với bảo hành lên đến 5 năm Phù hợp cho học sinh, sinh viên, dân văn phòng cần một chiếc USB đơn giản – dễ dùng – giá hợp lý Chi phí nhẹ nhàng – Hiệu quả bất ngờ Giá sản phẩm trên Tiki đã bao gồm thuế theo luật hiện hành. Bên cạnh đó, tuỳ vào loại sản phẩm, hình thức và địa chỉ giao hàng mà có thể phát sinh thêm chi phí khác như phí vận chuyển, phụ phí hàng cồng kềnh, thuế nhập khẩu (đối với đơn hàng giao từ nước ngoài có giá trị trên 1 triệu đồng).....",5,6,https://salt.tikicdn.com/ts/product/b5/84/de/06dd35baa4d02e1dc1903c0030aa7dfa.jpg,https://salt.tikicdn.com/cache/w1200/ts/product/b5/84/de/06dd35baa4d02e1dc1903c0030aa7dfa.jpg,https://salt.tikicdn.com/cache/w300/ts/product/b5/84/de/06dd35baa4d02e1dc1903c0030aa7dfa.jpg,https://salt.tikicdn.com/cache/200x280/ts/product/b5/84/de/06dd35baa4d02e1dc1903c0030aa7dfa.jpg,https://salt.tikicdn.com/cache/200x280/ts/product/b5/84/de/06dd35baa4d02e1dc1903c0030aa7dfa.jpg,1000,6
278522227,USB 2.0 Team Group C141  4GB / 8GB / 16GB / 32GB  INC Taiwan - Hàng chính hãng,155000,============================Sản phẩm chính hãng Team GroupThiết kế nhỏ gọn thời trangNắp trượt dễ dàng sử dụngTốc độ chuẩn USB 2.0============================ Sản phẩm được bảo hành đổi mới 60 ...,"============================ Sản phẩm chính hãng Team Group Thiết kế nhỏ gọn thời trang Nắp trượt dễ dàng sử dụng Tốc độ chuẩn USB 2.0 ============================ Sản phẩm được bảo hành đổi mới 60 tháng bằng tem Vỏ sản phẩm có thể được cắt ra để dán tem bảo hành trực tiếp trên sản phẩm Không bảo hành với sản phẩm không có tem của Shop, bị gãy cổng, mất tem, biến dạng... * * 1GB = 1.000.000.000 Bytes --> Trong hệ điều hành, nó sẽ được hiển thị là 1.000.000.000 Bytes / 1024/1024/1024 = 0.93GB Do đó 1GB trên USB thì máy tính chỉ nhận được 0.93GB Lưu ý: *** Tốc độ đọc / ghi có thể sai số với công bố của nhà sản xuất do ảnh hưởng nhiều yếu tố như độ lớn nhỏ của file, cấu hình máy tính, chất lượng cổng USB,... TÍNH NĂNG/LỢI ÍCH > Thiết kế không nắp — Không có nắp để khỏi bị mất hay nhầm nắp, chỉ cần trượt để mở và bắt đầu làm việc. > Thoải mái lưu trữ — Việc lưu trữ và truyền các tài liệu, tài liệu thuyết trình, nhạc, video và các nội dung khác dễ hơn bao giờ hết. > Dung lượng 8GB — Đủ để mang theo tất cả mọi tập tin bên mình. > Giao diện USB 2.0 — Tốc độ USB 2.0 tiêu chuẩn Thông số kỹ thuật Model : C141 Dung lượng : 4GB / 8GB / 16GB / 32GB Giao diện : USB 2.0 Kích thước : 56.7 x 20 x 8.4 mm Tương thích : Windows10, Windows 8.1, Windows 8, Windows 7, Windows Vista... Mac OS X v.10.6.x+... Linux v.2.6.x+... Trọng lượng : 10g Bảo hành : 5 năm Giá sản phẩm trên Tiki đã bao gồm thuế theo luật hiện hành. Bên cạnh đó, tuỳ vào loại sản phẩm, hình thức và địa chỉ giao hàng mà có thể phát sinh thêm chi phí khác như phí vận chuyển, phụ phí hàng cồng kềnh, thuế nhập khẩu (đối với đơn hàng giao từ nước ngoài có giá trị trên 1 triệu đồng).....",0,0,https://salt.tikicdn.com/ts/product/3e/dc/78/b4dc93e5d174594c446f58a010e41ebf.jpg,https://salt.tikicdn.com/cache/w1200/ts/product/3e/dc/78/b4dc93e5d174594c446f58a010e41ebf.jpg,https://salt.tikicdn.com/cache/w300/ts/product/3e/dc/78/b4dc93e5d174594c446f58a010e41ebf.jpg,https://salt.tikicdn.com/cache/200x280/ts/product/3e/dc/78/b4dc93e5d174594c446f58a010e41ebf.jpg,https://salt.tikicdn.com/cache/200x280/ts/product/3e/dc/78/b4dc93e5d174594c446f58a010e41ebf.jpg,1000,0
278463248,USB Kingston 3.2 Gen 1 DataTraveler Exodia  Exodia S DTXS  64GB / 128GB / 256GB - Hàng Chính Hãng,245000,USB 3.2 Kingston DataTraveler Exodia S DTXS/64GB/128GB/256GB - Tốc độ truyền tải ổn địnhUSB Kingston DataTraveler Exodia S DTXS/64GB/128GB/256GB là thiết bị lưu trữ lý tưởng cho người dùng phổ t...,"USB 3.2 Kingston DataTraveler Exodia S DTXS/64GB/128GB/256GB - Tốc độ truyền tải ổn định USB Kingston DataTraveler Exodia S DTXS/64GB/128GB/256GB là thiết bị lưu trữ lý tưởng cho người dùng phổ thông. Model USB này đến từ thương hiệu Kingston nổi tiếng, phù hợp để sử dụng hàng ngày ở nhà, trường học hoặc văn phòng. Truyền dữ liệu mượt với USB 3.2 Gen 1 Với dung lượng 64GB, 128GB/256GB USB 3.2 Kingston DataTraveler Exodia S DTXS  cho phép người dùng lưu trữ thoải mái các tập tin như tài liệu, ảnh hay video chất lượng cao. Dung lượng này đáp ứng tốt nhu cầu sử dụng phổ thông, từ học sinh đến nhân viên văn phòng. Bên cạnh đó, sản phẩm còn hỗ trợ chuẩn USB 3.2 Gen 1, giúp tăng tốc độ truyền dữ liệu so với chuẩn USB 2.0 cũ. Nhờ đó, Kingston DataTraveler Exodia S DTXS/64GB/128GB/256GB giúp rút ngắn thời gian sao chép và di chuyển dữ liệu, mang lại trải nghiệm làm việc mượt mà và hiệu quả hơn. Sử dụng dễ dàng trên nhiều nền tảng Điểm mạnh của USB này là khả năng tương thích rộng với nhiều hệ điều hành, bao gồm Windows 11/10, mac-OS, Linux và Chrome OS. Dù người dùng sử dụng laptop cá nhân, máy tính cơ quan hay thiết bị công cộng, USB 3.2 Kingston DataTraveler Exodia S DTXS/64GB/128GB/256GB đều hoạt động ổn định. Nhờ khả năng 'plug and play' đơn giản, người dùng có thể yên tâm mang USB theo bên mình để sử dụng ở bất cứ đâu. Đây là một lựa chọn lưu trữ đa năng, tiện dụng trong thời đại di động. Thiết kế tiện dụng và khôi phục dễ dàng Điểm nổi bật trong thiết kế của USB 3.2 Kingston DataTraveler Exodia S DTXS/64GB/128GB/256GBlà phần nắp xoay linh hoạt, bảo vệ đầu cắm USB khỏi bụi bẩn, va đập khi không dùng. Thiết kế này loại bỏ nguy cơ thất lạc nắp như các mẫu USB truyền thống, đồng thời tạo cảm giác chắc chắn và thuận tiện khi mang theo. Ngoài ra, sản phẩm có kích thước nhỏ gọn (57 x 19 x 11,8 mm) và trọng lượng chỉ 8,72g, phù hợp để treo vào móc khóa hoặc cất trong túi mà không chiếm nhiều không gian. Kingston DataTraveler Exodia S DTXS/64GB/128GB/256GB còn được phối màu theo dung lượng, vừa mang tính thẩm mỹ, vừa dễ phân biệt khi sử dụng nhiều thiết bị cùng lúc. Giá sản phẩm trên Tiki đã bao gồm thuế theo luật hiện hành. Bên cạnh đó, tuỳ vào loại sản phẩm, hình thức và địa chỉ giao hàng mà có thể phát sinh thêm chi phí khác như phí vận chuyển, phụ phí hàng cồng kềnh, thuế nhập khẩu (đối với đơn hàng giao từ nước ngoài có giá trị trên 1 triệu đồng).....",0,0,"https://salt.tikicdn.com/ts/product/fb/13/e4/824d2f6185079474180aefb5c59c1ae7.PNG, https://salt.tikicdn.com/ts/product/d7/9c/45/fb3c8e7d9e9d16bc990629b4cf4f0ff5.PNG, https://salt.tikicdn.com/ts/product/c8/de/a0/684258a12b3460f6e7e1ffc73565661a.PNG","https://salt.tikicdn.com/cache/w1200/ts/product/fb/13/e4/824d2f6185079474180aefb5c59c1ae7.PNG, https://salt.tikicdn.com/cache/w1200/ts/product/d7/9c/45/fb3c8e7d9e9d16bc990629b4cf4f0ff5.PNG, https://salt.tikicdn.com/cache/w1200/ts/product/c8/de/a0/684258a12b3460f6e7e1ffc73565661a.PNG","https://salt.tikicdn.com/cache/w300/ts/product/fb/13/e4/824d2f6185079474180aefb5c59c1ae7.PNG, https://salt.tikicdn.com/cache/w300/ts/product/d7/9c/45/fb3c8e7d9e9d16bc990629b4cf4f0ff5.PNG, https://salt.tikicdn.com/cache/w300/ts/product/c8/de/a0/684258a12b3460f6e7e1ffc73565661a.PNG","https://salt.tikicdn.com/cache/200x280/ts/product/fb/13/e4/824d2f6185079474180aefb5c59c1ae7.PNG, https://salt.tikicdn.com/cache/200x280/ts/product/d7/9c/45/fb3c8e7d9e9d16bc990629b4cf4f0ff5.PNG, https://salt.tikicdn.com/cache/200x280/ts/product/c8/de/a0/684258a12b3460f6e7e1ffc73565661a.PNG","https://salt.tikicdn.com/cache/200x280/ts/product/fb/13/e4/824d2f6185079474180aefb5c59c1ae7.PNG, https://salt.tikicdn.com/cache/200x280/ts/product/d7/9c/45/fb3c8e7d9e9d16bc990629b4cf4f0ff5.PNG, https://salt.tikicdn.com/cache/200x280/ts/product/c8/de/a0/684258a12b3460f6e7e1ffc73565661a.PNG",1000,0
278020762,USB 64GB Sandisk Phone Drive for Android SDDDC6-064G-G46 (Type C+Type A)- Hàng chính hãng ,559000,"THÔNG SỐ KỸ THUẬT :  Dung lượng64GBGiao tiếpUSB 3.2 Gen 1 / USB Type-CTốc độĐọc:100MB/sHệ điều hành hỗ trợWindows10+ , macOS v10.9+Kích thước70.1 x 80.01 x 10.92 mm...","THÔNG SỐ KỸ THUẬT : Dung lượng 64GB Giao tiếp USB 3.2 Gen 1 / USB Type-C Tốc độ Đọc:100MB/s Hệ điều hành hỗ trợ Windows10+ , macOS v10.9+ Kích thước 70.1 x 80.01 x 10.92 mm Khối lượng 13.6g Bảo hành 24 tháng Lưu ý : trước khi sd khách vào CH Play tải Phần mềm sandisk memory zone , sau khi tải về cho phép truy cập vào kho hình ảnh , hoặc dữ liệu của Điện thoại , máy tính để có thể chuyển dữ liệu từ ĐT hoặc máy tính qua USB MÔ TẢ TÍNH NĂNG : Bạn đang tìm kiếm một thiết bị lưu trữ nhỏ gọn, tốc độ cao và dễ dàng kết nối với điện thoại Android?là lựa chọn hoàn hảo để mở rộng bộ nhớ điện thoại, truyền tải dữ liệu và bảo vệ tệp tin quan trọng của bạn chỉ trong vài thao tác đơn giản. Tăng cường dung lượng với 64GB tiện lợi Không gian 64GB trên Sandisk G46 đủ để lưu trữ hàng trăm video, ảnh chất lượng cao và tài liệu công việc. Đây là lựa chọn phù hợp cho người dùng thường xuyên di chuyển hoặc làm việc từ xa, cần một thiết bị lưu trữ đáng tin cậy mọi lúc mọi nơi. Tốc độ truyền tải mạnh mẽ với USB 3.2 Gen 1 Với tốc độ đọc lên đến 100MB/s, USB Sandisk G46 giúp bạn sao chép dữ liệu cực nhanh giữa điện thoại Android và máy tính. Nhờ giao tiếp USB 3.2 Gen 1, mọi tác vụ sao lưu đều trở nên mượt mà và tiết kiệm thời gian hơn bao giờ hết. Tương thích đa nền tảng, kết nối dễ dàng Thiết bị hoạt động ổn định với hệ điều hành Windows 10+, mac-OS v10.9+ và hầu hết smartphone An-droid hỗ trợ OTG. Cấu tạo hai đầu USB-A và USB-C giúp bạn dễ dàng chuyển đổi giữa các thiết bị mà không cần cáp kết nối rườm rà. Thiết kế tinh tế, nhỏ gọn và bền bỉ Kích thước chỉ 70.1 x 80.01 x 10.92 mm, sản phẩm cực kỳ linh hoạt để mang theo trong túi áo, balo hay ví cá nhân. Thiết kế trượt thông minh bảo vệ đầu cắm và tăng độ bền trong quá trình sử dụng hàng ngày. Bảo vệ dữ liệu tối ưu với RescuePRO Deluxe Kèm theo phần mềm RescuePRO Deluxe, bạn có thể dễ dàng khôi phục những tập tin bị xóa nhầm hoặc mất do sự cố, đảm bảo dữ liệu của bạn luôn được an toàn và dễ truy xuất. Kết luận USB Sandisk Phone Drive for Android SDDDC6-064G-G46 là thiết bị lưu trữ lý tưởng cho người dùng Android yêu cầu tốc độ, tiện lợi và tính linh hoạt cao. Mạnh mẽ trong hiệu năng – gọn nhẹ trong thiết kế – hoàn hảo cho cuộc sống di động. Giá sản phẩm trên Tiki đã bao gồm thuế theo luật hiện hành. Bên cạnh đó, tuỳ vào loại sản phẩm, hình thức và địa chỉ giao hàng mà có thể phát sinh thêm chi phí khác như phí vận chuyển, phụ phí hàng cồng kềnh, thuế nhập khẩu (đối với đơn hàng giao từ nước ngoài có giá trị trên 1 triệu đồng).....",0,0,"https://salt.tikicdn.com/ts/product/39/a8/9c/834ab19c31fe0b39bda4df54bd7cb23c.PNG, https://salt.tikicdn.com/ts/product/8a/92/4f/9b4351b8eba8f9266316532969a12a7b.PNG, https://salt.tikicdn.com/ts/product/b7/00/18/9b78a7e8f0e8e43c285932346cf7ebf2.PNG, https://salt.tikicdn.com/ts/product/f2/0c/ab/cb7c2b5e9060caaf1574799e6f8cb40d.PNG, https://salt.tikicdn.com/ts/product/a8/5f/b9/d1526299d89f09fad7f6f87a0fa9a637.PNG","https://salt.tikicdn.com/cache/w1200/ts/product/39/a8/9c/834ab19c31fe0b39bda4df54bd7cb23c.PNG, https://salt.tikicdn.com/cache/w1200/ts/product/8a/92/4f/9b4351b8eba8f9266316532969a12a7b.PNG, https://salt.tikicdn.com/cache/w1200/ts/product/b7/00/18/9b78a7e8f0e8e43c285932346cf7ebf2.PNG, https://salt.tikicdn.com/cache/w1200/ts/product/f2/0c/ab/cb7c2b5e9060caaf1574799e6f8cb40d.PNG, https://salt.tikicdn.com/cache/w1200/ts/product/a8/5f/b9/d1526299d89f09fad7f6f87a0fa9a637.PNG","https://salt.tikicdn.com/cache/w300/ts/product/39/a8/9c/834ab19c31fe0b39bda4df54bd7cb23c.PNG, https://salt.tikicdn.com/cache/w300/ts/product/8a/92/4f/9b4351b8eba8f9266316532969a12a7b.PNG, https://salt.tikicdn.com/cache/w300/ts/product/b7/00/18/9b78a7e8f0e8e43c285932346cf7ebf2.PNG, https://salt.tikicdn.com/cache/w300/ts/product/f2/0c/ab/cb7c2b5e9060caaf1574799e6f8cb40d.PNG, https://salt.tikicdn.com/cache/w300/ts/product/a8/5f/b9/d1526299d89f09fad7f6f87a0fa9a637.PNG","https://salt.tikicdn.com/cache/200x280/ts/product/39/a8/9c/834ab19c31fe0b39bda4df54bd7cb23c.PNG, https://salt.tikicdn.com/cache/200x280/ts/product/8a/92/4f/9b4351b8eba8f9266316532969a12a7b.PNG, https://salt.tikicdn.com/cache/200x280/ts/product/b7/00/18/9b78a7e8f0e8e43c285932346cf7ebf2.PNG, https://salt.tikicdn.com/cache/200x280/ts/product/f2/0c/ab/cb7c2b5e9060caaf1574799e6f8cb40d.PNG, https://salt.tikicdn.com/cache/200x280/ts/product/a8/5f/b9/d1526299d89f09fad7f6f87a0fa9a637.PNG","https://salt.tikicdn.com/cache/200x280/ts/product/39/a8/9c/834ab19c31fe0b39bda4df54bd7cb23c.PNG, https://salt.tikicdn.com/cache/200x280/ts/product/8a/92/4f/9b4351b8eba8f9266316532969a12a7b.PNG, https://salt.tikicdn.com/cache/200x280/ts/product/b7/00/18/9b78a7e8f0e8e43c285932346cf7ebf2.PNG, https://salt.tikicdn.com/cache/200x280/ts/product/f2/0c/ab/cb7c2b5e9060caaf1574799e6f8cb40d.PNG, https://salt.tikicdn.com/cache/200x280/ts/product/a8/5f/b9/d1526299d89f09fad7f6f87a0fa9a637.PNG",1000,0
276181938,USB 3.2 Team Group C175 32GB - Hàng chính hãng,210000,=================================✪ Sản phẩm chính hãng Team Group✪ Thiết kế nắp rời và tông chủ màu đen hợp thời trang✪ Thiết bị lưu trữ USB 3.2 lý tưởng (USB 3.2 GEN 1 tương đương USB 3.0)✪ ...,"================================= ✪ Sản phẩm chính hãng Team Group ✪ Thiết kế nắp rời và tông chủ màu đen hợp thời trang ✪ Thiết bị lưu trữ USB 3.2 lý tưởng (USB 3.2 GEN 1 tương đương USB 3.0) ✪ Tốc độ đọc cực nhanh lên tới 75MB/s ~100MB/s ✪ Tốc độ ghi: ~10MB/s ================================= ✪ Sản phẩm được bảo hành đổi mới 5 năm bằng tem ✪ Vỏ sản phẩm có thể được cắt ra để dán tem bảo hành trực tiếp trên sản phẩm ✪ Không bảo hành với sản phẩm không có tem của Shop, bị gãy cổng, mất tem, biến dạ * * 1GB = 1.000.000.000 Bytes --> Trong hệ điều hành, nó sẽ được hiển thị là 1.000.000.000 Bytes / 1024/1024/1024 = 0.93GB Do đó 1GB trên USB thì máy tính chỉ nhận được 0.93GB. Lưu ý: *** Để kiểm tra tốc độ USB được chính xác nhất, các bạn nên gắn vào cổng USB 3.0 (thông thường màu xanh) trên máy vi tính / laptop để kiểm tra (cổng USB 2.0 chỉ nhận giới hạn tốc độ). *** Tốc độ đọc / ghi có thể sai số với công bố của nhà sản xuất do ảnh hưởng nhiều yếu tố như độ lớn nhỏ của file, cấu hình máy tính, chất lượng cổng USB, TÍNH NĂNG/LỢI ÍCH > Thiết kế nắp rời — Chỉ cần mở nắp và bắt đầu làm việc. > Thoải mái lưu trữ — Việc lưu trữ và truyền các tài liệu, tài liệu thuyết trình, nhạc, video và các nội dung khác dễ hơn bao giờ hết. > Dung lượng 32GB — Đủ để mang theo tất cả mọi tập tin bên mình. > Tốc độ USB 3.0 — Truyền tải tốc độ cực nhanh lên đến 80MB/s (tốc độ đọc) > Tương thích ngược — Có thể sử dụng với cổng USB 3.0 và 2.0. Chi tiết kĩ thuật: ☼ Nhà sản xuất : Team Group ☼ Model : C175 ☼ Dung lượng : 32GB ☼ Chuẩn giao tiếp : USB 3.0 (USB 3.2 GEN 1 tương đương USB 3.0) ☼ Tốc độ đọc:        ~75MB/s ☼ Tốc độ ghi :        ~10MB/s ☼ Kích thước : 55 x 20.5 x 9.5 mm ☼ Tương thích : Windows10, Windows 8.1, Windows 8, Windows 7, Windows Vista Mac OS X v.10.6.x+ Linux v.2.6.x+ ☼ Bảo hành : 5 năm ☼ Xuất xứ : Taiwan Giá sản phẩm trên Tiki đã bao gồm thuế theo luật hiện hành. Bên cạnh đó, tuỳ vào loại sản phẩm, hình thức và địa chỉ giao hàng mà có thể phát sinh thêm chi phí khác như phí vận chuyển, phụ phí hàng cồng kềnh, thuế nhập khẩu (đối với đơn hàng giao từ nước ngoài có giá trị trên 1 triệu đồng).....",5,11,"https://salt.tikicdn.com/ts/product/6a/a8/ab/a2569349f58751fb796f85c864e928a1.jpg, https://salt.tikicdn.com/ts/product/68/24/a6/182159febd127379b1eafe8c56549023.jpg, https://salt.tikicdn.com/ts/product/c7/a2/4b/0dd440c78d676f5cb1202a3bb9688e03.jpg, https://salt.tikicdn.com/ts/product/a0/2e/7e/ca0730e85055b73c0e53ec14d27bc871.jpg, https://salt.tikicdn.com/ts/product/07/0a/05/233d1909affeb7f839404e2d430e31f2.jpg","https://salt.tikicdn.com/cache/w1200/ts/product/6a/a8/ab/a2569349f58751fb796f85c864e928a1.jpg, https://salt.tikicdn.com/cache/w1200/ts/product/68/24/a6/182159febd127379b1eafe8c56549023.jpg, https://salt.tikicdn.com/cache/w1200/ts/product/c7/a2/4b/0dd440c78d676f5cb1202a3bb9688e03.jpg, https://salt.tikicdn.com/cache/w1200/ts/product/a0/2e/7e/ca0730e85055b73c0e53ec14d27bc871.jpg, https://salt.tikicdn.com/cache/w1200/ts/product/07/0a/05/233d1909affeb7f839404e2d430e31f2.jpg","https://salt.tikicdn.com/cache/w300/ts/product/6a/a8/ab/a2569349f58751fb796f85c864e928a1.jpg, https://salt.tikicdn.com/cache/w300/ts/product/68/24/a6/182159febd127379b1eafe8c56549023.jpg, https://salt.tikicdn.com/cache/w300/ts/product/c7/a2/4b/0dd440c78d676f5cb1202a3bb9688e03.jpg, https://salt.tikicdn.com/cache/w300/ts/product/a0/2e/7e/ca0730e85055b73c0e53ec14d27bc871.jpg, https://salt.tikicdn.com/cache/w300/ts/product/07/0a/05/233d1909affeb7f839404e2d430e31f2.jpg","https://salt.tikicdn.com/cache/200x280/ts/product/6a/a8/ab/a2569349f58751fb796f85c864e928a1.jpg, https://salt.tikicdn.com/cache/200x280/ts/product/68/24/a6/182159febd127379b1eafe8c56549023.jpg, https://salt.tikicdn.com/cache/200x280/ts/product/c7/a2/4b/0dd440c78d676f5cb1202a3bb9688e03.jpg, https://salt.tikicdn.com/cache/200x280/ts/product/a0/2e/7e/ca0730e85055b73c0e53ec14d27bc871.jpg, https://salt.tikicdn.com/cache/200x280/ts/product/07/0a/05/233d1909affeb7f839404e2d430e31f2.jpg","https://salt.tikicdn.com/cache/200x280/ts/product/6a/a8/ab/a2569349f58751fb796f85c864e928a1.jpg, https://salt.tikicdn.com/cache/200x280/ts/product/68/24/a6/182159febd127379b1eafe8c56549023.jpg, https://salt.tikicdn.com/cache/200x280/ts/product/c7/a2/4b/0dd440c78d676f5cb1202a3bb9688e03.jpg, https://salt.tikicdn.com/cache/200x280/ts/product/a0/2e/7e/ca0730e85055b73c0e53ec14d27bc871.jpg, https://salt.tikicdn.com/cache/200x280/ts/product/07/0a/05/233d1909affeb7f839404e2d430e31f2.jpg",1000,11
