id,name,price,short_description,description,rating_average,review_count,image_base_url,image_large_url,image_medium_url,image_small_url,image_thumbnail_url,stock,quantity_sold
10723695,USB SanDisk Cruzer Blade usb 2.0 CZ50 32GB - Hàng Chính Hãng,355000,THÔNG SỐ KỸ THUẬT :Tốc độ truyền tải nhanh chóngUSB SanDisk CZ50 32GB – USB 2.0 với công nghệ 2.0 cho phép trao đổi dữ liệu giữa máy tính và thiết bị một cách nhanh chóng. USB có tốc độ...,"THÔNG SỐ KỸ THUẬT : Tốc độ truyền tải nhanh chóng USB SanDisk CZ50 32 GB – USB 2.0 với công nghệ 2.0 cho phép trao đổi dữ liệu giữa máy tính và thiết bị một cách nhanh chóng. USB có tốc độ truyền tải tối đa trong điều kiện tối ưu là 480Mbp/s, giúp truyền dữ liệu 8GB trong vòng 3 phút. Sản phẩm hỗ trợ kết nối với máy tính. Thiết kế nhỏ gọn USB được thiết kế nhỏ gọn, màu đen đỏ cá tính. Bên cạnh đó, còn có 1 lỗ nhỏ xỏ dây giúp hạn chế thất lạc USB hơn. Thoải mái lưu trữ Với dung lượng 32GB cho bạn thoải mái lưu trữ các dữ liệu cần thiết dành cho công việc và giải trí. Sử dụng USB sẽ giúp cho bạn luôn chủ động trong công việc. Sử dụng đơn giản USB hoạt động theo nguyên tác Plug and Play, chỉ cần cắm vào máy tính là có thể sử dụng. Tương thích với các thiết bị như PC, laptop, máy in, máy chiếu, loa nghe nhạc… Bên cạnh đó, USB còn được tích hợp ứng dụng SecureAccess cho phép bạn đặt mật khẩu và mã hóa các tập tin cá nhân nhằm tăng độ bảo mật cho dữ liệu của bạn. ***  LƯU Ý : Vỏ hộp đuuợc khui ra để dán tem bảo hành . Giá sản phẩm trên Tiki đã bao gồm thuế theo luật hiện hành. Bên cạnh đó, tuỳ vào loại sản phẩm, hình thức và địa chỉ giao hàng mà có thể phát sinh thêm chi phí khác như phí vận chuyển, phụ phí hàng cồng kềnh, thuế nhập khẩu (đối với đơn hàng giao từ nước ngoài có giá trị trên 1 triệu đồng).....",4,5,"https://salt.tikicdn.com/ts/product/3a/ee/0f/2e2e6b9a8d0cc07bfbf9e37e730655f2.jpg, https://salt.tikicdn.com/ts/product/67/73/36/175d01376d14ceb4622bbe5aa3440596.jpg, https://salt.tikicdn.com/ts/product/cf/34/6c/17bf12371c1241eed52f00bc00f03c25.jpg","https://salt.tikicdn.com/cache/w1200/ts/product/3a/ee/0f/2e2e6b9a8d0cc07bfbf9e37e730655f2.jpg, https://salt.tikicdn.com/cache/w1200/ts/product/67/73/36/175d01376d14ceb4622bbe5aa3440596.jpg, https://salt.tikicdn.com/cache/w1200/ts/product/cf/34/6c/17bf12371c1241eed52f00bc00f03c25.jpg","https://salt.tikicdn.com/cache/w300/ts/product/3a/ee/0f/2e2e6b9a8d0cc07bfbf9e37e730655f2.jpg, https://salt.tikicdn.com/cache/w300/ts/product/67/73/36/175d01376d14ceb4622bbe5aa3440596.jpg, https://salt.tikicdn.com/cache/w300/ts/product/cf/34/6c/17bf12371c1241eed52f00bc00f03c25.jpg","https://salt.tikicdn.com/cache/200x280/ts/product/3a/ee/0f/2e2e6b9a8d0cc07bfbf9e37e730655f2.jpg, https://salt.tikicdn.com/cache/200x280/ts/product/67/73/36/175d01376d14ceb4622bbe5aa3440596.jpg, https://salt.tikicdn.com/cache/200x280/ts/product/cf/34/6c/17bf12371c1241eed52f00bc00f03c25.jpg","https://salt.tikicdn.com/cache/200x280/ts/product/3a/ee/0f/2e2e6b9a8d0cc07bfbf9e37e730655f2.jpg, https://salt.tikicdn.com/cache/200x280/ts/product/67/73/36/175d01376d14ceb4622bbe5aa3440596.jpg, https://salt.tikicdn.com/cache/200x280/ts/product/cf/34/6c/17bf12371c1241eed52f00bc00f03c25.jpg",1000,5
4981861,USB SanDisk CZ430 Ultra Fit 128GB - USB 3.1 - Hàng Chính Hãng,829000,"USB SanDisk CZ430 Ultra Fit - USB 3.1 - Hàng Chính Hãng là phần mềm SanDisk SecureAccess đi kèm trong USB giúp mật mã folder của bạn, ngăn chặn truy cập từ người khác.Chuẩn 3.1 giúp truyền dữ liệu n...","USB SanDisk CZ430 Ultra Fit - USB 3.1 - Hàng Chính Hãng là phần mềm SanDisk SecureAccess đi kèm trong USB giúp mật mã folder của bạn, ngăn chặn truy cập từ người khác. Chuẩn 3.1 giúp truyền dữ liệu nhanh gấp 15 lần so với 2.0 và nhanh hơn 3.0. Cắm USB vào cổng 3.1 (màu xanh) trên laptop để đạt tốc độ truyền nhanh nhất. Phần mềm SanDisk Recovery giúp cứu dữ liệu khi chẳng may xóa mất. Giúp lưu trữ nhiều dữ liệu Có 1 lỗ nhỏ để xỏ dây treo balo hay chìa khóa giúp tránh thất lạc Thao tác kéo thả dữ liệu qua lại giữa USB và máy tính đơn giản, không cần thêm phần mềm Có thể gắn luôn vào laptop biến USB thành 1 ổ cứng lưu trữ mặc định Chép thư mục giải trí của bạn vào USB sau đó gắn vào loa hay TV... để thưởng thức Lưu ý : Vỏ hộp được khui ra để dán tem bảo hành . Giá sản phẩm trên Tiki đã bao gồm thuế theo luật hiện hành. Bên cạnh đó, tuỳ vào loại sản phẩm, hình thức và địa chỉ giao hàng mà có thể phát sinh thêm chi phí khác như phí vận chuyển, phụ phí hàng cồng kềnh, thuế nhập khẩu (đối với đơn hàng giao từ nước ngoài có giá trị trên 1 triệu đồng).....",5,24,"https://salt.tikicdn.com/ts/product/9d/85/4f/c2ca03612d38f06e910177459220a0e1.jpg, https://salt.tikicdn.com/ts/product/45/6b/e2/e9a397aa1aa63de995da31f55849afb3.jpg","https://salt.tikicdn.com/cache/w1200/ts/product/9d/85/4f/c2ca03612d38f06e910177459220a0e1.jpg, https://salt.tikicdn.com/cache/w1200/ts/product/45/6b/e2/e9a397aa1aa63de995da31f55849afb3.jpg","https://salt.tikicdn.com/cache/w300/ts/product/9d/85/4f/c2ca03612d38f06e910177459220a0e1.jpg, https://salt.tikicdn.com/cache/w300/ts/product/45/6b/e2/e9a397aa1aa63de995da31f55849afb3.jpg","https://salt.tikicdn.com/cache/200x280/ts/product/9d/85/4f/c2ca03612d38f06e910177459220a0e1.jpg, https://salt.tikicdn.com/cache/200x280/ts/product/45/6b/e2/e9a397aa1aa63de995da31f55849afb3.jpg","https://salt.tikicdn.com/cache/200x280/ts/product/9d/85/4f/c2ca03612d38f06e910177459220a0e1.jpg, https://salt.tikicdn.com/cache/200x280/ts/product/45/6b/e2/e9a397aa1aa63de995da31f55849afb3.jpg",1000,24
4953361,USB SanDisk CZ50 16GB – USB 2.0 – Hàng Chính Hãng,265000,Tốc độ truyền tải nhanh chóngUSB SanDisk CZ50 16GB – USB 2.0 với công nghệ 2.0 cho phép trao đổi dữ liệu giữa máy tính và thiết bị một cách nhanh chóng. USB có tốc độ truyền tải tối đa t...,"Tốc độ truyền tải nhanh chóng USB SanDisk CZ50 16GB – USB 2.0 với công nghệ 2.0 cho phép trao đổi dữ liệu giữa máy tính và thiết bị một cách nhanh chóng. USB có tốc độ truyền tải tối đa trong điều kiện tối ưu là 480Mbp/s, giúp truyền dữ liệu 8GB trong vòng 3 phút. Sản phẩm hỗ trợ kết nối với máy tính. Thiết kế nhỏ gọn USB được thiết kế nhỏ gọn, màu đen đỏ cá tính. Bên cạnh đó, còn có 1 lỗ nhỏ xỏ dây giúp hạn chế thất lạc USB hơn. Thoải mái lưu trữ Với dung lượng 16GB cho bạn thoải mái lưu trữ các dữ liệu cần thiết dành cho công việc và giải trí. Sử dụng USB sẽ giúp cho bạn luôn chủ động trong công việc. Sử dụng đơn giản USB hoạt động theo nguyên tác Plug and Play, chỉ cần cắm vào máy tính là có thể sử dụng. Tương thích với các thiết bị như PC, laptop, máy in, máy chiếu, loa nghe nhạc… Bên cạnh đó, USB còn được tích hợp ứng dụng SecureAccess cho phép bạn đặt mật khẩu và mã hóa các tập tin cá nhân nhằm tăng độ bảo mật cho dữ liệu của bạn. *** LƯU Ý : Vỏ hộp được khui ra để dán tem bảo hành. Giá sản phẩm trên Tiki đã bao gồm thuế theo luật hiện hành. Bên cạnh đó, tuỳ vào loại sản phẩm, hình thức và địa chỉ giao hàng mà có thể phát sinh thêm chi phí khác như phí vận chuyển, phụ phí hàng cồng kềnh, thuế nhập khẩu (đối với đơn hàng giao từ nước ngoài có giá trị trên 1 triệu đồng).....",4.5,8,"https://salt.tikicdn.com/ts/product/69/c8/c7/cf23a027d78be87772a46f6acb0bd5fe.jpg, https://salt.tikicdn.com/ts/product/2e/70/d6/42b30a28f2af19f6b2215e212a669c58.jpg, https://salt.tikicdn.com/ts/product/89/61/45/20fb7ab1ef4857f4aabdd84fa24cd90c.jpg","https://salt.tikicdn.com/cache/w1200/ts/product/69/c8/c7/cf23a027d78be87772a46f6acb0bd5fe.jpg, https://salt.tikicdn.com/cache/w1200/ts/product/2e/70/d6/42b30a28f2af19f6b2215e212a669c58.jpg, https://salt.tikicdn.com/cache/w1200/ts/product/89/61/45/20fb7ab1ef4857f4aabdd84fa24cd90c.jpg","https://salt.tikicdn.com/cache/w300/ts/product/69/c8/c7/cf23a027d78be87772a46f6acb0bd5fe.jpg, https://salt.tikicdn.com/cache/w300/ts/product/2e/70/d6/42b30a28f2af19f6b2215e212a669c58.jpg, https://salt.tikicdn.com/cache/w300/ts/product/89/61/45/20fb7ab1ef4857f4aabdd84fa24cd90c.jpg","https://salt.tikicdn.com/cache/200x280/ts/product/69/c8/c7/cf23a027d78be87772a46f6acb0bd5fe.jpg, https://salt.tikicdn.com/cache/200x280/ts/product/2e/70/d6/42b30a28f2af19f6b2215e212a669c58.jpg, https://salt.tikicdn.com/cache/200x280/ts/product/89/61/45/20fb7ab1ef4857f4aabdd84fa24cd90c.jpg","https://salt.tikicdn.com/cache/200x280/ts/product/69/c8/c7/cf23a027d78be87772a46f6acb0bd5fe.jpg, https://salt.tikicdn.com/cache/200x280/ts/product/2e/70/d6/42b30a28f2af19f6b2215e212a669c58.jpg, https://salt.tikicdn.com/cache/200x280/ts/product/89/61/45/20fb7ab1ef4857f4aabdd84fa24cd90c.jpg",1000,8
2302081,USB 3.1 SanDisk CZ430 Ultra Fit 32GB 130MB/s - Hàng Chính Hãng,445000,"USB 3.1 SanDisk CZ430 Ultra Fit 32GB 130MB/s (Đen)Cách đơn giản để thêm lưu trữ tốc độ cao, thêm vào thiết bị của bạn! Thẻ nhớ USB SanDisk Ultra Fit  USB 3.1 mang lại hiệu suất cho phép bạn di chuyể...","USB 3.1 SanDisk CZ430 Ultra Fit 32GB 130MB/s (Đen) Cách đơn giản để thêm lưu trữ tốc độ cao, thêm vào thiết bị của bạn! Thẻ nhớ USB SanDisk Ultra Fit  USB 3.1 mang lại hiệu suất cho phép bạn di chuyển một bộ phim có độ dài lên đến 15x nhanh hơn so với ổ USB 2.0 tiêu chuẩn. 1 Hơn nữa, nhờ thiết kế gọn nhẹ, tinh gọn, bạn có thể cắm vào và để nó vào. THIẾT BỊ CUỘC VÀ CUNG CẤP COMPACT Ổ flash nhỏ gọn này được thiết kế để lưu trữ cắm và lưu trữ cho máy tính xách tay, máy tính bảng, TV, bảng điều khiển trò chơi, hệ thống âm thanh xe hơi và hơn thế nữa. Cắm nó vào, và bạn đã có bộ nhớ tức thời luôn luôn trên tàu! Tốc độ cao USB 3.1 Truyền tệp nhanh chóng với tốc độ đọc 130MB / s. Với tốc độ ghi nhanh hơn 15 lần so với các ổ USB 2.0 tiêu chuẩn, 1 bạn có thể di chuyển một bộ phim có chiều dài đầy đủ lên ổ đĩa trong vòng chưa đầy 30 giây. 2 SANDISK SECUREACCESS SOFTWARE GIÚP Đ PRO BẢO VỆ QUYỀN CỦA BẠN Tạo một thư mục riêng trên ổ đĩa của bạn với phần mềm SanDisk SecureAccess. 3 Phần mềm mã hóa AES 128-bit này giúp bạn dễ dàng bảo vệ các tệp quan trọng bằng mật khẩu. Kéo và thả tệp vào vault và chúng sẽ được mã hóa. EASY FILE RECOVERY VỚI PHẦN MỀM RESCUEPRO DELUXE Ổ đĩa đi cùng với phần mềm phục hồi dữ liệu RescuePRO Deluxe. 4 Phần mềm này giúp bạn dễ dàng khôi phục các tệp đã bị xóa vô tình (yêu cầu tải xuống). THÍCH ỨNG CÓ USB 3.0 VÀ 2.0 PORTS Thẻ nhớ USB SanDisk Ultra Fit USB 3.1 tương thích ngược, vì vậy bạn có thể cắm nó vào bất kỳ cổng USB 3.0 hoặc 2.0. Dung lượng:  16GB, 32GB, 64GB, 128GB, 256GB Hiệu suất / Tốc độ:  Lên đến 130MB/s (tối đa trong điều kiện hoàn hảo, thực tế sẽ thấp hơn công bố) Kích thước:  19,1 x 15,9 x 8,8 mm; 0,75 x 0,63 x 0,35 in (LxWxH) Nhiệt độ hoạt động:  0 C đến 35 C Nhiệt độ lưu trữ:  -10 C đến 70 C Khả năng tương thích:  USB 3.1 (tương thích ngược với USB 3.0 và USB 2.0) Giá sản phẩm trên Tiki đã bao gồm thuế theo luật hiện hành. Bên cạnh đó, tuỳ vào loại sản phẩm, hình thức và địa chỉ giao hàng mà có thể phát sinh thêm chi phí khác như phí vận chuyển, phụ phí hàng cồng kềnh, thuế nhập khẩu (đối với đơn hàng giao từ nước ngoài có giá trị trên 1 triệu đồng).....",4.5,17,"https://salt.tikicdn.com/ts/product/e0/e2/ad/5e6edf9303000f741c10823ceba38bf4.jpg, https://salt.tikicdn.com/ts/product/af/28/3f/ae1b2a9bb101c3f56df6add920c2196e.jpg, https://salt.tikicdn.com/ts/product/5e/94/bd/2e24aff85c5f498bb2923d0fdd3c231b.jpg","https://salt.tikicdn.com/cache/w1200/ts/product/e0/e2/ad/5e6edf9303000f741c10823ceba38bf4.jpg, https://salt.tikicdn.com/cache/w1200/ts/product/af/28/3f/ae1b2a9bb101c3f56df6add920c2196e.jpg, https://salt.tikicdn.com/cache/w1200/ts/product/5e/94/bd/2e24aff85c5f498bb2923d0fdd3c231b.jpg","https://salt.tikicdn.com/cache/w300/ts/product/e0/e2/ad/5e6edf9303000f741c10823ceba38bf4.jpg, https://salt.tikicdn.com/cache/w300/ts/product/af/28/3f/ae1b2a9bb101c3f56df6add920c2196e.jpg, https://salt.tikicdn.com/cache/w300/ts/product/5e/94/bd/2e24aff85c5f498bb2923d0fdd3c231b.jpg","https://salt.tikicdn.com/cache/200x280/ts/product/e0/e2/ad/5e6edf9303000f741c10823ceba38bf4.jpg, https://salt.tikicdn.com/cache/200x280/ts/product/af/28/3f/ae1b2a9bb101c3f56df6add920c2196e.jpg, https://salt.tikicdn.com/cache/200x280/ts/product/5e/94/bd/2e24aff85c5f498bb2923d0fdd3c231b.jpg","https://salt.tikicdn.com/cache/200x280/ts/product/e0/e2/ad/5e6edf9303000f741c10823ceba38bf4.jpg, https://salt.tikicdn.com/cache/200x280/ts/product/af/28/3f/ae1b2a9bb101c3f56df6add920c2196e.jpg, https://salt.tikicdn.com/cache/200x280/ts/product/5e/94/bd/2e24aff85c5f498bb2923d0fdd3c231b.jpg",1000,17
476063,USB Team E902 32GB - Hàng Chính Hãng,180000," USB Team E902 32GB sẽ giúp bạn giảm bớt dung lượng cho Laptop, PC của bạn nhờ không gian lưu trữ lên tới 32GB. Thiết kế sản phẩm nhỏ gọn cùng kiểu nắp xoay tiện lợi giúp bạn yên tâm hơn sau khi sử d...","USB Team E902 32GB sẽ giúp bạn giảm bớt dung lượng cho Laptop, PC của bạn nhờ không gian lưu trữ lên tới 32GB. Thiết kế sản phẩm nhỏ gọn cùng kiểu nắp xoay tiện lợi giúp bạn yên tâm hơn sau khi sử dụng. Sản phẩm sở hữu nắp xoay giúp người dùng thuận tiện hơn trong quá trình sử dụng. Không chỉ bảo vệ được cổng USB khỏi bụi bẩn, hư hại mà còn giúp bạn không còn quên đậy nắp USB sau khi sử dụng. Với bộ nhớ 32GB, bạn có thể thoải mái lưu trữ những dữ liệu cần thiết cho nhu cầu công việc và giải trí của mình và mang theo đến bất cứ đâu. USB được trang bị cổng kết nối USB 2.0 thông dụng giúp bạn yên tâm có thể kết nối được với hết hầu hết thiết bị. Thủ thuật sử dụng USB đúng cách: Hạn chế sự lây lan của virus: Click phải vào USB và chọn Explorer để ngăn chặn sự xâm nhập của virus vào máy, nên quét virus bằng phần mềm trước khi sử dụng. Tránh làm việc trực tiếp với dữ liệu lưu trên ổ USBĐể máy tính khởi động hết các ứng dụng hoàn toàn mới cắm USB vào máy. Ngắt USB an toàn: Chọn Eject/ Eject Mass Store Device Safely Remove USB Mass Storage Device trước khi rút USB.Tránh để ổ USB bị rơi, bị va đập, tránh xa khỏi nước, và đừng để ở nơi có nhiệt độ quá cao. Trong trường hợp không may ổ USB bị rơi vào nước, nên sấy khô hoàn toàn và không sử dụng ít nhất trong 48 giờ. Tránh ""FORMAT"" USB nhiều lần để tránh làm giảm lưu lượng của USB. Giá sản phẩm trên Tiki đã bao gồm thuế theo luật hiện hành. Bên cạnh đó, tuỳ vào loại sản phẩm, hình thức và địa chỉ giao hàng mà có thể phát sinh thêm chi phí khác như phí vận chuyển, phụ phí hàng cồng kềnh, thuế nhập khẩu (đối với đơn hàng giao từ nước ngoài có giá trị trên 1 triệu đồng).....",4.3,3,https://salt.tikicdn.com/media/catalog/product/u/s/usb-2-0-taiwan-team-group-inc-e902-32gb-nau-1061-3752521-1-zoom.jpg,https://salt.tikicdn.com/cache/w1200/media/catalog/product/u/s/usb-2-0-taiwan-team-group-inc-e902-32gb-nau-1061-3752521-1-zoom.jpg,https://salt.tikicdn.com/cache/w300/media/catalog/product/u/s/usb-2-0-taiwan-team-group-inc-e902-32gb-nau-1061-3752521-1-zoom.jpg,https://salt.tikicdn.com/cache/200x280/media/catalog/product/u/s/usb-2-0-taiwan-team-group-inc-e902-32gb-nau-1061-3752521-1-zoom.jpg,https://salt.tikicdn.com/cache/200x280/media/catalog/product/u/s/usb-2-0-taiwan-team-group-inc-e902-32gb-nau-1061-3752521-1-zoom.jpg,1000,3
452578,USB Transcend JetFlash 700 TS64GJF700 64GB - USB 3.0/3.1 - Hàng Chính Hãng ,409000,"USB Transcend JetFlash 700 TS64GJF700 64GB- USB 3.1USB Transcend JetFlash 700 TS64GJF700 64GB- USB 3.1 sẽ giúp bạn lưu hàng trăm, hàng nghìn bài hát, tập tin khác nhau để phục vụ nhu cầu sử dụng của ...","USB Transcend JetFlash 700 TS64GJF700 64GB- USB 3.1 USB Transcend JetFlash 700 TS64GJF700 64GB- USB 3.1 sẽ giúp bạn lưu hàng trăm, hàng nghìn bài hát, tập tin khác nhau để phục vụ nhu cầu sử dụng của mình. Bên cạnh đó, với chuẩn kết nối USB 3.1 sẽ giúp bạn truy xuất những file dung lượng lớn trong thời gian ngắn nhất. Thông tin sản phẩm Thi ế t k ế ti ệ n d ụ ng USB JetFlash 700 thiết kế dạng thanh đơn giản nhỏ gọn và nhẹ. Sản phẩm có nắp đậy giúp bảo vệ được cổng kết nối tránh những hư hỏng không mong muốn. Bên cạnh đó, USB JetFlash 700 còn tích hợp lỗ khuyết để bạn treo những dây đeo vào để tránh bị thất lạc USB. Dung lượng lưu trữ 64 GB USB có dung lượng 64 GB, đủ để bạn có thể lưu trữ hàng chục, thậm chí hàng trăm các tập tin khác nhau. Giờ đây, mọi thông tin cần thiết sẽ ở bên cạnh bạn khi bạn đi bất cứ đâu. Khả năng tương thích cao USB JetFlash 700 được trang bị cổng kết nối USB3.0 giúp truyền tải dữ liệu với tốc độ nhanh gấp nhiều lần so với cổng 2.0. Đồng thời, cổng USB 3.1 cũng tương thích ngược với USB 2.0.  Bạn có thể kết nối dễ dàng với thiết bị thông qua cổng USB 3.1 và sử dụng ngay mà không cần cài đặt bất kì phần mềm nào. Thông số kỹ thuật - Dung lượng: 64GB - Cổng giao tiếp: USB 3.1 Thủ thuật sử dụng USB đúng cách - Hạn chế sự lây lan của virus: Click phải vào USB và chọn Explorer để ngăn chặn sự xâm nhập của virus vào máy, nên quét virus bằng phần mềm trước khi sử dụng. - Tránh làm việc trực tiếp với dữ liệu lưu trên ổ USB -  Để máy tính khởi động hết các ứng dụng hoàn toàn mới cắm USB vào máy - Ngắt USB an toàn: Chọn Eject/ Eject Mobile Disk/ Eject Mass Store Device Safely Remove USB Mass Storage Device trước khi rút USB. - Tránh để ổ USB bị rơi, bị va đập, tránh xa khỏi nước, và đừng để ở nơi có nhiệt độ quá cao. - Trong trường hợp không may ổ USB bị rơi vào nước, nên sấy khô hoàn toàn và không sử dụng ít nhất trong 48 giờ. - Tránh ""FORMAT"" USB nhiều lần để tránh làm giảm lưu lượng của USB. Giá sản phẩm trên Tiki đã bao gồm thuế theo luật hiện hành. Bên cạnh đó, tuỳ vào loại sản phẩm, hình thức và địa chỉ giao hàng mà có thể phát sinh thêm chi phí khác như phí vận chuyển, phụ phí hàng cồng kềnh, thuế nhập khẩu (đối với đơn hàng giao từ nước ngoài có giá trị trên 1 triệu đồng).....",4.2,6,"https://salt.tikicdn.com/ts/product/ce/f0/6c/5da3b23e737022dfdd17bc6d234b3fa6.jpg, https://salt.tikicdn.com/media/catalog/product/6/1/61pucgawrxl._sl1500_.jpg, https://salt.tikicdn.com/media/catalog/product/7/1/713cdbx_wol._sl1500_.jpg, https://salt.tikicdn.com/ts/product/3f/7f/95/0612ea5a14564aed7cfac3064c5d5925.jpg","https://salt.tikicdn.com/cache/w1200/ts/product/ce/f0/6c/5da3b23e737022dfdd17bc6d234b3fa6.jpg, https://salt.tikicdn.com/cache/w1200/media/catalog/product/6/1/61pucgawrxl._sl1500_.jpg, https://salt.tikicdn.com/cache/w1200/media/catalog/product/7/1/713cdbx_wol._sl1500_.jpg, https://salt.tikicdn.com/cache/w1200/ts/product/3f/7f/95/0612ea5a14564aed7cfac3064c5d5925.jpg","https://salt.tikicdn.com/cache/w300/ts/product/ce/f0/6c/5da3b23e737022dfdd17bc6d234b3fa6.jpg, https://salt.tikicdn.com/cache/w300/media/catalog/product/6/1/61pucgawrxl._sl1500_.jpg, https://salt.tikicdn.com/cache/w300/media/catalog/product/7/1/713cdbx_wol._sl1500_.jpg, https://salt.tikicdn.com/cache/w300/ts/product/3f/7f/95/0612ea5a14564aed7cfac3064c5d5925.jpg","https://salt.tikicdn.com/cache/200x280/ts/product/ce/f0/6c/5da3b23e737022dfdd17bc6d234b3fa6.jpg, https://salt.tikicdn.com/cache/200x280/media/catalog/product/6/1/61pucgawrxl._sl1500_.jpg, https://salt.tikicdn.com/cache/200x280/media/catalog/product/7/1/713cdbx_wol._sl1500_.jpg, https://salt.tikicdn.com/cache/200x280/ts/product/3f/7f/95/0612ea5a14564aed7cfac3064c5d5925.jpg","https://salt.tikicdn.com/cache/200x280/ts/product/ce/f0/6c/5da3b23e737022dfdd17bc6d234b3fa6.jpg, https://salt.tikicdn.com/cache/200x280/media/catalog/product/6/1/61pucgawrxl._sl1500_.jpg, https://salt.tikicdn.com/cache/200x280/media/catalog/product/7/1/713cdbx_wol._sl1500_.jpg, https://salt.tikicdn.com/cache/200x280/ts/product/3f/7f/95/0612ea5a14564aed7cfac3064c5d5925.jpg",1000,6
