id,name,price,short_description,description,rating_average,review_count,image_base_url,image_large_url,image_medium_url,image_small_url,image_thumbnail_url,stock,quantity_sold
279186459,Card Màn Hình VGA INNO3D GeForce RTX 3050 6GB Twin X2 V2 - Hàng Chính Hãng,5150000,"INNO3D GeForce RTX 3050 6GB Twin X2 V2INNO3D GeForce RTX 3050 6GB Twin X2 V2 là dòng card đồ họa tầm trung phù hợp cho nhu cầu chơi game Full HD, làm việc đồ họa cơ bản và giải trí đa phương tiện. Sả...","INNO3D GeForce RTX 3050 6GB Twin X2 V2 INNO3D GeForce RTX 3050 6GB Twin X2 V2 là dòng card đồ họa tầm trung phù hợp cho nhu cầu chơi game Full HD, làm việc đồ họa cơ bản và giải trí đa phương tiện . Sản phẩm được thiết kế với hệ thống tản nhiệt 2 quạt (Twin X2) giúp duy trì nhiệt độ ổn định khi vận hành liên tục, đồng thời tối ưu độ bền cho linh kiện. Với nền tảng kiến trúc NVIDIA RTX, mẫu card này hỗ trợ các công nghệ hiện đại như Ray Tracing và DLSS , mang lại trải nghiệm hình ảnh đẹp hơn và cải thiện hiệu năng trong nhiều tựa game phổ biến. Dung lượng VRAM 6GB đáp ứng tốt các tác vụ gaming eSports, game online và phần lớn game AAA ở mức thiết lập hợp lý. Thiết kế của INNO3D Twin X2 V2 gọn gàng, dễ lắp đặt trong nhiều cấu hình PC phổ thông đến gaming, phù hợp cho người dùng muốn nâng cấp hiệu năng đồ họa với mức chi phí tối ưu. Điểm nổi bật Card đồ họa rời dành cho PC gaming / làm việc Thiết kế 2 quạt tản nhiệt ổn định, vận hành hiệu quả Hỗ trợ công nghệ NVIDIA hiện đại (RTX, Ray Tracing, DLSS) Phù hợp nhu cầu chơi game 1080p (Full HD) Dễ nâng cấp cho dàn máy học tập, làm việc, giải trí Giá sản phẩm trên Tiki đã bao gồm thuế theo luật hiện hành. Bên cạnh đó, tuỳ vào loại sản phẩm, hình thức và địa chỉ giao hàng mà có thể phát sinh thêm chi phí khác như phí vận chuyển, phụ phí hàng cồng kềnh, thuế nhập khẩu (đối với đơn hàng giao từ nước ngoài có giá trị trên 1 triệu đồng).....",0,0,"https://salt.tikicdn.com/ts/product/2a/dc/82/b955e514bc2e4f6ed2c10b42c7bb506b.png, https://salt.tikicdn.com/ts/product/3b/40/e3/ab0c0ad9e13997f2c7f443a956c07383.png","https://salt.tikicdn.com/cache/w1200/ts/product/2a/dc/82/b955e514bc2e4f6ed2c10b42c7bb506b.png, https://salt.tikicdn.com/cache/w1200/ts/product/3b/40/e3/ab0c0ad9e13997f2c7f443a956c07383.png","https://salt.tikicdn.com/cache/w300/ts/product/2a/dc/82/b955e514bc2e4f6ed2c10b42c7bb506b.png, https://salt.tikicdn.com/cache/w300/ts/product/3b/40/e3/ab0c0ad9e13997f2c7f443a956c07383.png","https://salt.tikicdn.com/cache/200x280/ts/product/2a/dc/82/b955e514bc2e4f6ed2c10b42c7bb506b.png, https://salt.tikicdn.com/cache/200x280/ts/product/3b/40/e3/ab0c0ad9e13997f2c7f443a956c07383.png","https://salt.tikicdn.com/cache/200x280/ts/product/2a/dc/82/b955e514bc2e4f6ed2c10b42c7bb506b.png, https://salt.tikicdn.com/cache/200x280/ts/product/3b/40/e3/ab0c0ad9e13997f2c7f443a956c07383.png",1000,0
278898178,Card đồ họa Nvidia NVLink Bridge A100 Ampere 2-Way 2-Slot x16 - Hàng chính hãng,10000000," NVIDIA NVLink Bridge A100 Ampere 2-Way 2-Slot x16NVIDIA NVLink Bridge A100 (2-Way, 2-Slot, x16) là phụ kiện chuyên dụng giúp kết nối hai GPU NVIDIA  lại với nhau, tạo thành cặp đôi “song kiếm hợp bí...","NVIDIA NVLink Bridge A100 Ampere 2-Way 2-Slot x16 NVIDIA NVLink Bridge A100 (2-Way, 2-Slot, x16) là phụ kiện chuyên dụng giúp kết nối hai GPU NVIDIA lại với nhau, tạo thành cặp đôi “song kiếm hợp bích” cho các tác vụ AI, HPC và mô phỏng khoa học cực nặng. Tăng tốc giao tiếp giữa GPU NVLink cung cấp băng thông cực cao, nhanh hơn nhiều lần so với PCIe truyền thống. Nhờ đó dữ liệu, mô hình AI và bộ nhớ giữa hai GPU được chia sẻ mượt mà, giảm tình trạng “nghẽn cổ chai” khi train model lớn. THÔNG SỐ CHÍNH Model: NVIDIA NVLink Bridge A100 Kiểu kết nối: 2-Way Độ rộng: 2-Slot Giao tiếp: x16 Chức năng: Tăng băng thông liên kết GPU – hỗ trợ mô hình AI lớn và tính toán nặng Giá sản phẩm trên Tiki đã bao gồm thuế theo luật hiện hành. Bên cạnh đó, tuỳ vào loại sản phẩm, hình thức và địa chỉ giao hàng mà có thể phát sinh thêm chi phí khác như phí vận chuyển, phụ phí hàng cồng kềnh, thuế nhập khẩu (đối với đơn hàng giao từ nước ngoài có giá trị trên 1 triệu đồng).....",0,0,"https://salt.tikicdn.com/ts/product/f6/0d/0b/263698dc5a9ff07cdf47734b74bfd952.jpg, https://salt.tikicdn.com/ts/product/9e/2a/12/0d96a190915764d3565f7c86b06fe2cd.jpg","https://salt.tikicdn.com/cache/w1200/ts/product/f6/0d/0b/263698dc5a9ff07cdf47734b74bfd952.jpg, https://salt.tikicdn.com/cache/w1200/ts/product/9e/2a/12/0d96a190915764d3565f7c86b06fe2cd.jpg","https://salt.tikicdn.com/cache/w300/ts/product/f6/0d/0b/263698dc5a9ff07cdf47734b74bfd952.jpg, https://salt.tikicdn.com/cache/w300/ts/product/9e/2a/12/0d96a190915764d3565f7c86b06fe2cd.jpg","https://salt.tikicdn.com/cache/200x280/ts/product/f6/0d/0b/263698dc5a9ff07cdf47734b74bfd952.jpg, https://salt.tikicdn.com/cache/200x280/ts/product/9e/2a/12/0d96a190915764d3565f7c86b06fe2cd.jpg","https://salt.tikicdn.com/cache/200x280/ts/product/f6/0d/0b/263698dc5a9ff07cdf47734b74bfd952.jpg, https://salt.tikicdn.com/cache/200x280/ts/product/9e/2a/12/0d96a190915764d3565f7c86b06fe2cd.jpg",1000,0
277570437,Card đồ họa Nvidia Tesla T4 16GB GDDR6 PCIe 3.0 Passive Cooling - Hàng chính hãng,35000000,"Next-Level Acceleration Has ArrivedWe’re racing toward the future where every customer interaction, every product, and every service offering will be touched and improved by AI. Realizing that the f...","Next-Level Acceleration Has Arrived We’re racing toward the future where every customer interaction, every product, and every service offering will be touched and improved by AI. Realizing that the future requires a computing platform that can accelerate the full diversity of modern AI, enabling businesses to create new customer experiences, reimagine how they meet—and exceed—customer demands, and cost-effectively scale their AI-based products and services. The NVIDIA T4 GPU accelerates diverse cloud workloads, including high-performance computing, deep learning training and inference, machine learning, data analytics, and graphics. Based on the new NVIDIA Turing architecture and packaged in an energy-efficient 70-watt, small PCIe form factor, T4 is optimized for mainstream computing environments and features multi-precision Turing  and new RT Cores. Combined with accelerated containerized software stacks from NGC, T4 delivers revolutionary performance at scale. NVIDIA T4 Specifications Performance Turing Tensor Cores 320 NVIDIA CUDA cores 2,560 Single Precision Performance (FP32) 8.1 TFLOPS Mixed Precision (FP16/FP32) 65 FP16 TFLOPS INT8 Precision 130 INT8 TOPS INT4 Precision 260 INT4 TOPS Interconnect Gen3 x16 PCIe Memory Capacity 16 GB GDDR6 Bandwidth 320+ GB/s Power 70 watts Giá sản phẩm trên Tiki đã bao gồm thuế theo luật hiện hành. Bên cạnh đó, tuỳ vào loại sản phẩm, hình thức và địa chỉ giao hàng mà có thể phát sinh thêm chi phí khác như phí vận chuyển, phụ phí hàng cồng kềnh, thuế nhập khẩu (đối với đơn hàng giao từ nước ngoài có giá trị trên 1 triệu đồng).....",0,0,"https://salt.tikicdn.com/ts/product/56/a8/b0/f2c28121986ce407c49f2a8d288690aa.jpg, https://salt.tikicdn.com/ts/product/b3/dd/8c/c4e424d25b0d2476ff39544c47b6f397.jpg","https://salt.tikicdn.com/cache/w1200/ts/product/56/a8/b0/f2c28121986ce407c49f2a8d288690aa.jpg, https://salt.tikicdn.com/cache/w1200/ts/product/b3/dd/8c/c4e424d25b0d2476ff39544c47b6f397.jpg","https://salt.tikicdn.com/cache/w300/ts/product/56/a8/b0/f2c28121986ce407c49f2a8d288690aa.jpg, https://salt.tikicdn.com/cache/w300/ts/product/b3/dd/8c/c4e424d25b0d2476ff39544c47b6f397.jpg","https://salt.tikicdn.com/cache/200x280/ts/product/56/a8/b0/f2c28121986ce407c49f2a8d288690aa.jpg, https://salt.tikicdn.com/cache/200x280/ts/product/b3/dd/8c/c4e424d25b0d2476ff39544c47b6f397.jpg","https://salt.tikicdn.com/cache/200x280/ts/product/56/a8/b0/f2c28121986ce407c49f2a8d288690aa.jpg, https://salt.tikicdn.com/cache/200x280/ts/product/b3/dd/8c/c4e424d25b0d2476ff39544c47b6f397.jpg",1000,0
277570392,Card đồ họa Nvidia Quadro RTX A2000 12GB GDDR6 PCIe 4.0 - Hàng Chính Hãng,16500000,Specifications GPU FeaturesNVIDIA RTX A2000 | A2000 12GBGPU Memory6 GB | 12 GB GDDR6 with error-correction code (ECC)Display Ports4x mini DisplayPort 1.4Max Power Consu...,"Specifications GPU Features NVIDIA RTX A2000 | A2000 12GB GPU Memory 6 GB | 12 GB GDDR6 with error-correction code (ECC) Display Ports 4x mini DisplayPort 1.4 Max Power Consumption 70 W Graphics Bus PCI Express Gen 4 x 16 Form Factor 2.7” (H) x 6.6” (L) Dual Slot Thermal Active VR Ready Yes Giá sản phẩm trên Tiki đã bao gồm thuế theo luật hiện hành. Bên cạnh đó, tuỳ vào loại sản phẩm, hình thức và địa chỉ giao hàng mà có thể phát sinh thêm chi phí khác như phí vận chuyển, phụ phí hàng cồng kềnh, thuế nhập khẩu (đối với đơn hàng giao từ nước ngoài có giá trị trên 1 triệu đồng).....",0,0,https://salt.tikicdn.com/ts/product/71/63/74/3edf516cb65be6e69404bbd46a9d57f2.PNG,https://salt.tikicdn.com/cache/w1200/ts/product/71/63/74/3edf516cb65be6e69404bbd46a9d57f2.PNG,https://salt.tikicdn.com/cache/w300/ts/product/71/63/74/3edf516cb65be6e69404bbd46a9d57f2.PNG,https://salt.tikicdn.com/cache/200x280/ts/product/71/63/74/3edf516cb65be6e69404bbd46a9d57f2.PNG,https://salt.tikicdn.com/cache/200x280/ts/product/71/63/74/3edf516cb65be6e69404bbd46a9d57f2.PNG,1000,0
277570259,NVIDIA Geforce RTX3080Ti GDDR6X PCIe Gen 4.0 - Blower/Passive - Hàng chính hãng,26000000,Product SpecificationsSpecificationDescriptionProduct Name GEFORCE RTX 3080 Ti AI PASSIVEGPU Architecture NVIDIA Ampere GPU(GA102)Physical dimensions 111mmx264mm; 2 slotCUDA Cores 10240GPU clocksBase ...,"Product Specifications Specification Description Product Name GEFORCE RTX 3080 Ti AI PASSIVE GPU Architecture NVIDIA Ampere GPU(GA102) Physical dimensions 111mmx264mm; 2 slot CUDA Cores 10240 GPU clocks Base 1365 MHz Boost 1665 MHz VBIOS UEFI Supported PCI Express interface PCI Express 4.0 ×16 Display connectors 2x DisplayPort connectors (1.4a) 1 x HDMI(2.1) Multi Monitor 4 Power connectors and headers PCIe power connectors: Two 8-pin OpenGL 4.6 DirectX Capability DirectX 12 Ultimate NVIDIA NVLink YES Decoder(NVIDIA GPU) HEVC/H.264/VP9/VC1/MPEG-1,2,4 Total graphics power (TGP) 350 W PCI IDs Device ID: 2208 Vendor ID:10DE Sub-Vendor ID:10DE Sub-System ID:27A0 Specification Description Memory Size 12G GDDR6X Memory clock 19 Gbps Memory bus width 384 bits Memory bandwidth Up to 912 GB/s Support Information Operating System Support  Microsoft Windows 10 64-bit , Windows 8 64-bit and Windows 7 64-bit,  Linux 64-bit System Requirements  PCI Express-compliant motherboard with one dual-width x16 graphics slot  750 W or greater system power supply  1.5 GB available hard-disk space  8 GB system memory (16GB recommended)  Microsoft Windows 10 64-bit (April 2018 Update or later), Windows 7 64-bit, Linux 64-bit  Two 8-pin supplementary power connectors Certificates and Agencies  Conformité Européenne (CE)  RoHS Package Content  GEFORCE RTX 3080 Ti AI PASSIVE  BULK Packing  8-pin power Cable x 2 Giá sản phẩm trên Tiki đã bao gồm thuế theo luật hiện hành. Bên cạnh đó, tuỳ vào loại sản phẩm, hình thức và địa chỉ giao hàng mà có thể phát sinh thêm chi phí khác như phí vận chuyển, phụ phí hàng cồng kềnh, thuế nhập khẩu (đối với đơn hàng giao từ nước ngoài có giá trị trên 1 triệu đồng).....",0,0,"https://salt.tikicdn.com/ts/product/92/2b/f3/43ec50eb659f089caea14d1efecccf01.jpg, https://salt.tikicdn.com/ts/product/4b/a8/c9/397d0474893089122393e79882bae6de.jpg, https://salt.tikicdn.com/ts/product/e3/49/18/f7deb6f2fb36346764eafca3490512f6.jpg","https://salt.tikicdn.com/cache/w1200/ts/product/92/2b/f3/43ec50eb659f089caea14d1efecccf01.jpg, https://salt.tikicdn.com/cache/w1200/ts/product/4b/a8/c9/397d0474893089122393e79882bae6de.jpg, https://salt.tikicdn.com/cache/w1200/ts/product/e3/49/18/f7deb6f2fb36346764eafca3490512f6.jpg","https://salt.tikicdn.com/cache/w300/ts/product/92/2b/f3/43ec50eb659f089caea14d1efecccf01.jpg, https://salt.tikicdn.com/cache/w300/ts/product/4b/a8/c9/397d0474893089122393e79882bae6de.jpg, https://salt.tikicdn.com/cache/w300/ts/product/e3/49/18/f7deb6f2fb36346764eafca3490512f6.jpg","https://salt.tikicdn.com/cache/200x280/ts/product/92/2b/f3/43ec50eb659f089caea14d1efecccf01.jpg, https://salt.tikicdn.com/cache/200x280/ts/product/4b/a8/c9/397d0474893089122393e79882bae6de.jpg, https://salt.tikicdn.com/cache/200x280/ts/product/e3/49/18/f7deb6f2fb36346764eafca3490512f6.jpg","https://salt.tikicdn.com/cache/200x280/ts/product/92/2b/f3/43ec50eb659f089caea14d1efecccf01.jpg, https://salt.tikicdn.com/cache/200x280/ts/product/4b/a8/c9/397d0474893089122393e79882bae6de.jpg, https://salt.tikicdn.com/cache/200x280/ts/product/e3/49/18/f7deb6f2fb36346764eafca3490512f6.jpg",1000,0
277570240,Card đồ họa Nvidia A2 Ampere 16GB GDDR6 PCIe 4.0 - Hàng chính hãng,36000000,Technical Specifications Peak FP324.5 TFTF32 Tensor Core9 TF | 18 TF¹BFLOAT16 Tensor Core18 TF | 36 TF¹Peak FP16 Tensor Core18 TF | 36 TF¹Peak INT8 Tensor Core36...,"Technical Specifications Peak FP32 4.5 TF TF32 Tensor Core 9 TF | 18 TF¹ BFLOAT16 Tensor Core 18 TF | 36 TF¹ Peak FP16 Tensor Core 18 TF | 36 TF¹ Peak INT8 Tensor Core 36 TOPS | 72 TOPS¹ Peak INT4 Tensor Core 72 TOPS | 144 TOPS¹ RT Cores 10 Media engines 1 video encoder 2 video decoders (includes AV1 decode) GPU memory 16GB GDDR6 GPU memory bandwidth 200GB/s Interconnect PCIe Gen4 x8 Form factor 1-slot, low-profile PCIe Max thermal design power (TDP) 40–60W (configurable) Virtual GPU (vGPU) software support ² NVIDIA Virtual PC (vPC), NVIDIA Virtual Applications (vApps), NVIDIA RTX Virtual Workstation (vWS), NVIDIA AI Enterprise, NVIDIA Virtual Compute Server (vCS) Giá sản phẩm trên Tiki đã bao gồm thuế theo luật hiện hành. Bên cạnh đó, tuỳ vào loại sản phẩm, hình thức và địa chỉ giao hàng mà có thể phát sinh thêm chi phí khác như phí vận chuyển, phụ phí hàng cồng kềnh, thuế nhập khẩu (đối với đơn hàng giao từ nước ngoài có giá trị trên 1 triệu đồng).....",0,0,"https://salt.tikicdn.com/ts/product/25/b2/1f/b89d171b33c963c3f360a7d7f641a803.PNG, https://salt.tikicdn.com/ts/product/da/a2/5f/7433ace0ed92d800b42477bdbe08e760.jpg, https://salt.tikicdn.com/ts/product/5e/69/73/100dd0bb83ebb555412262348203c8c0.jpg, https://salt.tikicdn.com/ts/product/fd/c3/5e/de6ca239a4825d07c27ec438ed47cdc5.jpg, https://salt.tikicdn.com/ts/product/00/2f/ed/87799c3a6d698b2f41a2e9a9314c1c2e.jpg, https://salt.tikicdn.com/ts/product/fc/c8/a3/cadfb0e81579005d4dff1c4c57d1e97a.jpg","https://salt.tikicdn.com/cache/w1200/ts/product/25/b2/1f/b89d171b33c963c3f360a7d7f641a803.PNG, https://salt.tikicdn.com/cache/w1200/ts/product/da/a2/5f/7433ace0ed92d800b42477bdbe08e760.jpg, https://salt.tikicdn.com/cache/w1200/ts/product/5e/69/73/100dd0bb83ebb555412262348203c8c0.jpg, https://salt.tikicdn.com/cache/w1200/ts/product/fd/c3/5e/de6ca239a4825d07c27ec438ed47cdc5.jpg, https://salt.tikicdn.com/cache/w1200/ts/product/00/2f/ed/87799c3a6d698b2f41a2e9a9314c1c2e.jpg, https://salt.tikicdn.com/cache/w1200/ts/product/fc/c8/a3/cadfb0e81579005d4dff1c4c57d1e97a.jpg","https://salt.tikicdn.com/cache/w300/ts/product/25/b2/1f/b89d171b33c963c3f360a7d7f641a803.PNG, https://salt.tikicdn.com/cache/w300/ts/product/da/a2/5f/7433ace0ed92d800b42477bdbe08e760.jpg, https://salt.tikicdn.com/cache/w300/ts/product/5e/69/73/100dd0bb83ebb555412262348203c8c0.jpg, https://salt.tikicdn.com/cache/w300/ts/product/fd/c3/5e/de6ca239a4825d07c27ec438ed47cdc5.jpg, https://salt.tikicdn.com/cache/w300/ts/product/00/2f/ed/87799c3a6d698b2f41a2e9a9314c1c2e.jpg, https://salt.tikicdn.com/cache/w300/ts/product/fc/c8/a3/cadfb0e81579005d4dff1c4c57d1e97a.jpg","https://salt.tikicdn.com/cache/200x280/ts/product/25/b2/1f/b89d171b33c963c3f360a7d7f641a803.PNG, https://salt.tikicdn.com/cache/200x280/ts/product/da/a2/5f/7433ace0ed92d800b42477bdbe08e760.jpg, https://salt.tikicdn.com/cache/200x280/ts/product/5e/69/73/100dd0bb83ebb555412262348203c8c0.jpg, https://salt.tikicdn.com/cache/200x280/ts/product/fd/c3/5e/de6ca239a4825d07c27ec438ed47cdc5.jpg, https://salt.tikicdn.com/cache/200x280/ts/product/00/2f/ed/87799c3a6d698b2f41a2e9a9314c1c2e.jpg, https://salt.tikicdn.com/cache/200x280/ts/product/fc/c8/a3/cadfb0e81579005d4dff1c4c57d1e97a.jpg","https://salt.tikicdn.com/cache/200x280/ts/product/25/b2/1f/b89d171b33c963c3f360a7d7f641a803.PNG, https://salt.tikicdn.com/cache/200x280/ts/product/da/a2/5f/7433ace0ed92d800b42477bdbe08e760.jpg, https://salt.tikicdn.com/cache/200x280/ts/product/5e/69/73/100dd0bb83ebb555412262348203c8c0.jpg, https://salt.tikicdn.com/cache/200x280/ts/product/fd/c3/5e/de6ca239a4825d07c27ec438ed47cdc5.jpg, https://salt.tikicdn.com/cache/200x280/ts/product/00/2f/ed/87799c3a6d698b2f41a2e9a9314c1c2e.jpg, https://salt.tikicdn.com/cache/200x280/ts/product/fc/c8/a3/cadfb0e81579005d4dff1c4c57d1e97a.jpg",1000,0
277568242,Card đồ họa Nvidia RTX 4000 ADA 20GB GDDR6 - Hàng Chính Hãng,44000000,"Thông tin sản phẩm GPU NVIDIA RTX4000 ADA 20GB GDDR6 PCIe 4.0Performance for endless possibilities. The NVIDIA RTX 4000 Ada Generation is the most powerful single-slot GPU for professionals, provi...","Thông tin sản phẩm GPU NVIDIA RTX4000 ADA 20GB GDDR6 PCIe 4.0 Performance for endless possibilities. The NVIDIA RTX 4000 Ada Generation is the most powerful single-slot GPU for professionals, providing massive breakthroughs in speed and power efficiency to tackle demanding creative, design, and engineering workflows from the desktop. Harnessing the latest-generation RT Cores, Tensor Cores, and CUDA cores alongside 20GB of graphics memory, RTX 4000 empowers professionals to create intricate product engineering, visionary cityscapes, and immersive entertainment. Specifications GPU Memory 20GB GDDR6 with error-correction code (ECC) Display Ports 4x DisplayPort 1.4a Max Power Consumption 130W Graphics Bus PCIe Gen4 x 16 Form Factor 4.4” H x 9.5” L, single slot Thermal Active VR Ready Yes Giá sản phẩm trên Tiki đã bao gồm thuế theo luật hiện hành. Bên cạnh đó, tuỳ vào loại sản phẩm, hình thức và địa chỉ giao hàng mà có thể phát sinh thêm chi phí khác như phí vận chuyển, phụ phí hàng cồng kềnh, thuế nhập khẩu (đối với đơn hàng giao từ nước ngoài có giá trị trên 1 triệu đồng).....",0,0,https://salt.tikicdn.com/ts/product/02/0e/1b/f1465e94a7d230f4ea91e9f0c98ef4a5.PNG,https://salt.tikicdn.com/cache/w1200/ts/product/02/0e/1b/f1465e94a7d230f4ea91e9f0c98ef4a5.PNG,https://salt.tikicdn.com/cache/w300/ts/product/02/0e/1b/f1465e94a7d230f4ea91e9f0c98ef4a5.PNG,https://salt.tikicdn.com/cache/200x280/ts/product/02/0e/1b/f1465e94a7d230f4ea91e9f0c98ef4a5.PNG,https://salt.tikicdn.com/cache/200x280/ts/product/02/0e/1b/f1465e94a7d230f4ea91e9f0c98ef4a5.PNG,1000,0
160821459,Card màn hình GIGABYTE GeForce GT 1030 2GB GDDR5 OC (GV-N1030OC-2GI) - Hàng chính hãng,2450000,"Card màn hình Gigabyte GT 1030 OC-2GI (2GB GDDR5, 64-bit, DVI+HDMI)Hàng người dùng nâng cấp dư ra, ngoại hình đẹp keng như mớiShop bảo hành 1 tháng....","Card màn hình Gigabyte GT 1030 OC-2GI (2GB GDDR5, 64-bit, DVI+HDMI) Hàng người dùng nâng cấp dư ra, ngoại hình đẹp keng như mới Shop bảo hành 1 tháng. Giá sản phẩm trên Tiki đã bao gồm thuế theo luật hiện hành. Bên cạnh đó, tuỳ vào loại sản phẩm, hình thức và địa chỉ giao hàng mà có thể phát sinh thêm chi phí khác như phí vận chuyển, phụ phí hàng cồng kềnh, thuế nhập khẩu (đối với đơn hàng giao từ nước ngoài có giá trị trên 1 triệu đồng).....",5,1,"https://salt.tikicdn.com/ts/product/01/2e/06/a23c4f5afd2dba2c4a1979b5b757ed44.jpg, https://salt.tikicdn.com/ts/product/1d/14/13/3a28ef3b45892314945512625f9e6da8.jpg, https://salt.tikicdn.com/ts/product/62/54/9d/51e4225b1cf0fa7d4ad488fd4068ad6e.jpg, https://salt.tikicdn.com/ts/product/85/f8/68/a3b604b2b44abf14c4f8188e71931217.jpg, https://salt.tikicdn.com/ts/product/a6/c1/87/d0e1c117edd2b46d414d1053ae1c8053.jpg","https://salt.tikicdn.com/cache/w1200/ts/product/01/2e/06/a23c4f5afd2dba2c4a1979b5b757ed44.jpg, https://salt.tikicdn.com/cache/w1200/ts/product/1d/14/13/3a28ef3b45892314945512625f9e6da8.jpg, https://salt.tikicdn.com/cache/w1200/ts/product/62/54/9d/51e4225b1cf0fa7d4ad488fd4068ad6e.jpg, https://salt.tikicdn.com/cache/w1200/ts/product/85/f8/68/a3b604b2b44abf14c4f8188e71931217.jpg, https://salt.tikicdn.com/cache/w1200/ts/product/a6/c1/87/d0e1c117edd2b46d414d1053ae1c8053.jpg","https://salt.tikicdn.com/cache/w300/ts/product/01/2e/06/a23c4f5afd2dba2c4a1979b5b757ed44.jpg, https://salt.tikicdn.com/cache/w300/ts/product/1d/14/13/3a28ef3b45892314945512625f9e6da8.jpg, https://salt.tikicdn.com/cache/w300/ts/product/62/54/9d/51e4225b1cf0fa7d4ad488fd4068ad6e.jpg, https://salt.tikicdn.com/cache/w300/ts/product/85/f8/68/a3b604b2b44abf14c4f8188e71931217.jpg, https://salt.tikicdn.com/cache/w300/ts/product/a6/c1/87/d0e1c117edd2b46d414d1053ae1c8053.jpg","https://salt.tikicdn.com/cache/200x280/ts/product/01/2e/06/a23c4f5afd2dba2c4a1979b5b757ed44.jpg, https://salt.tikicdn.com/cache/200x280/ts/product/1d/14/13/3a28ef3b45892314945512625f9e6da8.jpg, https://salt.tikicdn.com/cache/200x280/ts/product/62/54/9d/51e4225b1cf0fa7d4ad488fd4068ad6e.jpg, https://salt.tikicdn.com/cache/200x280/ts/product/85/f8/68/a3b604b2b44abf14c4f8188e71931217.jpg, https://salt.tikicdn.com/cache/200x280/ts/product/a6/c1/87/d0e1c117edd2b46d414d1053ae1c8053.jpg","https://salt.tikicdn.com/cache/200x280/ts/product/01/2e/06/a23c4f5afd2dba2c4a1979b5b757ed44.jpg, https://salt.tikicdn.com/cache/200x280/ts/product/1d/14/13/3a28ef3b45892314945512625f9e6da8.jpg, https://salt.tikicdn.com/cache/200x280/ts/product/62/54/9d/51e4225b1cf0fa7d4ad488fd4068ad6e.jpg, https://salt.tikicdn.com/cache/200x280/ts/product/85/f8/68/a3b604b2b44abf14c4f8188e71931217.jpg, https://salt.tikicdn.com/cache/200x280/ts/product/a6/c1/87/d0e1c117edd2b46d414d1053ae1c8053.jpg",1000,1
