id,name,price,short_description,description,rating_average,review_count,image_base_url,image_large_url,image_medium_url,image_small_url,image_thumbnail_url,stock,quantity_sold
277593506,Cổng chuyển đổi TP-Link 6-in-1 USB-C UH6120C - Hàng chính hãng,1099000,"Cổng chuyển đổi 6-in-1 tích hợp nhiều tính năng trong một thiết bị nhỏ gọnCổng USB-C to HDMI hỗ trợ độ phân giải lên đến 4K, kết nối màn hình, TV dễ dàng2 cổng USB 3.0 truyền tải dữ liệu nhanh chón...","Cổng chuyển đổi 6-in-1 tích hợp nhiều tính năng trong một thiết bị nhỏ gọn Cổng USB-C to HDMI hỗ trợ độ phân giải lên đến 4K, kết nối màn hình, TV dễ dàng 2 cổng USB 3.0 truyền tải dữ liệu nhanh chóng, tương thích với nhiều thiết bị ngoại vi Cổng Ethernet Gigabit cung cấp kết nối mạng có dây nhanh chóng và ổn định Cổng SD và microSD tiện lợi cho việc chuyển dữ liệu từ thẻ nhớ vào thiết bị Thiết kế nhỏ gọn, di động dễ dàng mang theo khi đi công tác hoặc du lịch Chất liệu bền bỉ, chống trầy xước giúp bảo vệ sản phẩm trong suốt quá trình sử dụng Tương thích với nhiều thiết bị như laptop, máy tính bảng, điện thoại hỗ trợ USB-C Cắm và sử dụng, không cần cài đặt thêm phần mềm dễ dàng kết nối và sử dụng ngay lập tức Thương hiệu TP-Link uy tín chất lượng đảm bảo, bảo hành chính hãng LƯU Ý KHI MUA HÀNG Cảm ơn quý khách đã quan tâm đến sản phẩm bên shop, quý khách vui lòng dành ít thời gian đọc kĩ các thông tin sau: Shop nhận đổi trả trong trường hợp hàng sai mẫu, size, màu do shop gửi. Bên shop chỉ giải quyết khiếu nại khi quý khách có video clip khi mở/nhận hàng. Sản phẩm cần bảo hành khách chịu phí vận chuyển đến shop hoặc trung tâm bảo hành Khách hàng có nhu cầu xuất hóa đơn VAT, vui lòng liên hệ với gian hàng trực tiếp qua tin nhắn khi đơn hàng được giao thành công. Trong một số trường hợp sản phẩm đã được kích hoạt bảo hành tham gia chương trình khuyến mãi có giá tốt nhất cho khách hàng, vì vậy sản phẩm được bảo hành thông qua nhà bán hàng. Vui lòng chat với shop để được hỗ trợ thêm thông tin. Không nhận đổi trả khi sản phẩm bị hư hại do tác động ngoại lực từ người mua như móp, bể, trầy xước, nổ điện, rớt nước, rách tem bảo hành, không đầy đủ phụ kiện và hộp. Vì lượng hàng hoá nhiều shop không nhận đổi trả trong trường hợp khách không thích, không ưng màu, chất liệu; quý khách vui lòng đọc kĩ mô tả và xem hình ảnh cụ thể; nếu cần hãy chat với shop để được tư vấn. Giá sản phẩm trên Tiki đã bao gồm thuế theo luật hiện hành. Bên cạnh đó, tuỳ vào loại sản phẩm, hình thức và địa chỉ giao hàng mà có thể phát sinh thêm chi phí khác như phí vận chuyển, phụ phí hàng cồng kềnh, thuế nhập khẩu (đối với đơn hàng giao từ nước ngoài có giá trị trên 1 triệu đồng).....",0,0,"https://salt.tikicdn.com/ts/product/72/2f/10/e626ffc75a390989cc05d7448ff60c32.jpg, https://salt.tikicdn.com/ts/product/77/bf/0a/ea80ffeb1db935306c5cbb0637cc9419.jpg, https://salt.tikicdn.com/ts/product/cf/86/cf/42234023c02b64329cb89006e0b40097.jpg, https://salt.tikicdn.com/ts/product/e5/b1/7d/c659cd17ca77399a3206826ceeef46fa.jpg, https://salt.tikicdn.com/ts/product/39/7f/77/c6e3d43ae479e857b6ac9117b4327ae6.jpg, https://salt.tikicdn.com/ts/product/ec/81/c8/755276a997337cbe3fef0a5d89ebfc37.jpg, https://salt.tikicdn.com/ts/product/0a/4a/dd/6d9fdd7a09520c8206715b65090a3b6c.jpg, https://salt.tikicdn.com/ts/product/0b/16/79/cf9d206f2ebfa2007e4161f491b43e34.jpg, https://salt.tikicdn.com/ts/product/58/3a/a6/101d60a7216df4217a69a48253cea91d.jpg, https://salt.tikicdn.com/ts/product/a0/54/aa/41862f94afcc7b1d88e07171d9135757.jpg","https://salt.tikicdn.com/cache/w1200/ts/product/72/2f/10/e626ffc75a390989cc05d7448ff60c32.jpg, https://salt.tikicdn.com/cache/w1200/ts/product/77/bf/0a/ea80ffeb1db935306c5cbb0637cc9419.jpg, https://salt.tikicdn.com/cache/w1200/ts/product/cf/86/cf/42234023c02b64329cb89006e0b40097.jpg, https://salt.tikicdn.com/cache/w1200/ts/product/e5/b1/7d/c659cd17ca77399a3206826ceeef46fa.jpg, https://salt.tikicdn.com/cache/w1200/ts/product/39/7f/77/c6e3d43ae479e857b6ac9117b4327ae6.jpg, https://salt.tikicdn.com/cache/w1200/ts/product/ec/81/c8/755276a997337cbe3fef0a5d89ebfc37.jpg, https://salt.tikicdn.com/cache/w1200/ts/product/0a/4a/dd/6d9fdd7a09520c8206715b65090a3b6c.jpg, https://salt.tikicdn.com/cache/w1200/ts/product/0b/16/79/cf9d206f2ebfa2007e4161f491b43e34.jpg, https://salt.tikicdn.com/cache/w1200/ts/product/58/3a/a6/101d60a7216df4217a69a48253cea91d.jpg, https://salt.tikicdn.com/cache/w1200/ts/product/a0/54/aa/41862f94afcc7b1d88e07171d9135757.jpg","https://salt.tikicdn.com/cache/w300/ts/product/72/2f/10/e626ffc75a390989cc05d7448ff60c32.jpg, https://salt.tikicdn.com/cache/w300/ts/product/77/bf/0a/ea80ffeb1db935306c5cbb0637cc9419.jpg, https://salt.tikicdn.com/cache/w300/ts/product/cf/86/cf/42234023c02b64329cb89006e0b40097.jpg, https://salt.tikicdn.com/cache/w300/ts/product/e5/b1/7d/c659cd17ca77399a3206826ceeef46fa.jpg, https://salt.tikicdn.com/cache/w300/ts/product/39/7f/77/c6e3d43ae479e857b6ac9117b4327ae6.jpg, https://salt.tikicdn.com/cache/w300/ts/product/ec/81/c8/755276a997337cbe3fef0a5d89ebfc37.jpg, https://salt.tikicdn.com/cache/w300/ts/product/0a/4a/dd/6d9fdd7a09520c8206715b65090a3b6c.jpg, https://salt.tikicdn.com/cache/w300/ts/product/0b/16/79/cf9d206f2ebfa2007e4161f491b43e34.jpg, https://salt.tikicdn.com/cache/w300/ts/product/58/3a/a6/101d60a7216df4217a69a48253cea91d.jpg, https://salt.tikicdn.com/cache/w300/ts/product/a0/54/aa/41862f94afcc7b1d88e07171d9135757.jpg","https://salt.tikicdn.com/cache/200x280/ts/product/72/2f/10/e626ffc75a390989cc05d7448ff60c32.jpg, https://salt.tikicdn.com/cache/200x280/ts/product/77/bf/0a/ea80ffeb1db935306c5cbb0637cc9419.jpg, https://salt.tikicdn.com/cache/200x280/ts/product/cf/86/cf/42234023c02b64329cb89006e0b40097.jpg, https://salt.tikicdn.com/cache/200x280/ts/product/e5/b1/7d/c659cd17ca77399a3206826ceeef46fa.jpg, https://salt.tikicdn.com/cache/200x280/ts/product/39/7f/77/c6e3d43ae479e857b6ac9117b4327ae6.jpg, https://salt.tikicdn.com/cache/200x280/ts/product/ec/81/c8/755276a997337cbe3fef0a5d89ebfc37.jpg, https://salt.tikicdn.com/cache/200x280/ts/product/0a/4a/dd/6d9fdd7a09520c8206715b65090a3b6c.jpg, https://salt.tikicdn.com/cache/200x280/ts/product/0b/16/79/cf9d206f2ebfa2007e4161f491b43e34.jpg, https://salt.tikicdn.com/cache/200x280/ts/product/58/3a/a6/101d60a7216df4217a69a48253cea91d.jpg, https://salt.tikicdn.com/cache/200x280/ts/product/a0/54/aa/41862f94afcc7b1d88e07171d9135757.jpg","https://salt.tikicdn.com/cache/200x280/ts/product/72/2f/10/e626ffc75a390989cc05d7448ff60c32.jpg, https://salt.tikicdn.com/cache/200x280/ts/product/77/bf/0a/ea80ffeb1db935306c5cbb0637cc9419.jpg, https://salt.tikicdn.com/cache/200x280/ts/product/cf/86/cf/42234023c02b64329cb89006e0b40097.jpg, https://salt.tikicdn.com/cache/200x280/ts/product/e5/b1/7d/c659cd17ca77399a3206826ceeef46fa.jpg, https://salt.tikicdn.com/cache/200x280/ts/product/39/7f/77/c6e3d43ae479e857b6ac9117b4327ae6.jpg, https://salt.tikicdn.com/cache/200x280/ts/product/ec/81/c8/755276a997337cbe3fef0a5d89ebfc37.jpg, https://salt.tikicdn.com/cache/200x280/ts/product/0a/4a/dd/6d9fdd7a09520c8206715b65090a3b6c.jpg, https://salt.tikicdn.com/cache/200x280/ts/product/0b/16/79/cf9d206f2ebfa2007e4161f491b43e34.jpg, https://salt.tikicdn.com/cache/200x280/ts/product/58/3a/a6/101d60a7216df4217a69a48253cea91d.jpg, https://salt.tikicdn.com/cache/200x280/ts/product/a0/54/aa/41862f94afcc7b1d88e07171d9135757.jpg",1000,0
275886253,SOAIY Card Chuyển Đổi PCI-E PCI Express To SVHS AV S-Video (Trắng) - Hàng Nhập Khẩu,925000,"Bus PCI-E, tương thích với Windows Plug and Play (PNP), dễ cài đặtKích thước cửa sổ hình ảnh có thể tùy chỉnh theo ý muốn và có thể hiển thị toàn màn hìnhHình ảnh được chụp động được lưu dưới dạng hìn...","Bus PCI-E, tương thích với Windows Plug and Play (PNP), dễ cài đặt Kích thước cửa sổ hình ảnh có thể tùy chỉnh theo ý muốn và có thể hiển thị toàn màn hình Hình ảnh được chụp động được lưu dưới dạng hình ảnh tĩnh, cung cấp nhiều định dạng lưu như BMP, JPG, PCX, GIF, TIF, TGA, Cung cấp khả năng chụp ảnh AVI động, chụp và lưu kích thước hình ảnh theo ý muốn Tương thích với kiến ​​trúc phần mềm VFW của Windows và chế độ WDM, cung cấp gói phát triển thứ cấp đầy đủ chức năng, có thể được sử dụng rộng rãi trong phát triển hệ thống trong ngân hàng, cộng đồng, giao thông vận tải, giám sát nông nghiệp và truyền thông từ xa Tên: Thẻ mở rộng PCIE Loại: Thẻ mở rộng PCIE sang AV Độ phân giải: 640x480 Chip: CX25800-11Z Màu sắc: Trắng Chất liệu: Nhựa Giá sản phẩm trên Tiki đã bao gồm thuế theo luật hiện hành. Bên cạnh đó, tuỳ vào loại sản phẩm, hình thức và địa chỉ giao hàng mà có thể phát sinh thêm chi phí khác như phí vận chuyển, phụ phí hàng cồng kềnh, thuế nhập khẩu (đối với đơn hàng giao từ nước ngoài có giá trị trên 1 triệu đồng).....",0,0,"https://salt.tikicdn.com/ts/product/d4/6d/65/c63b0b27887d6dc45560a1be938dd2c3.jpg, https://salt.tikicdn.com/ts/product/b3/dc/c9/4faf96f47b7213803fa677f69a97ead0.jpg, https://salt.tikicdn.com/ts/product/2f/9a/ac/34dcffdf1eb16e8c0c7e9d6ea0127d5c.jpg, https://salt.tikicdn.com/ts/product/36/d6/3c/4e92318171f1cad27a9225740f02afcb.jpg, https://salt.tikicdn.com/ts/product/e8/e0/d6/afe9767e4d9483991d04a63fc886e59d.jpg, https://salt.tikicdn.com/ts/product/8a/93/4d/5032430f801472e5cfde80b7a24fadec.jpg","https://salt.tikicdn.com/cache/w1200/ts/product/d4/6d/65/c63b0b27887d6dc45560a1be938dd2c3.jpg, https://salt.tikicdn.com/cache/w1200/ts/product/b3/dc/c9/4faf96f47b7213803fa677f69a97ead0.jpg, https://salt.tikicdn.com/cache/w1200/ts/product/2f/9a/ac/34dcffdf1eb16e8c0c7e9d6ea0127d5c.jpg, https://salt.tikicdn.com/cache/w1200/ts/product/36/d6/3c/4e92318171f1cad27a9225740f02afcb.jpg, https://salt.tikicdn.com/cache/w1200/ts/product/e8/e0/d6/afe9767e4d9483991d04a63fc886e59d.jpg, https://salt.tikicdn.com/cache/w1200/ts/product/8a/93/4d/5032430f801472e5cfde80b7a24fadec.jpg","https://salt.tikicdn.com/cache/w300/ts/product/d4/6d/65/c63b0b27887d6dc45560a1be938dd2c3.jpg, https://salt.tikicdn.com/cache/w300/ts/product/b3/dc/c9/4faf96f47b7213803fa677f69a97ead0.jpg, https://salt.tikicdn.com/cache/w300/ts/product/2f/9a/ac/34dcffdf1eb16e8c0c7e9d6ea0127d5c.jpg, https://salt.tikicdn.com/cache/w300/ts/product/36/d6/3c/4e92318171f1cad27a9225740f02afcb.jpg, https://salt.tikicdn.com/cache/w300/ts/product/e8/e0/d6/afe9767e4d9483991d04a63fc886e59d.jpg, https://salt.tikicdn.com/cache/w300/ts/product/8a/93/4d/5032430f801472e5cfde80b7a24fadec.jpg","https://salt.tikicdn.com/cache/200x280/ts/product/d4/6d/65/c63b0b27887d6dc45560a1be938dd2c3.jpg, https://salt.tikicdn.com/cache/200x280/ts/product/b3/dc/c9/4faf96f47b7213803fa677f69a97ead0.jpg, https://salt.tikicdn.com/cache/200x280/ts/product/2f/9a/ac/34dcffdf1eb16e8c0c7e9d6ea0127d5c.jpg, https://salt.tikicdn.com/cache/200x280/ts/product/36/d6/3c/4e92318171f1cad27a9225740f02afcb.jpg, https://salt.tikicdn.com/cache/200x280/ts/product/e8/e0/d6/afe9767e4d9483991d04a63fc886e59d.jpg, https://salt.tikicdn.com/cache/200x280/ts/product/8a/93/4d/5032430f801472e5cfde80b7a24fadec.jpg","https://salt.tikicdn.com/cache/200x280/ts/product/d4/6d/65/c63b0b27887d6dc45560a1be938dd2c3.jpg, https://salt.tikicdn.com/cache/200x280/ts/product/b3/dc/c9/4faf96f47b7213803fa677f69a97ead0.jpg, https://salt.tikicdn.com/cache/200x280/ts/product/2f/9a/ac/34dcffdf1eb16e8c0c7e9d6ea0127d5c.jpg, https://salt.tikicdn.com/cache/200x280/ts/product/36/d6/3c/4e92318171f1cad27a9225740f02afcb.jpg, https://salt.tikicdn.com/cache/200x280/ts/product/e8/e0/d6/afe9767e4d9483991d04a63fc886e59d.jpg, https://salt.tikicdn.com/cache/200x280/ts/product/8a/93/4d/5032430f801472e5cfde80b7a24fadec.jpg",1000,0
138831381,Card Mở Rộng 4 Cổng USB 3.0 Orico PME-4U - Hàng Chính Hãng,450000," TÍNH NĂNG NỔI BẬT - Card mở rộng 4 cổng USB 3.0 - Hỗ trợ khe cắm PCI-e 3.0 Host Interface. - Đầu ra: 4 cổng USB 3.0 - Hỗ trợ hệ điều hành: Windows 7/8/10, Linux    ...","TÍNH NĂNG NỔI BẬT - Card mở rộng 4 cổng USB 3.0 - Hỗ trợ khe cắm PCI-e 3.0 Host Interface. - Đầu ra: 4 cổng USB 3.0 - Hỗ trợ hệ điều hành: Windows 7/8/10, Linux Giá sản phẩm trên Tiki đã bao gồm thuế theo luật hiện hành. Bên cạnh đó, tuỳ vào loại sản phẩm, hình thức và địa chỉ giao hàng mà có thể phát sinh thêm chi phí khác như phí vận chuyển, phụ phí hàng cồng kềnh, thuế nhập khẩu (đối với đơn hàng giao từ nước ngoài có giá trị trên 1 triệu đồng).....",0,0,"https://salt.tikicdn.com/ts/product/2f/11/80/3cacb24ee6fc7a9718bf7abcedc3a59d.jpg, https://salt.tikicdn.com/ts/product/d1/d4/62/a1b4a178f5d5ed59745e762e9e909a6b.jpg, https://salt.tikicdn.com/ts/product/65/1e/82/148db186b1cf2256eed4fe70c2861cf5.jpg, https://salt.tikicdn.com/ts/product/f3/94/41/bb341ceff5c7c70f2e6939e3055b7d0e.jpg, https://salt.tikicdn.com/ts/product/e6/9a/64/4bdae99e168c9bc1b5f32c9776666d2a.jpg","https://salt.tikicdn.com/cache/w1200/ts/product/2f/11/80/3cacb24ee6fc7a9718bf7abcedc3a59d.jpg, https://salt.tikicdn.com/cache/w1200/ts/product/d1/d4/62/a1b4a178f5d5ed59745e762e9e909a6b.jpg, https://salt.tikicdn.com/cache/w1200/ts/product/65/1e/82/148db186b1cf2256eed4fe70c2861cf5.jpg, https://salt.tikicdn.com/cache/w1200/ts/product/f3/94/41/bb341ceff5c7c70f2e6939e3055b7d0e.jpg, https://salt.tikicdn.com/cache/w1200/ts/product/e6/9a/64/4bdae99e168c9bc1b5f32c9776666d2a.jpg","https://salt.tikicdn.com/cache/w300/ts/product/2f/11/80/3cacb24ee6fc7a9718bf7abcedc3a59d.jpg, https://salt.tikicdn.com/cache/w300/ts/product/d1/d4/62/a1b4a178f5d5ed59745e762e9e909a6b.jpg, https://salt.tikicdn.com/cache/w300/ts/product/65/1e/82/148db186b1cf2256eed4fe70c2861cf5.jpg, https://salt.tikicdn.com/cache/w300/ts/product/f3/94/41/bb341ceff5c7c70f2e6939e3055b7d0e.jpg, https://salt.tikicdn.com/cache/w300/ts/product/e6/9a/64/4bdae99e168c9bc1b5f32c9776666d2a.jpg","https://salt.tikicdn.com/cache/200x280/ts/product/2f/11/80/3cacb24ee6fc7a9718bf7abcedc3a59d.jpg, https://salt.tikicdn.com/cache/200x280/ts/product/d1/d4/62/a1b4a178f5d5ed59745e762e9e909a6b.jpg, https://salt.tikicdn.com/cache/200x280/ts/product/65/1e/82/148db186b1cf2256eed4fe70c2861cf5.jpg, https://salt.tikicdn.com/cache/200x280/ts/product/f3/94/41/bb341ceff5c7c70f2e6939e3055b7d0e.jpg, https://salt.tikicdn.com/cache/200x280/ts/product/e6/9a/64/4bdae99e168c9bc1b5f32c9776666d2a.jpg","https://salt.tikicdn.com/cache/200x280/ts/product/2f/11/80/3cacb24ee6fc7a9718bf7abcedc3a59d.jpg, https://salt.tikicdn.com/cache/200x280/ts/product/d1/d4/62/a1b4a178f5d5ed59745e762e9e909a6b.jpg, https://salt.tikicdn.com/cache/200x280/ts/product/65/1e/82/148db186b1cf2256eed4fe70c2861cf5.jpg, https://salt.tikicdn.com/cache/200x280/ts/product/f3/94/41/bb341ceff5c7c70f2e6939e3055b7d0e.jpg, https://salt.tikicdn.com/cache/200x280/ts/product/e6/9a/64/4bdae99e168c9bc1b5f32c9776666d2a.jpg",1000,0
131407786,"Network card Supermicro AOC-STG-i2T (2x RJ45, 10GbE)_Hàng nhập khẩu",11000000,"Thông tin sản phẩm Network card Supermicro AOC-STG-i2T (2x RJ45, 10GbE)Overview:10 Gigabit Dual-Port PCI-E x8 Ethernet Card, w/ 10GBase-T, Based on Intel X540 - Low-Profile, RoHS Compliant 6/6, Inte...","Thông tin sản phẩm Network card Supermicro AOC-STG-i2T (2x RJ45, 10GbE) Overview:10 Gigabit Dual-Port PCI-E x8 Ethernet Card, w/ 10GBase-T, Based on Intel X540 - Low-Profile, RoHS Compliant 6/6, Intel 82598EB Chipset, PB-Free (OEM, Bundled with Supermicro System ONLY) • RoHS compliant 6/6 • Dual RJ45 Connectors • iSCSI Remote Boot Support • Operating Systems (NOSs) • Intel QuickData Technology • Load Balancing on Multiple CPUs • PCI Express 2.1 (2.5GT/s or 5GT/s) • Fibre Channel over Ethernet (FCoE) • Support the most popular Network • Jumbo Frames Support up to 15.5KB • Low-Profile, Short Length Standard Form Factor • VMDq, Next-Generation VMDq, and PC-SIG SR-IOV for Virtualized Environments Giá sản phẩm trên Tiki đã bao gồm thuế theo luật hiện hành. Bên cạnh đó, tuỳ vào loại sản phẩm, hình thức và địa chỉ giao hàng mà có thể phát sinh thêm chi phí khác như phí vận chuyển, phụ phí hàng cồng kềnh, thuế nhập khẩu (đối với đơn hàng giao từ nước ngoài có giá trị trên 1 triệu đồng).....",0,0,https://salt.tikicdn.com/ts/product/c2/7a/74/88de7e84335cd23b2fcf7e1e807e9e81.jpg,https://salt.tikicdn.com/cache/w1200/ts/product/c2/7a/74/88de7e84335cd23b2fcf7e1e807e9e81.jpg,https://salt.tikicdn.com/cache/w300/ts/product/c2/7a/74/88de7e84335cd23b2fcf7e1e807e9e81.jpg,https://salt.tikicdn.com/cache/200x280/ts/product/c2/7a/74/88de7e84335cd23b2fcf7e1e807e9e81.jpg,https://salt.tikicdn.com/cache/200x280/ts/product/c2/7a/74/88de7e84335cd23b2fcf7e1e807e9e81.jpg,1000,0
131405337,"Network card Supermicro AOC-STGN-i2S (2x SFP+, 10GbE)_Hàng nhập khẩu",11000000,"Thông tin sản phẩm Network card Supermicro AOC-STGN-i2S (2x SFP+, 10GbE)General• Intel 82599EN 10GbE controller (AOC-STGN-i1S) / Intel 82599ES 10GbEcontroller (AOC-STGN-i2S)• Standard low-profil...","Thông tin sản phẩm Network card Supermicro AOC-STGN-i2S (2x SFP+, 10GbE) General • Intel 82599EN 10GbE controller (AOC-STGN-i1S) / Intel 82599ES 10GbE controller (AOC-STGN-i2S) • Standard low-profile form factor • Single SFP+ port (AOC-STGN-i1S) • Dual SFP+ ports (AOC-STGN-i2S) • PCI-E 2.0 x8 (5GT/s) • Load balancing on multiple CPUs • iSCSI remote boot support • Fibre Channel over Ethernet (FCoE) Support • Intel PROSet Utility for Windows Device Manager I/O Features • Intel QuickData Technology: DMA engine that enhances data acceleration and lowers CPU usage • Direct Cache Access (DCA) to avoid cache misses • MSI-X support to minimize the overhead of interrupts allowing load-balancing between multiple cores/CPUs • Tx/ IP, SCTP, TCP and UDP checksum offloading capabilities (IPv4, IPv6) • Receive and Transmit Side Scaling for Windows environments and Scalable I/O for Linux environments Giá sản phẩm trên Tiki đã bao gồm thuế theo luật hiện hành. Bên cạnh đó, tuỳ vào loại sản phẩm, hình thức và địa chỉ giao hàng mà có thể phát sinh thêm chi phí khác như phí vận chuyển, phụ phí hàng cồng kềnh, thuế nhập khẩu (đối với đơn hàng giao từ nước ngoài có giá trị trên 1 triệu đồng).....",0,0,https://salt.tikicdn.com/ts/product/43/0b/85/e0ab57bf22f047bde9a9b1ff832caeac.jpg,https://salt.tikicdn.com/cache/w1200/ts/product/43/0b/85/e0ab57bf22f047bde9a9b1ff832caeac.jpg,https://salt.tikicdn.com/cache/w300/ts/product/43/0b/85/e0ab57bf22f047bde9a9b1ff832caeac.jpg,https://salt.tikicdn.com/cache/200x280/ts/product/43/0b/85/e0ab57bf22f047bde9a9b1ff832caeac.jpg,https://salt.tikicdn.com/cache/200x280/ts/product/43/0b/85/e0ab57bf22f047bde9a9b1ff832caeac.jpg,1000,0
131405230,Supermicro AOC-TSR-FS SFP+ Transceiver_Hàng nhập khẩu,1500000,Thông tin sản phẩm Supermicro AOC-TSR-FS SFP+ TransceiverOverview:SFP+ transceiver module for short range fiber cables (up to 300m)Specifications:  Main SpecificationsWeight9.28 oz...,"Thông tin sản phẩm Supermicro AOC-TSR-FS SFP+ Transceiver Overview:SFP+ transceiver module for short range fiber cables (up to 300m) Specifications: Main Specifications Weight 9.28 oz Device type SFP+ Module Networking Connectivity Technology Multi-mode Optical Fiber 10GBase-X Data Transfer Rate 10 Gbps Gigabit Ethernet Expansion / Connectivity Interfaces 1 x 10GBase-X Network Miscellaneous Designed For Data Networking, Optical Network Supermicro Computer AOC-CTG-i2S Module Giá sản phẩm trên Tiki đã bao gồm thuế theo luật hiện hành. Bên cạnh đó, tuỳ vào loại sản phẩm, hình thức và địa chỉ giao hàng mà có thể phát sinh thêm chi phí khác như phí vận chuyển, phụ phí hàng cồng kềnh, thuế nhập khẩu (đối với đơn hàng giao từ nước ngoài có giá trị trên 1 triệu đồng).....",0,0,https://salt.tikicdn.com/ts/product/38/d1/79/895a3b2068f9c87842b151782663b3d3.jpg,https://salt.tikicdn.com/cache/w1200/ts/product/38/d1/79/895a3b2068f9c87842b151782663b3d3.jpg,https://salt.tikicdn.com/cache/w300/ts/product/38/d1/79/895a3b2068f9c87842b151782663b3d3.jpg,https://salt.tikicdn.com/cache/200x280/ts/product/38/d1/79/895a3b2068f9c87842b151782663b3d3.jpg,https://salt.tikicdn.com/cache/200x280/ts/product/38/d1/79/895a3b2068f9c87842b151782663b3d3.jpg,1000,0
131405030,Supermicro AOC-MGP-I2M_Hàng nhập khẩu,2700000,• Super I/O Module (SIOM) Form Factor• Intel i350 GbE controller• Dual RJ45 Ports• VMDq and SR-IOV for Virtualized Environments• Jumbo Frames support• Energy Efficient Ethernet (EEE)• iSCSI Remo...,"• Super I/O Module (SIOM) Form Factor • Intel i350 GbE controller • Dual RJ45 Ports • VMDq and SR-IOV for Virtualized Environments • Jumbo Frames support • Energy Efficient Ethernet (EEE) • iSCSI Remote Boot Support • PXE Boot Support • Support for most Network Operating Systems • Asset Management Features • NC-SI for Remote Management • RoHS compliant 6/6 Giá sản phẩm trên Tiki đã bao gồm thuế theo luật hiện hành. Bên cạnh đó, tuỳ vào loại sản phẩm, hình thức và địa chỉ giao hàng mà có thể phát sinh thêm chi phí khác như phí vận chuyển, phụ phí hàng cồng kềnh, thuế nhập khẩu (đối với đơn hàng giao từ nước ngoài có giá trị trên 1 triệu đồng).....",0,0,https://salt.tikicdn.com/ts/product/74/b3/26/0d56cbe0569cea1aef7c0eed781b03f6.jpg,https://salt.tikicdn.com/cache/w1200/ts/product/74/b3/26/0d56cbe0569cea1aef7c0eed781b03f6.jpg,https://salt.tikicdn.com/cache/w300/ts/product/74/b3/26/0d56cbe0569cea1aef7c0eed781b03f6.jpg,https://salt.tikicdn.com/cache/200x280/ts/product/74/b3/26/0d56cbe0569cea1aef7c0eed781b03f6.jpg,https://salt.tikicdn.com/cache/200x280/ts/product/74/b3/26/0d56cbe0569cea1aef7c0eed781b03f6.jpg,1000,0
