id,name,price,short_description,description,rating_average,review_count,image_base_url,image_large_url,image_medium_url,image_small_url,image_thumbnail_url,stock,quantity_sold
90474865,"Soundcard XOX K10 10th Jubilee phiên bản tiếng Anh 2021 chuyên hát Thu âm, Livestream Bigo, Facebook",999000,Sound card K10 tiếng Anh phiên bản 2021 hay còn gọi là XOX K10 10th Jubilee là phiên bản nâng cấp của dòng sound card huyền thoại XOX K10 tiếng Trung. K10 chính là 1 trong những dòng sound card đầu ti...,"Sound card K10 tiếng Anh phiên bản 2021 hay còn gọi là XOX K10 10th Jubilee là phiên bản nâng cấp của dòng sound card huyền thoại XOX K10 tiếng Trung. K10 chính là 1 trong những dòng sound card đầu tiên có mặt tại thị trường Việt Nam, tạo nên làn sóng hát karaoke livestream Bigo, FB XOX K10 tiếng Anh 2020 - Sự lựa chọn hoàn hảo - Có thiết kế bên ngoài gần giống với phiên bản K10 tiếng Trung cũ nhưng phần cứng của XOX K10 2021 được cải tiến hoàn toàn. - Nếu ở bản K10 tiếng Trung bạn thường gặp phải lỗi tiếng bị rè khi mở âm lượng hết cỡ sau 1 thời gian sử dụng thì trên XOX K10 10th tiếng Anh này bạn hoàn toàn không cần phải lo lắng về lỗi đó. Chất lượng của K10 2021 hoàn toàn khác biệt, âm thanh hay, sống động, không bị rè dù bạn có chỉnh hết cỡ âm lượng. - Và để đảm bảo người dùng có được trải nghiệm tốt nhất thì trên XOX K10 2021 hãng đã thiết kế cổng livestream kiểu khác đồng thời trang bị sẵn dây livestream dành riêng cho phiên bản này. Tránh tình trạng như trên bản cũ K10 tiếng Trung không có sẵn dây livestream và người dùng phải mua bên ngoài, có khi không tương thích với thiết bị dẫn tới âm thanh đầu ra không hay. - Mặc dù nâng cấp hoàn toàn về phần cứng và trang bị đầy đủ phụ kiện kèm theo nhưng giá của XOX K10 2021 tiếng Anh chỉ cao hơn K10 tiếng Trung cũ 1 ít, xứng đáng là sound card đáng mua nhất trong tầm giá 1tr trở xuống và có chất lượng không hề thua kém gì so với các dòng sound card cao cấp. 4 chế độ sử dụng - Music (logo XOX màu trắng): dùng để nghe nhạc. Ở chế độ này thì micro sẽ bị vô hiệu hóa, bạn chỉ có thể nghe nhạc từ nguồn cấp nhạc (điện thoại, máy tính). - Sing (logo XOX màu xanh dương): dùng để hát karaoke livestream. Đây là chế độ thường được sử dụng nhất. Ở chế độ này khi bạn hát sẽ có độ vang cùng các hiệu ứng khác. - Chat (logo XOX màu xanh lá cây): dùng để trò chuyện. Khi bạn muốn nói chuyện bình thường mà không muốn có tiếng vang thì chuyển sang chế độ này. - MC (logo XOX màu đỏ): dùng để dẫn chương trình. Ở chế độ này khi bạn nói thì tiếng nhạc nền sẽ nhỏ lại, ưu tiên cho giọng nói của bạn. Khi không nói thì tiếng nhạc lại trở lại bình thường. Kết nối đơn giản, dễ sử dụng - Với giao diện bằng tiếng Anh, bạn dễ dàng lắp đặt và sử dụng hơn nhiều so với bản K10 tiếng Trung cũ trước đây. - Bên cạnh đó Góc Nhà Công Nghệ sẽ tặng kèm bạn 1 cuốn hướng dẫn sử dụng bằng tiếng Việt để bạn dễ dùng hơn. Trọn bộ sản phẩm bao gồm - 1 x sound card XOX K10 tiếng Anh 2021 - 1 dây livestream - 1 dây nguồn, kết nối máy tính - 1 dây âm thanh 3.5mm Khác với phiên bản K10 tiếng Trung chỉ có màu đen thì phiên bản K10 tiếng Anh 2021 có 4 màu để bạn lựa chọn theo sở thích của mình bao gồm: màu vàng, màu đen, màu xanh lam và màu hồng. Giá sản phẩm trên Tiki đã bao gồm thuế theo luật hiện hành. Bên cạnh đó, tuỳ vào loại sản phẩm, hình thức và địa chỉ giao hàng mà có thể phát sinh thêm chi phí khác như phí vận chuyển, phụ phí hàng cồng kềnh, thuế nhập khẩu (đối với đơn hàng giao từ nước ngoài có giá trị trên 1 triệu đồng).....",4.2,5,"https://salt.tikicdn.com/ts/product/83/55/dc/8a139db025e2bc7663c3ef1c9fabc088.png, https://salt.tikicdn.com/ts/product/2d/e4/66/440ac8047ce64ac7cf2319728ba1bda5.png, https://salt.tikicdn.com/ts/product/8e/f4/ca/dfec44b5746fa81e28f42bd1c6acbea4.png, https://salt.tikicdn.com/ts/product/aa/ad/6d/3c410b646f1fd827d21811590ebf79c3.png, https://salt.tikicdn.com/ts/product/eb/6d/e2/af3c43b14f7d44c539a6d9dd9975ad25.png","https://salt.tikicdn.com/cache/w1200/ts/product/83/55/dc/8a139db025e2bc7663c3ef1c9fabc088.png, https://salt.tikicdn.com/cache/w1200/ts/product/2d/e4/66/440ac8047ce64ac7cf2319728ba1bda5.png, https://salt.tikicdn.com/cache/w1200/ts/product/8e/f4/ca/dfec44b5746fa81e28f42bd1c6acbea4.png, https://salt.tikicdn.com/cache/w1200/ts/product/aa/ad/6d/3c410b646f1fd827d21811590ebf79c3.png, https://salt.tikicdn.com/cache/w1200/ts/product/eb/6d/e2/af3c43b14f7d44c539a6d9dd9975ad25.png","https://salt.tikicdn.com/cache/w300/ts/product/83/55/dc/8a139db025e2bc7663c3ef1c9fabc088.png, https://salt.tikicdn.com/cache/w300/ts/product/2d/e4/66/440ac8047ce64ac7cf2319728ba1bda5.png, https://salt.tikicdn.com/cache/w300/ts/product/8e/f4/ca/dfec44b5746fa81e28f42bd1c6acbea4.png, https://salt.tikicdn.com/cache/w300/ts/product/aa/ad/6d/3c410b646f1fd827d21811590ebf79c3.png, https://salt.tikicdn.com/cache/w300/ts/product/eb/6d/e2/af3c43b14f7d44c539a6d9dd9975ad25.png","https://salt.tikicdn.com/cache/200x280/ts/product/83/55/dc/8a139db025e2bc7663c3ef1c9fabc088.png, https://salt.tikicdn.com/cache/200x280/ts/product/2d/e4/66/440ac8047ce64ac7cf2319728ba1bda5.png, https://salt.tikicdn.com/cache/200x280/ts/product/8e/f4/ca/dfec44b5746fa81e28f42bd1c6acbea4.png, https://salt.tikicdn.com/cache/200x280/ts/product/aa/ad/6d/3c410b646f1fd827d21811590ebf79c3.png, https://salt.tikicdn.com/cache/200x280/ts/product/eb/6d/e2/af3c43b14f7d44c539a6d9dd9975ad25.png","https://salt.tikicdn.com/cache/200x280/ts/product/83/55/dc/8a139db025e2bc7663c3ef1c9fabc088.png, https://salt.tikicdn.com/cache/200x280/ts/product/2d/e4/66/440ac8047ce64ac7cf2319728ba1bda5.png, https://salt.tikicdn.com/cache/200x280/ts/product/8e/f4/ca/dfec44b5746fa81e28f42bd1c6acbea4.png, https://salt.tikicdn.com/cache/200x280/ts/product/aa/ad/6d/3c410b646f1fd827d21811590ebf79c3.png, https://salt.tikicdn.com/cache/200x280/ts/product/eb/6d/e2/af3c43b14f7d44c539a6d9dd9975ad25.png",1000,5
50367257,Behringer U-PHORIA UMC404HD Audio Interface - Hàng Chính Hãng,4620000,Key Features4 x 4 USB Audio Interface Ideal For Microphones & Instruments24-Bit/192kHz Resolution Provides Professional Sound QualityCompatible With Wide Variety Of Popular Recording Softw...,"Key Features 4 x 4 USB Audio Interface Ideal For Microphones & Instruments 24-Bit/192kHz Resolution Provides Professional Sound Quality Compatible With Wide Variety Of Popular Recording Software 4 x Studio-Grade Midas Mic Preamps Deliver Outstanding Sound Incredibly Robust, Impact-Resistant Metal Housing Giá sản phẩm trên Tiki đã bao gồm thuế theo luật hiện hành. Bên cạnh đó, tuỳ vào loại sản phẩm, hình thức và địa chỉ giao hàng mà có thể phát sinh thêm chi phí khác như phí vận chuyển, phụ phí hàng cồng kềnh, thuế nhập khẩu (đối với đơn hàng giao từ nước ngoài có giá trị trên 1 triệu đồng).....",5,1,"https://salt.tikicdn.com/ts/product/18/f5/9b/404e5d168230f9d49499175650cb1340.jpg, https://salt.tikicdn.com/ts/product/b6/d6/c4/fb60be2402d18a5001440d8458f9726c.jpg, https://salt.tikicdn.com/ts/product/be/06/7b/3c2e4079d07a829dfd9b9f2ec0d66a40.jpg, https://salt.tikicdn.com/ts/product/18/f5/9b/4bd867eede73c66ffd6b6fd154050e1d.jpg, https://salt.tikicdn.com/ts/product/01/0f/87/6a3bca99319332c7f540a5c87e0a53fe.jpg","https://salt.tikicdn.com/cache/w1200/ts/product/18/f5/9b/404e5d168230f9d49499175650cb1340.jpg, https://salt.tikicdn.com/cache/w1200/ts/product/b6/d6/c4/fb60be2402d18a5001440d8458f9726c.jpg, https://salt.tikicdn.com/cache/w1200/ts/product/be/06/7b/3c2e4079d07a829dfd9b9f2ec0d66a40.jpg, https://salt.tikicdn.com/cache/w1200/ts/product/18/f5/9b/4bd867eede73c66ffd6b6fd154050e1d.jpg, https://salt.tikicdn.com/cache/w1200/ts/product/01/0f/87/6a3bca99319332c7f540a5c87e0a53fe.jpg","https://salt.tikicdn.com/cache/w300/ts/product/18/f5/9b/404e5d168230f9d49499175650cb1340.jpg, https://salt.tikicdn.com/cache/w300/ts/product/b6/d6/c4/fb60be2402d18a5001440d8458f9726c.jpg, https://salt.tikicdn.com/cache/w300/ts/product/be/06/7b/3c2e4079d07a829dfd9b9f2ec0d66a40.jpg, https://salt.tikicdn.com/cache/w300/ts/product/18/f5/9b/4bd867eede73c66ffd6b6fd154050e1d.jpg, https://salt.tikicdn.com/cache/w300/ts/product/01/0f/87/6a3bca99319332c7f540a5c87e0a53fe.jpg","https://salt.tikicdn.com/cache/200x280/ts/product/18/f5/9b/404e5d168230f9d49499175650cb1340.jpg, https://salt.tikicdn.com/cache/200x280/ts/product/b6/d6/c4/fb60be2402d18a5001440d8458f9726c.jpg, https://salt.tikicdn.com/cache/200x280/ts/product/be/06/7b/3c2e4079d07a829dfd9b9f2ec0d66a40.jpg, https://salt.tikicdn.com/cache/200x280/ts/product/18/f5/9b/4bd867eede73c66ffd6b6fd154050e1d.jpg, https://salt.tikicdn.com/cache/200x280/ts/product/01/0f/87/6a3bca99319332c7f540a5c87e0a53fe.jpg","https://salt.tikicdn.com/cache/200x280/ts/product/18/f5/9b/404e5d168230f9d49499175650cb1340.jpg, https://salt.tikicdn.com/cache/200x280/ts/product/b6/d6/c4/fb60be2402d18a5001440d8458f9726c.jpg, https://salt.tikicdn.com/cache/200x280/ts/product/be/06/7b/3c2e4079d07a829dfd9b9f2ec0d66a40.jpg, https://salt.tikicdn.com/cache/200x280/ts/product/18/f5/9b/4bd867eede73c66ffd6b6fd154050e1d.jpg, https://salt.tikicdn.com/cache/200x280/ts/product/01/0f/87/6a3bca99319332c7f540a5c87e0a53fe.jpg",1000,1
50366547,Behringer U-Phoria UMC22 USB Audio Interface - Hàng Chính Hãng,1692000,Key FeaturesUltra-Low Latency 2x2 Interface with USB ConnectivityMIDAS Designed Preamp with +48V Phantom PowerCompatible with Mac OS X and Windows ComputersPefect for Recording Vocals and Ins...,"Key Features Ultra-Low Latency 2x2 Interface with USB Connectivity MIDAS Designed Preamp with +48V Phantom Power Compatible with Mac OS X and Windows Computers Pefect for Recording Vocals and Instruments Free Recording, Editing and Podcasting Software Full Description MIDAS-Design Preamps Renowned for their mastery of digital console design, our sister company MIDAS developed the world-class preamps for the UMC204, UMC202 and UMC22 interfaces - and thanks to the available+48 V phantom power, you can even use professional-grade studio condenser mics to create outstanding tracks. 96 kHz Precision You take your tracks seriously,and the U-PHORIA Series respects that,providing your choice of 96 kHz resolution (UMC204/UMC202), or 48 kHz resolution converters (UMC22/UM2), depending on your application. Both sampling rates offer better than CD recording quality for professional results. Convenient Monitoring All U-PHORIA models provide powerful phones output with Level control and Direct Monitor select, Status, Signal and Clip LEDs, and are powered via your computer's USB port so they're ready to go wherever you go. Features 2x2 USB audio interface for recording microphones and instruments Audiophile 48 kHz resolution for professional audio quality Compatible with popular recording software including Avid Pro Tools*, Ableton Live*, Steinberg Cubase*, etc. Streams 2 inputs / 2 outputs with ultra-low latency to your computer, supporting Mac OS X and Windows XP or higher State-of-the-art, MIDAS designed Mic Preamplifier with +48 V phantom power Powerful Phones output with Level control and Direct Monitor select Status, Signal and Clip indications for perfect overview USB port for connection and power ""Built-like-a-tank"", impact-resistant metal chassis High-quality components and exceptionally rugged construction ensure long life Specifications Preamp: 1 x MIDAS Design Input Connectors: Microphone/Line: 1 x XLR/TRS Combo Instrument: 1 x TRS Frequency Response: 10Hz - 30kHz, 0dB/-0.5dB Dynamic Range: 100dB, A-Weighted Impedance: Mic/Line: 3kOhms Instrument: 1MOhms Maximum Input Level: Microphone: +2dBu Line: +22dBu Instrument: +2dBu Sample Rates: 32kHz/44.1kHz/48kHz USB Connector: USB Type B Operating Systems: Mac OS X / Windows XP or Higher Power Consumption: 2.5W Maximum Dimensions: 46.45mm x 163mm x 125mm / 1.8'' x 6.4'' x 4.9'' (H x W x D) Weight: 0.5kg / 1lb Giá sản phẩm trên Tiki đã bao gồm thuế theo luật hiện hành. Bên cạnh đó, tuỳ vào loại sản phẩm, hình thức và địa chỉ giao hàng mà có thể phát sinh thêm chi phí khác như phí vận chuyển, phụ phí hàng cồng kềnh, thuế nhập khẩu (đối với đơn hàng giao từ nước ngoài có giá trị trên 1 triệu đồng).....",3,1,"https://salt.tikicdn.com/ts/product/03/34/9e/c33cb32e0d34ffebb4b716b294df5a2c.jpg, https://salt.tikicdn.com/ts/product/80/53/84/9e4a0ef6aa7a8e52e0626a243168e773.jpg, https://salt.tikicdn.com/ts/product/86/7c/21/a292f37f7fa08fde11e9ef7ccb3b8931.jpg, https://salt.tikicdn.com/ts/product/0f/52/1a/a3f981a3fcc1cf269bb3eaa8638a4083.jpg","https://salt.tikicdn.com/cache/w1200/ts/product/03/34/9e/c33cb32e0d34ffebb4b716b294df5a2c.jpg, https://salt.tikicdn.com/cache/w1200/ts/product/80/53/84/9e4a0ef6aa7a8e52e0626a243168e773.jpg, https://salt.tikicdn.com/cache/w1200/ts/product/86/7c/21/a292f37f7fa08fde11e9ef7ccb3b8931.jpg, https://salt.tikicdn.com/cache/w1200/ts/product/0f/52/1a/a3f981a3fcc1cf269bb3eaa8638a4083.jpg","https://salt.tikicdn.com/cache/w300/ts/product/03/34/9e/c33cb32e0d34ffebb4b716b294df5a2c.jpg, https://salt.tikicdn.com/cache/w300/ts/product/80/53/84/9e4a0ef6aa7a8e52e0626a243168e773.jpg, https://salt.tikicdn.com/cache/w300/ts/product/86/7c/21/a292f37f7fa08fde11e9ef7ccb3b8931.jpg, https://salt.tikicdn.com/cache/w300/ts/product/0f/52/1a/a3f981a3fcc1cf269bb3eaa8638a4083.jpg","https://salt.tikicdn.com/cache/200x280/ts/product/03/34/9e/c33cb32e0d34ffebb4b716b294df5a2c.jpg, https://salt.tikicdn.com/cache/200x280/ts/product/80/53/84/9e4a0ef6aa7a8e52e0626a243168e773.jpg, https://salt.tikicdn.com/cache/200x280/ts/product/86/7c/21/a292f37f7fa08fde11e9ef7ccb3b8931.jpg, https://salt.tikicdn.com/cache/200x280/ts/product/0f/52/1a/a3f981a3fcc1cf269bb3eaa8638a4083.jpg","https://salt.tikicdn.com/cache/200x280/ts/product/03/34/9e/c33cb32e0d34ffebb4b716b294df5a2c.jpg, https://salt.tikicdn.com/cache/200x280/ts/product/80/53/84/9e4a0ef6aa7a8e52e0626a243168e773.jpg, https://salt.tikicdn.com/cache/200x280/ts/product/86/7c/21/a292f37f7fa08fde11e9ef7ccb3b8931.jpg, https://salt.tikicdn.com/cache/200x280/ts/product/0f/52/1a/a3f981a3fcc1cf269bb3eaa8638a4083.jpg",1000,1
33847400,"Combo Phòng Thu Cá Nhân Focusrite Scarlett Solo, 2i2 Studio (Gen 3) - Hàng Nhập Khẩu",6040000,"Focusrite Scarlett Solo Studio (3rd Gen)Là bộ sản phẩm thu âm chất lượng cao đến từ hãng sản xuất thiết bị thu âm nổi tiếng Focusrite, Scarlett Solo Studio ( Gen 3)được trang bị micro condenser Sc...","Focusrite Scarlett Solo Studio (3rd Gen) Là bộ sản phẩm thu âm chất lượng cao đến từ hãng sản xuất thiết bị thu âm nổi tiếng Focusrite, Scarlett Solo Studio ( Gen 3)được trang bị micro condenser Scarlett CM25 MKIII, tai nghe kiểm âm Scarlett HP60 MKIII và Soundcard Scarlett Solo Gen 3 mới nhất, cho âm thanh rõ ràng, mượt mà, với độ phân giải lên tới 192kHz/24 bit. TÍNH NĂNG CƠ BẢN - Bộ sản phẩm bao gồm : Micro condenser Scarlett Studio, Soundcard Scarlett Solo/ 2i2 (Gen 3), Tai kiểm âm Scarlett Studio. - Micro condenser Scarlett Studio với dải tần đáp ứng từ 20 Hz - 20 kHz, cho khả năng tái tạo âm thanh trung thực. - Sound card thu âm Scarlett Solo Gen 3 có tỷ lệ mẫu âm thanh đầu vào lên đến 24-bit / 192 kHz, giảm thiểu độ nhiễu, méo tín hiệu, cho bản thu trung thực nhất. - Hỗ trợ nguồn phantom 48V. - Hỗ trợ đầu ra tai nghe có khả năng kiểm soát được âm thanh trực tiếp từ microphone. - Tai nghe kiểm âm Scarlett Studio thể hiện tốt dải trung và cao, cho phép kiểm âm cả 1 số dòng nhạc cụ như Guitar, Organ.. - Sử dụng nguồn cấp từ cổng USB - Type C, thuận tiện sử dụng. - - Các phần mềm được tặng kèm theo bộ sản phẩm: Avid Pro Tools , Ableton Live Lite , 03 tháng đăng ký Splice Sounds, XLN Audio Addictive, Softube Time and Tone Bundle, Focusrite Red Plug-in Suite, Focusrite Plug-in Collective. BỘ SẢN PHẨM BAO GỒM - 01 Sound card Focusrite Scarlett Solo Gen 3. - 01 Micro Condenser Scarlett CM25. - 01 Tai nghe Scarlett HP60 closed-back. - 01 Cáp Micro XLR-XLR Scarlett (3m). - 01 Cáp USB A-B (1.5m). THÔNG SỐ KỸ THUẬT Connectivity USB Type-C Protocol USB 2.0 Form Factor Desktop Simultaneous I/O 2 x 2 A/D Resolution 24-bit/192 kHz Number of Preamps 1 Phantom Power YES Instrument Inputs 1 Line Inputs 1 Analog Outputs 2 TRS (Balanced) Headphone Outputs 1 Bus Powered YES Interface Dimensions 43.5 X 143.5 X 95.8 mm CM25 Microphone Cardioid/condenser HP60 Microphones Closed-back Focusrite Scarlett 2i2 Studio (3rd Gen) Là bộ sản phẩm thu âm chất lượng cao đến từ hãng sản xuất thiết bị thu âm nổi tiếng Focusrite, Scarlett 2I2 Gen 3 Studio được trang bị micro condenser Scarlett CM25 MKIII, tai nghe kiểm âm Scarlett HP60 MKIII và Soundcard Scarlett 2I2 Gen 3 mới nhất, hỗ trợ 2 cổng Micro combo 48v, cho âm thanh rõ ràng, mượt mà, với độ phân giải lên tới 192kHz/24 bit. TÍNH NĂNG CƠ BẢN - Bộ sản phẩm bao gồm : Micro condenser Scarlett Studio, Soundcard Scarlett Solo/ 2i2 (Gen 3), Tai kiểm âm Scarlett Studio. - Micro condenser Scarlett Studio với dải tần đáp ứng từ 20 Hz - 20 kHz, cho khả năng tái tạo âm thanh trung thực. - Sound card thu âm Scarlett Solo Gen 3 có tỷ lệ mẫu âm thanh đầu vào lên đến 24-bit / 192 kHz, giảm thiểu độ nhiễu, méo tín hiệu, cho bản thu trung thực nhất. - Hỗ trợ nguồn phantom 48V. - Hỗ trợ đầu ra tai nghe có khả năng kiểm soát được âm thanh trực tiếp từ microphone. - Tai nghe kiểm âm Scarlett Studio thể hiện tốt dải trung và cao, cho phép kiểm âm cả 1 số dòng nhạc cụ như Guitar, Organ.. - Sử dụng nguồn cấp từ cổng USB - Type C, thuận tiện sử dụng. - Các phần mềm được tặng kèm theo bộ sản phẩm: Avid Pro Tools , Ableton Live Lite , 03 tháng đăng ký Splice Sounds, XLN Audio Addictive, Softube Time and Tone Bundle, Focusrite Red Plug-in Suite, Focusrite Plug-in Collective. BỘ SẢN PHẨM BAO GỒM - 01 Sound card Focusrite Scarlett 2I2 Gen 3. - 01 Micro Condenser Scarlett CM25. - 01 Tai nghe Scarlett HP60 closed-back. - 01 Cáp Micro XLR-XLR Scarlett (3m). - 01 Cáp USB A-B (1.5m). THÔNG SỐ KỸ THUẬT Connectivity USB Type-C Protocol USB 2.0 Form Factor Desktop Simultaneous I/O 2 x 2 A/D Resolution 24-bit/192 kHz Number of Preamps 2 Phantom Power YES Instrument Inputs 2 Line Inputs 2 Analog Outputs 2 Headphone Outputs 1 Bus Powered YES Interface Dimensions 47.5 X 175 X 98.8 mm CM25 Microphone Cardioid/condenser HP60 Microphones Closed-back Giá sản phẩm trên Tiki đã bao gồm thuế theo luật hiện hành. Bên cạnh đó, tuỳ vào loại sản phẩm, hình thức và địa chỉ giao hàng mà có thể phát sinh thêm chi phí khác như phí vận chuyển, phụ phí hàng cồng kềnh, thuế nhập khẩu (đối với đơn hàng giao từ nước ngoài có giá trị trên 1 triệu đồng).....",4.5,2,"https://salt.tikicdn.com/ts/product/6b/c7/7a/5f8113d75de5d2a54f1774b978ca1533.jpg, https://salt.tikicdn.com/ts/product/f8/a3/1a/e289fa7b632c120120d3fc908da5c947.jpg, https://salt.tikicdn.com/ts/product/b1/2b/19/31bb0f8ce328a13a482453cb7b187214.jpg, https://salt.tikicdn.com/ts/product/b3/eb/6e/ba35429ee58c6f48868aed5f93029159.jpg, https://salt.tikicdn.com/ts/product/e3/a8/e9/3b2c97d5671ddbdbb9f1e29a76f94c07.jpg, https://salt.tikicdn.com/ts/product/96/b9/16/2051ef81a5b8a0da87cf293e7813b650.jpg, https://salt.tikicdn.com/ts/product/7d/b6/cc/b555a4870f7e96ea61ac665ccc4164ac.jpg, https://salt.tikicdn.com/ts/product/28/67/c4/e5fbdfdf2b83b500f1e1c0abc7dd0aa1.jpg, https://salt.tikicdn.com/ts/product/cb/b4/34/8d9e1d4414619f535b2059077cfeb7ea.jpg, https://salt.tikicdn.com/ts/product/28/30/e8/227194e772c3cd0c458d3920f5a294f8.jpg, https://salt.tikicdn.com/ts/product/70/be/a0/56aed41a1405c032283b6b2a1038583a.jpg, https://salt.tikicdn.com/ts/product/55/3b/52/5e23b16979c9b9eddcbaaa330d345301.jpg","https://salt.tikicdn.com/cache/w1200/ts/product/6b/c7/7a/5f8113d75de5d2a54f1774b978ca1533.jpg, https://salt.tikicdn.com/cache/w1200/ts/product/f8/a3/1a/e289fa7b632c120120d3fc908da5c947.jpg, https://salt.tikicdn.com/cache/w1200/ts/product/b1/2b/19/31bb0f8ce328a13a482453cb7b187214.jpg, https://salt.tikicdn.com/cache/w1200/ts/product/b3/eb/6e/ba35429ee58c6f48868aed5f93029159.jpg, https://salt.tikicdn.com/cache/w1200/ts/product/e3/a8/e9/3b2c97d5671ddbdbb9f1e29a76f94c07.jpg, https://salt.tikicdn.com/cache/w1200/ts/product/96/b9/16/2051ef81a5b8a0da87cf293e7813b650.jpg, https://salt.tikicdn.com/cache/w1200/ts/product/7d/b6/cc/b555a4870f7e96ea61ac665ccc4164ac.jpg, https://salt.tikicdn.com/cache/w1200/ts/product/28/67/c4/e5fbdfdf2b83b500f1e1c0abc7dd0aa1.jpg, https://salt.tikicdn.com/cache/w1200/ts/product/cb/b4/34/8d9e1d4414619f535b2059077cfeb7ea.jpg, https://salt.tikicdn.com/cache/w1200/ts/product/28/30/e8/227194e772c3cd0c458d3920f5a294f8.jpg, https://salt.tikicdn.com/cache/w1200/ts/product/70/be/a0/56aed41a1405c032283b6b2a1038583a.jpg, https://salt.tikicdn.com/cache/w1200/ts/product/55/3b/52/5e23b16979c9b9eddcbaaa330d345301.jpg","https://salt.tikicdn.com/cache/w300/ts/product/6b/c7/7a/5f8113d75de5d2a54f1774b978ca1533.jpg, https://salt.tikicdn.com/cache/w300/ts/product/f8/a3/1a/e289fa7b632c120120d3fc908da5c947.jpg, https://salt.tikicdn.com/cache/w300/ts/product/b1/2b/19/31bb0f8ce328a13a482453cb7b187214.jpg, https://salt.tikicdn.com/cache/w300/ts/product/b3/eb/6e/ba35429ee58c6f48868aed5f93029159.jpg, https://salt.tikicdn.com/cache/w300/ts/product/e3/a8/e9/3b2c97d5671ddbdbb9f1e29a76f94c07.jpg, https://salt.tikicdn.com/cache/w300/ts/product/96/b9/16/2051ef81a5b8a0da87cf293e7813b650.jpg, https://salt.tikicdn.com/cache/w300/ts/product/7d/b6/cc/b555a4870f7e96ea61ac665ccc4164ac.jpg, https://salt.tikicdn.com/cache/w300/ts/product/28/67/c4/e5fbdfdf2b83b500f1e1c0abc7dd0aa1.jpg, https://salt.tikicdn.com/cache/w300/ts/product/cb/b4/34/8d9e1d4414619f535b2059077cfeb7ea.jpg, https://salt.tikicdn.com/cache/w300/ts/product/28/30/e8/227194e772c3cd0c458d3920f5a294f8.jpg, https://salt.tikicdn.com/cache/w300/ts/product/70/be/a0/56aed41a1405c032283b6b2a1038583a.jpg, https://salt.tikicdn.com/cache/w300/ts/product/55/3b/52/5e23b16979c9b9eddcbaaa330d345301.jpg","https://salt.tikicdn.com/cache/200x280/ts/product/6b/c7/7a/5f8113d75de5d2a54f1774b978ca1533.jpg, https://salt.tikicdn.com/cache/200x280/ts/product/f8/a3/1a/e289fa7b632c120120d3fc908da5c947.jpg, https://salt.tikicdn.com/cache/200x280/ts/product/b1/2b/19/31bb0f8ce328a13a482453cb7b187214.jpg, https://salt.tikicdn.com/cache/200x280/ts/product/b3/eb/6e/ba35429ee58c6f48868aed5f93029159.jpg, https://salt.tikicdn.com/cache/200x280/ts/product/e3/a8/e9/3b2c97d5671ddbdbb9f1e29a76f94c07.jpg, https://salt.tikicdn.com/cache/200x280/ts/product/96/b9/16/2051ef81a5b8a0da87cf293e7813b650.jpg, https://salt.tikicdn.com/cache/200x280/ts/product/7d/b6/cc/b555a4870f7e96ea61ac665ccc4164ac.jpg, https://salt.tikicdn.com/cache/200x280/ts/product/28/67/c4/e5fbdfdf2b83b500f1e1c0abc7dd0aa1.jpg, https://salt.tikicdn.com/cache/200x280/ts/product/cb/b4/34/8d9e1d4414619f535b2059077cfeb7ea.jpg, https://salt.tikicdn.com/cache/200x280/ts/product/28/30/e8/227194e772c3cd0c458d3920f5a294f8.jpg, https://salt.tikicdn.com/cache/200x280/ts/product/70/be/a0/56aed41a1405c032283b6b2a1038583a.jpg, https://salt.tikicdn.com/cache/200x280/ts/product/55/3b/52/5e23b16979c9b9eddcbaaa330d345301.jpg","https://salt.tikicdn.com/cache/200x280/ts/product/6b/c7/7a/5f8113d75de5d2a54f1774b978ca1533.jpg, https://salt.tikicdn.com/cache/200x280/ts/product/f8/a3/1a/e289fa7b632c120120d3fc908da5c947.jpg, https://salt.tikicdn.com/cache/200x280/ts/product/b1/2b/19/31bb0f8ce328a13a482453cb7b187214.jpg, https://salt.tikicdn.com/cache/200x280/ts/product/b3/eb/6e/ba35429ee58c6f48868aed5f93029159.jpg, https://salt.tikicdn.com/cache/200x280/ts/product/e3/a8/e9/3b2c97d5671ddbdbb9f1e29a76f94c07.jpg, https://salt.tikicdn.com/cache/200x280/ts/product/96/b9/16/2051ef81a5b8a0da87cf293e7813b650.jpg, https://salt.tikicdn.com/cache/200x280/ts/product/7d/b6/cc/b555a4870f7e96ea61ac665ccc4164ac.jpg, https://salt.tikicdn.com/cache/200x280/ts/product/28/67/c4/e5fbdfdf2b83b500f1e1c0abc7dd0aa1.jpg, https://salt.tikicdn.com/cache/200x280/ts/product/cb/b4/34/8d9e1d4414619f535b2059077cfeb7ea.jpg, https://salt.tikicdn.com/cache/200x280/ts/product/28/30/e8/227194e772c3cd0c458d3920f5a294f8.jpg, https://salt.tikicdn.com/cache/200x280/ts/product/70/be/a0/56aed41a1405c032283b6b2a1038583a.jpg, https://salt.tikicdn.com/cache/200x280/ts/product/55/3b/52/5e23b16979c9b9eddcbaaa330d345301.jpg",1000,2
