id,name,price,short_description,description,rating_average,review_count,image_base_url,image_large_url,image_medium_url,image_small_url,image_thumbnail_url,stock,quantity_sold
15302872,Sound card hát online cho máy tính XOX ES102 - Hàng chính hãng,774000," là dòng , được sử dụng với phần mềm điều khiển âm thanh kỹ thuật số với dụng các hiệu ứng âm thanh VST chuyên nghiệp.  phục vụ tốt cho nhu cầu thu âm giọng hát, nghe nhạc, voice chat và hát karaoke o...","là dòng , được sử dụng với phần mềm điều khiển âm thanh kỹ thuật số với dụng các hiệu ứng âm thanh VST chuyên nghiệp. phục vụ tốt cho nhu cầu thu âm giọng hát, nghe nhạc, voice chat và hát karaoke online. Sử dụng các hiệu ứng âm thanh VST dễ dàng và hiệu quả chỉ với một cái nhấp chuột. Công nghệ giới hạn điện áp đầu vào đảm bảo âm thanh không bị vỡ. Hỗ trợ hai micro sử dụng cùng lúc. Phần mềm điều khiển mạnh mẽ, sử dụng dễ dàng. Hỗ trợ ghi âm và , máy tính bảng. Thoải mái tận hưởng âm nhạc hoặc phim với âm thanh stereo chất lượng cao. Âm thanh to và rõ ràng khi nói chuyện trực tuyến, chat skype Hiệu ứng reverb FXS thời gian thực tiện lợi khi hát trực tuyến. Tương thích hệ thống Windows XP/Vista/7/8 Giá sản phẩm trên Tiki đã bao gồm thuế theo luật hiện hành. Bên cạnh đó, tuỳ vào loại sản phẩm, hình thức và địa chỉ giao hàng mà có thể phát sinh thêm chi phí khác như phí vận chuyển, phụ phí hàng cồng kềnh, thuế nhập khẩu (đối với đơn hàng giao từ nước ngoài có giá trị trên 1 triệu đồng).....",3.7,3,"https://salt.tikicdn.com/ts/product/c4/b0/30/4ceec570e31f36f734b0c68a5dcab4f9.jpg, https://salt.tikicdn.com/ts/product/c2/38/67/e8ccac6ce2e8f22528f8124bf1ee2e96.jpg, https://salt.tikicdn.com/ts/product/db/14/45/faa77494dfc8f74931ba90fbf6f70a52.jpg, https://salt.tikicdn.com/ts/product/e7/69/87/32fa1f8ee8051ef2df186076a44533e7.jpg, https://salt.tikicdn.com/ts/product/b8/ea/4b/0f3f87c63a9b084a02009ed88b6521d4.jpg, https://salt.tikicdn.com/ts/product/05/f2/94/8ae94e396345573e0cb165322a508c2c.jpg, https://salt.tikicdn.com/ts/product/e2/41/73/6d1ffd8e6f070e59f05816976a57101c.jpg","https://salt.tikicdn.com/cache/w1200/ts/product/c4/b0/30/4ceec570e31f36f734b0c68a5dcab4f9.jpg, https://salt.tikicdn.com/cache/w1200/ts/product/c2/38/67/e8ccac6ce2e8f22528f8124bf1ee2e96.jpg, https://salt.tikicdn.com/cache/w1200/ts/product/db/14/45/faa77494dfc8f74931ba90fbf6f70a52.jpg, https://salt.tikicdn.com/cache/w1200/ts/product/e7/69/87/32fa1f8ee8051ef2df186076a44533e7.jpg, https://salt.tikicdn.com/cache/w1200/ts/product/b8/ea/4b/0f3f87c63a9b084a02009ed88b6521d4.jpg, https://salt.tikicdn.com/cache/w1200/ts/product/05/f2/94/8ae94e396345573e0cb165322a508c2c.jpg, https://salt.tikicdn.com/cache/w1200/ts/product/e2/41/73/6d1ffd8e6f070e59f05816976a57101c.jpg","https://salt.tikicdn.com/cache/w300/ts/product/c4/b0/30/4ceec570e31f36f734b0c68a5dcab4f9.jpg, https://salt.tikicdn.com/cache/w300/ts/product/c2/38/67/e8ccac6ce2e8f22528f8124bf1ee2e96.jpg, https://salt.tikicdn.com/cache/w300/ts/product/db/14/45/faa77494dfc8f74931ba90fbf6f70a52.jpg, https://salt.tikicdn.com/cache/w300/ts/product/e7/69/87/32fa1f8ee8051ef2df186076a44533e7.jpg, https://salt.tikicdn.com/cache/w300/ts/product/b8/ea/4b/0f3f87c63a9b084a02009ed88b6521d4.jpg, https://salt.tikicdn.com/cache/w300/ts/product/05/f2/94/8ae94e396345573e0cb165322a508c2c.jpg, https://salt.tikicdn.com/cache/w300/ts/product/e2/41/73/6d1ffd8e6f070e59f05816976a57101c.jpg","https://salt.tikicdn.com/cache/200x280/ts/product/c4/b0/30/4ceec570e31f36f734b0c68a5dcab4f9.jpg, https://salt.tikicdn.com/cache/200x280/ts/product/c2/38/67/e8ccac6ce2e8f22528f8124bf1ee2e96.jpg, https://salt.tikicdn.com/cache/200x280/ts/product/db/14/45/faa77494dfc8f74931ba90fbf6f70a52.jpg, https://salt.tikicdn.com/cache/200x280/ts/product/e7/69/87/32fa1f8ee8051ef2df186076a44533e7.jpg, https://salt.tikicdn.com/cache/200x280/ts/product/b8/ea/4b/0f3f87c63a9b084a02009ed88b6521d4.jpg, https://salt.tikicdn.com/cache/200x280/ts/product/05/f2/94/8ae94e396345573e0cb165322a508c2c.jpg, https://salt.tikicdn.com/cache/200x280/ts/product/e2/41/73/6d1ffd8e6f070e59f05816976a57101c.jpg","https://salt.tikicdn.com/cache/200x280/ts/product/c4/b0/30/4ceec570e31f36f734b0c68a5dcab4f9.jpg, https://salt.tikicdn.com/cache/200x280/ts/product/c2/38/67/e8ccac6ce2e8f22528f8124bf1ee2e96.jpg, https://salt.tikicdn.com/cache/200x280/ts/product/db/14/45/faa77494dfc8f74931ba90fbf6f70a52.jpg, https://salt.tikicdn.com/cache/200x280/ts/product/e7/69/87/32fa1f8ee8051ef2df186076a44533e7.jpg, https://salt.tikicdn.com/cache/200x280/ts/product/b8/ea/4b/0f3f87c63a9b084a02009ed88b6521d4.jpg, https://salt.tikicdn.com/cache/200x280/ts/product/05/f2/94/8ae94e396345573e0cb165322a508c2c.jpg, https://salt.tikicdn.com/cache/200x280/ts/product/e2/41/73/6d1ffd8e6f070e59f05816976a57101c.jpg",1000,3
11600987,Behringer XENYX Q802S - Mixer Thu Âm 8 Cổng Vào - Hàng Nhập Khẩu,3034000,"Bàn mixer nhỏ Behringer XENYX Q802S với 8 đầu vào (2 mic, 2 stereo) cho phép tạo được âm thanh chất lượng cao nhờ có XENYX Mic Preamp trên bo mạch và hệ thống EQ của nước Anh.TÍNH NĂNG CƠ BẢNMi...","Bàn mixer nhỏ Behringer XENYX Q802S với 8 đầu vào (2 mic, 2 stereo) cho phép tạo được âm thanh chất lượng cao nhờ có XENYX Mic Preamp trên bo mạch và hệ thống EQ của nước Anh. TÍNH NĂNG CƠ BẢN Mixer Behringer XENYX Q802S với đầu trộn headroom hiệu suất cao cho tiếng ồn cực thấp. 2 cổng mono đầu tiên của XENYX Mic Preamps có chất lượng so sánh được với các đèn pream-store độc ​​lập. Máy nén tín hiệu âm thanh được tích hợp loại dùng cho phòng thu với chức năng ""một núm"" chỉnh cực nhanh và đèn LED điều khiển cho âm thanh và nhạc cụ chuyên nghiệp. Mixer thu âm Behringer XENYX được tích hợp giao diện âm thanh nổi USB / Audio để kết nối trực tiếp với máy tính. Đi kèm phần mềm ghi âm, chỉnh sửa và podcasting miễn phí mở rộng 150 công cụ / hiệu ứng plug-ins tại behringer.com Các EQ 3-band giống với các bàn mixer cổ điển nước Anh cho âm thanh ấm áp. Hỗ trợ FX send và AUX RETURN STERO để kết hợp các bộ FX bên ngoài gửi đến từng kênh. Kết hợp đầu ra chính cộng với phòng điều khiển riêng, tai nghe và đầu ra 2-Track. Đầu vào 2 track in được gán cho đầu ra chính hoặc phòng điều khuyển/ tai nghe đầu ra. Sản phẩm được thiết kế tại Đức và được bảo hành 3 năm trên toàn cầu bởi các đối tác của hãng. BỘ SẢN PHẨM BAO GỒM - 01 Bàn mixer chuyên nghiệp Behringer XENYX Q802S - 01 Dây cáp nguồn. - 01 Dây cable usb audio. - 01 Bộ sách hướng dẫn sử dụng tiếng anh. THÔNG SỐ KỸ THUẬT Hãng Behringer Model XENYX Q802S Total  Of Inputs Total: 8 Mono: 2 Stereo: 2 USB 2-in / 2-out Mix / Effect Buses 2 Mic Preamps Xenyx mic preamps: 2 Phantom Power +48V EQ Section Mono channel: 3-band Stereo channel: 3-band Compressor 2 AUX Sends 1 AUX Returns FX returns: 1 stereo Metering 4 segment LEDs Weight 2.3lb (1.05kg) Package Weight 5.2 lb Box Dimensions (LxWxH) 14.0 x 12.2 x 4.2"" Giá sản phẩm trên Tiki đã bao gồm thuế theo luật hiện hành. Bên cạnh đó, tuỳ vào loại sản phẩm, hình thức và địa chỉ giao hàng mà có thể phát sinh thêm chi phí khác như phí vận chuyển, phụ phí hàng cồng kềnh, thuế nhập khẩu (đối với đơn hàng giao từ nước ngoài có giá trị trên 1 triệu đồng).....",4,1,"https://salt.tikicdn.com/ts/product/bd/50/f1/f6137d63cb5b8eb49e371b2b53b55400.jpg, https://salt.tikicdn.com/ts/product/63/63/8d/75a8e6c119bb7d4fef966a0be248adbf.jpg, https://salt.tikicdn.com/ts/product/19/00/a4/a3a4f72f223da71c1cae63045ed7703a.jpg, https://salt.tikicdn.com/ts/product/95/68/8e/0e4a40f5fb28812678297e98ad11eb69.jpg, https://salt.tikicdn.com/ts/product/c4/b5/fb/7d86d259f00d4459618aa0f95199ba2f.jpg, https://salt.tikicdn.com/ts/product/b4/da/81/391cf4ed3c028e93ea52fa1094315be1.jpg, https://salt.tikicdn.com/ts/product/d9/ca/8c/7accee0fc00353b57121da52aec0cc72.jpg, https://salt.tikicdn.com/ts/product/b8/9f/8e/82a980f0d2a82396f3171a2f7e6699f3.jpg, https://salt.tikicdn.com/ts/product/35/f3/8b/620943ab60552216a1d6815899de54c7.jpg","https://salt.tikicdn.com/cache/w1200/ts/product/bd/50/f1/f6137d63cb5b8eb49e371b2b53b55400.jpg, https://salt.tikicdn.com/cache/w1200/ts/product/63/63/8d/75a8e6c119bb7d4fef966a0be248adbf.jpg, https://salt.tikicdn.com/cache/w1200/ts/product/19/00/a4/a3a4f72f223da71c1cae63045ed7703a.jpg, https://salt.tikicdn.com/cache/w1200/ts/product/95/68/8e/0e4a40f5fb28812678297e98ad11eb69.jpg, https://salt.tikicdn.com/cache/w1200/ts/product/c4/b5/fb/7d86d259f00d4459618aa0f95199ba2f.jpg, https://salt.tikicdn.com/cache/w1200/ts/product/b4/da/81/391cf4ed3c028e93ea52fa1094315be1.jpg, https://salt.tikicdn.com/cache/w1200/ts/product/d9/ca/8c/7accee0fc00353b57121da52aec0cc72.jpg, https://salt.tikicdn.com/cache/w1200/ts/product/b8/9f/8e/82a980f0d2a82396f3171a2f7e6699f3.jpg, https://salt.tikicdn.com/cache/w1200/ts/product/35/f3/8b/620943ab60552216a1d6815899de54c7.jpg","https://salt.tikicdn.com/cache/w300/ts/product/bd/50/f1/f6137d63cb5b8eb49e371b2b53b55400.jpg, https://salt.tikicdn.com/cache/w300/ts/product/63/63/8d/75a8e6c119bb7d4fef966a0be248adbf.jpg, https://salt.tikicdn.com/cache/w300/ts/product/19/00/a4/a3a4f72f223da71c1cae63045ed7703a.jpg, https://salt.tikicdn.com/cache/w300/ts/product/95/68/8e/0e4a40f5fb28812678297e98ad11eb69.jpg, https://salt.tikicdn.com/cache/w300/ts/product/c4/b5/fb/7d86d259f00d4459618aa0f95199ba2f.jpg, https://salt.tikicdn.com/cache/w300/ts/product/b4/da/81/391cf4ed3c028e93ea52fa1094315be1.jpg, https://salt.tikicdn.com/cache/w300/ts/product/d9/ca/8c/7accee0fc00353b57121da52aec0cc72.jpg, https://salt.tikicdn.com/cache/w300/ts/product/b8/9f/8e/82a980f0d2a82396f3171a2f7e6699f3.jpg, https://salt.tikicdn.com/cache/w300/ts/product/35/f3/8b/620943ab60552216a1d6815899de54c7.jpg","https://salt.tikicdn.com/cache/200x280/ts/product/bd/50/f1/f6137d63cb5b8eb49e371b2b53b55400.jpg, https://salt.tikicdn.com/cache/200x280/ts/product/63/63/8d/75a8e6c119bb7d4fef966a0be248adbf.jpg, https://salt.tikicdn.com/cache/200x280/ts/product/19/00/a4/a3a4f72f223da71c1cae63045ed7703a.jpg, https://salt.tikicdn.com/cache/200x280/ts/product/95/68/8e/0e4a40f5fb28812678297e98ad11eb69.jpg, https://salt.tikicdn.com/cache/200x280/ts/product/c4/b5/fb/7d86d259f00d4459618aa0f95199ba2f.jpg, https://salt.tikicdn.com/cache/200x280/ts/product/b4/da/81/391cf4ed3c028e93ea52fa1094315be1.jpg, https://salt.tikicdn.com/cache/200x280/ts/product/d9/ca/8c/7accee0fc00353b57121da52aec0cc72.jpg, https://salt.tikicdn.com/cache/200x280/ts/product/b8/9f/8e/82a980f0d2a82396f3171a2f7e6699f3.jpg, https://salt.tikicdn.com/cache/200x280/ts/product/35/f3/8b/620943ab60552216a1d6815899de54c7.jpg","https://salt.tikicdn.com/cache/200x280/ts/product/bd/50/f1/f6137d63cb5b8eb49e371b2b53b55400.jpg, https://salt.tikicdn.com/cache/200x280/ts/product/63/63/8d/75a8e6c119bb7d4fef966a0be248adbf.jpg, https://salt.tikicdn.com/cache/200x280/ts/product/19/00/a4/a3a4f72f223da71c1cae63045ed7703a.jpg, https://salt.tikicdn.com/cache/200x280/ts/product/95/68/8e/0e4a40f5fb28812678297e98ad11eb69.jpg, https://salt.tikicdn.com/cache/200x280/ts/product/c4/b5/fb/7d86d259f00d4459618aa0f95199ba2f.jpg, https://salt.tikicdn.com/cache/200x280/ts/product/b4/da/81/391cf4ed3c028e93ea52fa1094315be1.jpg, https://salt.tikicdn.com/cache/200x280/ts/product/d9/ca/8c/7accee0fc00353b57121da52aec0cc72.jpg, https://salt.tikicdn.com/cache/200x280/ts/product/b8/9f/8e/82a980f0d2a82396f3171a2f7e6699f3.jpg, https://salt.tikicdn.com/cache/200x280/ts/product/35/f3/8b/620943ab60552216a1d6815899de54c7.jpg",1000,1
11597565,Sound card thu âm Behringer U-PHORIA UMC202HD - Hàng Nhập Khẩu,2900000,"    Getting ConnectedOn the rear panel of the UMC404HD, you’ll find the USB 2.0 port for simple and easy connection to your computer, along with plenty of analo...","Getting Connected On the rear panel of the UMC404HD, you’ll find the USB 2.0 port for simple and easy connection to your computer, along with plenty of analog playback options including ¼"" TRS, RCA and XLR. The UMC404HD also features 4 analog Inserts for use with external effects such as compressors, gates and EQs, etc. Built-in MIDI I/O allows you to connect keyboards and all your favorite outboard MIDI hardware. Tracktion - Record, Edit, Mix and Share Tracktion is one of the world’s fastest and easiest Digital Audio Workstations (DAW) for composing, recording, editing, mixing and sharing your music with the world. Featuring a single-screen interface, and pushing the envelope in design elegance, Tracktion brings together outstanding Pro DAW features, such as dynamic automation, unlimited track count, MIDI recording and support for VST and AU plug-ins. This powerful music production software gives you all the tools of an entire professional-grade recording studio. Learning a DAW has never been easier, thanks to their vast and readily available library of resources. Everything You Need to Sound Amazing The U-Phoria UMC404HD is a powerful 4 input, 4 output USB recording interface featuring genuine MIDAS-designed mic preamps with exceptional 24-Bit/192 kHz high-resolution converters, designed to help your recordings and mixes sound their absolute best. Giá sản phẩm trên Tiki đã bao gồm thuế theo luật hiện hành. Bên cạnh đó, tuỳ vào loại sản phẩm, hình thức và địa chỉ giao hàng mà có thể phát sinh thêm chi phí khác như phí vận chuyển, phụ phí hàng cồng kềnh, thuế nhập khẩu (đối với đơn hàng giao từ nước ngoài có giá trị trên 1 triệu đồng).....",5,1,"https://salt.tikicdn.com/ts/product/4a/9e/1d/58f46c41fee459d6b7ac01e764d41b6e.jpg, https://salt.tikicdn.com/ts/product/3b/51/a1/ad061e2a2f217c61c286d8618ba0f79b.jpg, https://salt.tikicdn.com/ts/product/c3/a4/1e/f744e40d2efefce44910502b802776bc.jpg, https://salt.tikicdn.com/ts/product/32/07/2c/47046266c25c965ab0ee62af96522866.jpg, https://salt.tikicdn.com/ts/product/56/f7/ba/d3b7736fbbd88f0941db9e819c60e1c6.jpg, https://salt.tikicdn.com/ts/product/2e/33/b6/34bdb12c0600459ce6fedc0197e301c7.jpg","https://salt.tikicdn.com/cache/w1200/ts/product/4a/9e/1d/58f46c41fee459d6b7ac01e764d41b6e.jpg, https://salt.tikicdn.com/cache/w1200/ts/product/3b/51/a1/ad061e2a2f217c61c286d8618ba0f79b.jpg, https://salt.tikicdn.com/cache/w1200/ts/product/c3/a4/1e/f744e40d2efefce44910502b802776bc.jpg, https://salt.tikicdn.com/cache/w1200/ts/product/32/07/2c/47046266c25c965ab0ee62af96522866.jpg, https://salt.tikicdn.com/cache/w1200/ts/product/56/f7/ba/d3b7736fbbd88f0941db9e819c60e1c6.jpg, https://salt.tikicdn.com/cache/w1200/ts/product/2e/33/b6/34bdb12c0600459ce6fedc0197e301c7.jpg","https://salt.tikicdn.com/cache/w300/ts/product/4a/9e/1d/58f46c41fee459d6b7ac01e764d41b6e.jpg, https://salt.tikicdn.com/cache/w300/ts/product/3b/51/a1/ad061e2a2f217c61c286d8618ba0f79b.jpg, https://salt.tikicdn.com/cache/w300/ts/product/c3/a4/1e/f744e40d2efefce44910502b802776bc.jpg, https://salt.tikicdn.com/cache/w300/ts/product/32/07/2c/47046266c25c965ab0ee62af96522866.jpg, https://salt.tikicdn.com/cache/w300/ts/product/56/f7/ba/d3b7736fbbd88f0941db9e819c60e1c6.jpg, https://salt.tikicdn.com/cache/w300/ts/product/2e/33/b6/34bdb12c0600459ce6fedc0197e301c7.jpg","https://salt.tikicdn.com/cache/200x280/ts/product/4a/9e/1d/58f46c41fee459d6b7ac01e764d41b6e.jpg, https://salt.tikicdn.com/cache/200x280/ts/product/3b/51/a1/ad061e2a2f217c61c286d8618ba0f79b.jpg, https://salt.tikicdn.com/cache/200x280/ts/product/c3/a4/1e/f744e40d2efefce44910502b802776bc.jpg, https://salt.tikicdn.com/cache/200x280/ts/product/32/07/2c/47046266c25c965ab0ee62af96522866.jpg, https://salt.tikicdn.com/cache/200x280/ts/product/56/f7/ba/d3b7736fbbd88f0941db9e819c60e1c6.jpg, https://salt.tikicdn.com/cache/200x280/ts/product/2e/33/b6/34bdb12c0600459ce6fedc0197e301c7.jpg","https://salt.tikicdn.com/cache/200x280/ts/product/4a/9e/1d/58f46c41fee459d6b7ac01e764d41b6e.jpg, https://salt.tikicdn.com/cache/200x280/ts/product/3b/51/a1/ad061e2a2f217c61c286d8618ba0f79b.jpg, https://salt.tikicdn.com/cache/200x280/ts/product/c3/a4/1e/f744e40d2efefce44910502b802776bc.jpg, https://salt.tikicdn.com/cache/200x280/ts/product/32/07/2c/47046266c25c965ab0ee62af96522866.jpg, https://salt.tikicdn.com/cache/200x280/ts/product/56/f7/ba/d3b7736fbbd88f0941db9e819c60e1c6.jpg, https://salt.tikicdn.com/cache/200x280/ts/product/2e/33/b6/34bdb12c0600459ce6fedc0197e301c7.jpg",1000,1
11596410,Card Sound USB thu âm Behringer U-Phoria UM2 - Hàng Nhập Khẩu,1550000,"192 kHz PrecisionYou take your tracks seriously, and the UMC404HD respects that, providing up to 192 kHz resolution for even the most demanding applications in music as we...","192 kHz Precision You take your tracks seriously, and the UMC404HD respects that, providing up to 192 kHz resolution for even the most demanding applications in music as well as video post production. Work with confidence and accuracy in your favorite recording software for professional results every time. MIDAS - The Legend in Sound Quality Ever since its formation in the 1970s, MIDAS has had a long history of innovation in the world of audio mixing consoles. Employed by the most famous touring acts and installations world-wide, legendary MIDAS consoles such as the XL4 and Heritage H3000 quickly became industry standards. 'Zero-Latency' Monitoring The UMC404HD mix control allows zero-latency direct monitoring, which means musicians can experience their performance clearly – with no delay or lag in the returning signal, resulting in a better performance and recording. A powerful phones output has its own level control and Monitor A/B source select for DJ-style cueing. Getting Connected On the rear panel of the UMC404HD, you’ll find the USB 2.0 port for simple and easy connection to your computer, along with plenty of analog playback options including ¼"" TRS, RCA and XLR. The UMC404HD also features 4 analog Inserts for use with external effects such as compressors, gates and EQs, etc. Built-in MIDI I/O allows you to connect keyboards and all your favorite outboard MIDI hardware. Tracktion - Record, Edit, Mix and Share Tracktion is one of the world’s fastest and easiest Digital Audio Workstations (DAW) for composing, recording, editing, mixing and sharing your music with the world. Featuring a single-screen interface, and pushing the envelope in design elegance, Tracktion brings together outstanding Pro DAW features, such as dynamic automation, unlimited track count, MIDI recording and support for VST and AU plug-ins. This powerful music production software gives you all the tools of an entire professional-grade recording studio. Learning a DAW has never been easier, thanks to their vast and readily available library of resources. Everything You Need to Sound Amazing The U-Phoria UMC404HD is a powerful 4 input, 4 output USB recording interface featuring genuine MIDAS-designed mic preamps with exceptional 24-Bit/192 kHz high-resolution converters, designed to help your recordings and mixes sound their absolute best. Giá sản phẩm trên Tiki đã bao gồm thuế theo luật hiện hành. Bên cạnh đó, tuỳ vào loại sản phẩm, hình thức và địa chỉ giao hàng mà có thể phát sinh thêm chi phí khác như phí vận chuyển, phụ phí hàng cồng kềnh, thuế nhập khẩu (đối với đơn hàng giao từ nước ngoài có giá trị trên 1 triệu đồng).....",4.5,2,"https://salt.tikicdn.com/ts/product/43/8a/55/89debe8d9bb391e2ab41767b570d0e08.jpg, https://salt.tikicdn.com/ts/product/3a/9e/09/8fe13af0b7bdf014c461a6f2571c582d.jpg, https://salt.tikicdn.com/ts/product/f3/26/05/1016be552011ae34e50da839b74ec3e6.jpg, https://salt.tikicdn.com/ts/product/ad/59/9b/edfa4d55ff2fa4f34b451545b5ee0906.jpg, https://salt.tikicdn.com/ts/product/0b/02/15/c0e54e0060f83ea8980cc28ba6d97650.jpg","https://salt.tikicdn.com/cache/w1200/ts/product/43/8a/55/89debe8d9bb391e2ab41767b570d0e08.jpg, https://salt.tikicdn.com/cache/w1200/ts/product/3a/9e/09/8fe13af0b7bdf014c461a6f2571c582d.jpg, https://salt.tikicdn.com/cache/w1200/ts/product/f3/26/05/1016be552011ae34e50da839b74ec3e6.jpg, https://salt.tikicdn.com/cache/w1200/ts/product/ad/59/9b/edfa4d55ff2fa4f34b451545b5ee0906.jpg, https://salt.tikicdn.com/cache/w1200/ts/product/0b/02/15/c0e54e0060f83ea8980cc28ba6d97650.jpg","https://salt.tikicdn.com/cache/w300/ts/product/43/8a/55/89debe8d9bb391e2ab41767b570d0e08.jpg, https://salt.tikicdn.com/cache/w300/ts/product/3a/9e/09/8fe13af0b7bdf014c461a6f2571c582d.jpg, https://salt.tikicdn.com/cache/w300/ts/product/f3/26/05/1016be552011ae34e50da839b74ec3e6.jpg, https://salt.tikicdn.com/cache/w300/ts/product/ad/59/9b/edfa4d55ff2fa4f34b451545b5ee0906.jpg, https://salt.tikicdn.com/cache/w300/ts/product/0b/02/15/c0e54e0060f83ea8980cc28ba6d97650.jpg","https://salt.tikicdn.com/cache/200x280/ts/product/43/8a/55/89debe8d9bb391e2ab41767b570d0e08.jpg, https://salt.tikicdn.com/cache/200x280/ts/product/3a/9e/09/8fe13af0b7bdf014c461a6f2571c582d.jpg, https://salt.tikicdn.com/cache/200x280/ts/product/f3/26/05/1016be552011ae34e50da839b74ec3e6.jpg, https://salt.tikicdn.com/cache/200x280/ts/product/ad/59/9b/edfa4d55ff2fa4f34b451545b5ee0906.jpg, https://salt.tikicdn.com/cache/200x280/ts/product/0b/02/15/c0e54e0060f83ea8980cc28ba6d97650.jpg","https://salt.tikicdn.com/cache/200x280/ts/product/43/8a/55/89debe8d9bb391e2ab41767b570d0e08.jpg, https://salt.tikicdn.com/cache/200x280/ts/product/3a/9e/09/8fe13af0b7bdf014c461a6f2571c582d.jpg, https://salt.tikicdn.com/cache/200x280/ts/product/f3/26/05/1016be552011ae34e50da839b74ec3e6.jpg, https://salt.tikicdn.com/cache/200x280/ts/product/ad/59/9b/edfa4d55ff2fa4f34b451545b5ee0906.jpg, https://salt.tikicdn.com/cache/200x280/ts/product/0b/02/15/c0e54e0060f83ea8980cc28ba6d97650.jpg",1000,2
