id,name,price,short_description,description,rating_average,review_count,image_base_url,image_large_url,image_medium_url,image_small_url,image_thumbnail_url,stock,quantity_sold
279340678,"Behringer Xenyx 1202SFX - Mixer 12 Kênh USB, FX 100 Preset Dành Cho Livestream, Podcast, Thu Âm - Hàng chính hãng",4700000,"TÍNH NĂNG CƠ BẢNSở hữu mixer analog 12 kênh nhỏ gọn với thiết kế bền bỉ, vận hành ổn định, phù hợp cho phòng thu, livestream, podcast, hội nghị và hệ thống âm thanh biểu diễn.Trang bị 4 preamp micr...","TÍNH NĂNG CƠ BẢN Sở hữu mixer analog 12 kênh nhỏ gọn với thiết kế bền bỉ, vận hành ổn định, phù hợp cho phòng thu, livestream, podcast, hội nghị và hệ thống âm thanh biểu diễn. Trang bị 4 preamp micro XENYX chất lượng cao, hỗ trợ nguồn phantom +48V, giúp micro condenser hoạt động ổn định và cho âm thanh trong trẻo. Tích hợp giao diện USB audio 2x2, cho phép kết nối trực tiếp với máy tính để thu âm, phát lại hoặc livestream dễ dàng. Bộ xử lý hiệu ứng kỹ thuật số Klark Teknik và EQ 3 băng tần trên mỗi kênh, giúp tinh chỉnh âm thanh chi tiết mang đến nhiều hiệu ứng âm thanh chuyên nghiệp cho giọng hát và nhạc cụ. Hỗ trợ nhiều cổng kết nối XLR, 6.35mm, RCA và headphone, thuận tiện khi kết nối micro, nhạc cụ, loa và các thiết bị ghi âm. BỘ SẢN PHẨM BAO GỒM 01 Mixer Behringer Xenyx 1202SFX 01 Adapter nguồn 01 Hướng dẫn sử dụng THÔNG SỐ KỸ THUẬT Mono Inputs Microphone Input Balanced XLR, discrete input circuit Mic EIN (22 Hz-22 kHz) @ 50 Ω: 132 dB, A-weighted Frequency response Gain +10 dB: 10 Hz to 150 kHz Frequency response Gain +60 dB: 20 Hz to 70 kHz Gain range: +10 dB to +60 dB Max input level @ +10 dB Gain: +12 dBu Input Impedance 2 kΩ balanced Distortion (THD + N) 1 kHz @ +10 dB Gain: 0.005% Mono Line Inputs 1/4"" TRS connector balanced Impedance: 22 kΩ Balanced, 10 kΩ unbalanced Gain range: -10 dB to +40 dB Max input level @ 0 dB Gain: +21 dBu Stereo Inputs Stereo Line 1/4"" TRS connector balanced Frequency response: 20 Hz to 200 kHz Impedance: 22 kΩ Balanced, 10 kΩ unbalanced Max input level @ 0 dB Gain: +21 dBu STREAM Inputs (Analog) RCA connector unbalanced Impedance: 10 kΩ unbalanced Max input level: 10 dBu EQUALIZER Low 80 Hz/±15 dB Mid 2.5 kHz/±15 dB High 12 kHz/±15 dB Main, Monitor & FX Send Outputs Type 1/4"" TRS connector impedance-balanced Impedance 120 Ω Max output level 21 dBu Phones Out Type 1/4"" TRS connector unbalanced Impedance 23 Ω Max output level 19 dBu/150 Ω STREAM out (Analog) Type RCA connector unbalanced Impedance 1 kΩ unbalanced Max output level 10 10 dBu Main Mix noise Main Mix @ -∞ -108 dBu A-weighted Channel @ -∞ -108 dBu A-weighted FX Section Type Klark Teknik Converter 24-bit Sigma Delta Sample Rate 40 kHz USB Type Type-B connector USB Audio Data 48 kHz 16 Bit UAC2 Class Compliant stereo in/out Keyword : Behringer Xenyx 1202SFX, mixer Behringer 12 kênh, mixer livestream USB, bàn mixer analog Behringer, mixer thu âm podcast, mixer phòng thu nhỏ gọn. Giá sản phẩm trên Tiki đã bao gồm thuế theo luật hiện hành. Bên cạnh đó, tuỳ vào loại sản phẩm, hình thức và địa chỉ giao hàng mà có thể phát sinh thêm chi phí khác như phí vận chuyển, phụ phí hàng cồng kềnh, thuế nhập khẩu (đối với đơn hàng giao từ nước ngoài có giá trị trên 1 triệu đồng).....",0,0,"https://salt.tikicdn.com/ts/product/a9/13/4f/5ea686574f10d604b9b9106faf3786bd.jpg, https://salt.tikicdn.com/ts/product/2f/a5/27/bab3ef0abf371566a66fc573c2b1c2bd.jpg, https://salt.tikicdn.com/ts/product/bc/ca/b9/70b0a1940d9f67c0dc712e9b089c5ba1.jpg, https://salt.tikicdn.com/ts/product/c2/d3/1b/ea05598b8ca492c0e2f95b74eab33e4b.jpg, https://salt.tikicdn.com/ts/product/a6/8e/29/33890ba1052668d011bdb46cd8a2a02b.jpg, https://salt.tikicdn.com/ts/product/a9/13/4f/751ba30d60dd7b3391fb70930d9f655b.jpg","https://salt.tikicdn.com/cache/w1200/ts/product/a9/13/4f/5ea686574f10d604b9b9106faf3786bd.jpg, https://salt.tikicdn.com/cache/w1200/ts/product/2f/a5/27/bab3ef0abf371566a66fc573c2b1c2bd.jpg, https://salt.tikicdn.com/cache/w1200/ts/product/bc/ca/b9/70b0a1940d9f67c0dc712e9b089c5ba1.jpg, https://salt.tikicdn.com/cache/w1200/ts/product/c2/d3/1b/ea05598b8ca492c0e2f95b74eab33e4b.jpg, https://salt.tikicdn.com/cache/w1200/ts/product/a6/8e/29/33890ba1052668d011bdb46cd8a2a02b.jpg, https://salt.tikicdn.com/cache/w1200/ts/product/a9/13/4f/751ba30d60dd7b3391fb70930d9f655b.jpg","https://salt.tikicdn.com/cache/w300/ts/product/a9/13/4f/5ea686574f10d604b9b9106faf3786bd.jpg, https://salt.tikicdn.com/cache/w300/ts/product/2f/a5/27/bab3ef0abf371566a66fc573c2b1c2bd.jpg, https://salt.tikicdn.com/cache/w300/ts/product/bc/ca/b9/70b0a1940d9f67c0dc712e9b089c5ba1.jpg, https://salt.tikicdn.com/cache/w300/ts/product/c2/d3/1b/ea05598b8ca492c0e2f95b74eab33e4b.jpg, https://salt.tikicdn.com/cache/w300/ts/product/a6/8e/29/33890ba1052668d011bdb46cd8a2a02b.jpg, https://salt.tikicdn.com/cache/w300/ts/product/a9/13/4f/751ba30d60dd7b3391fb70930d9f655b.jpg","https://salt.tikicdn.com/cache/200x280/ts/product/a9/13/4f/5ea686574f10d604b9b9106faf3786bd.jpg, https://salt.tikicdn.com/cache/200x280/ts/product/2f/a5/27/bab3ef0abf371566a66fc573c2b1c2bd.jpg, https://salt.tikicdn.com/cache/200x280/ts/product/bc/ca/b9/70b0a1940d9f67c0dc712e9b089c5ba1.jpg, https://salt.tikicdn.com/cache/200x280/ts/product/c2/d3/1b/ea05598b8ca492c0e2f95b74eab33e4b.jpg, https://salt.tikicdn.com/cache/200x280/ts/product/a6/8e/29/33890ba1052668d011bdb46cd8a2a02b.jpg, https://salt.tikicdn.com/cache/200x280/ts/product/a9/13/4f/751ba30d60dd7b3391fb70930d9f655b.jpg","https://salt.tikicdn.com/cache/200x280/ts/product/a9/13/4f/5ea686574f10d604b9b9106faf3786bd.jpg, https://salt.tikicdn.com/cache/200x280/ts/product/2f/a5/27/bab3ef0abf371566a66fc573c2b1c2bd.jpg, https://salt.tikicdn.com/cache/200x280/ts/product/bc/ca/b9/70b0a1940d9f67c0dc712e9b089c5ba1.jpg, https://salt.tikicdn.com/cache/200x280/ts/product/c2/d3/1b/ea05598b8ca492c0e2f95b74eab33e4b.jpg, https://salt.tikicdn.com/cache/200x280/ts/product/a6/8e/29/33890ba1052668d011bdb46cd8a2a02b.jpg, https://salt.tikicdn.com/cache/200x280/ts/product/a9/13/4f/751ba30d60dd7b3391fb70930d9f655b.jpg",1000,0
276015670,"USB sound âm thanh cực chất 7.1- 5HV2 - Dùng cho máy tính, laptop - Hàng Nhập Khẩu",130000,"- Dễ sử dụng, thuận tiện, trên USB có các nút tùy chỉnh giúp bạn sử dụng- Cổng USB Sound có dây kết nối: Có 1 Jack âm thanh nối đầu ra và 1 đầu vào- Driver tự động nhận cho Windows 98SE/ME/ 2000/ ...","- Dễ sử dụng, thuận tiện, trên USB có các nút tùy chỉnh giúp bạn sử dụng - Cổng USB Sound có dây kết nối: Có 1 Jack âm thanh nối đầu ra và 1 đầu vào - Driver tự động nhận cho Windows 98SE/ME/ 2000/ XP/ Vista/ 7, Linux - Tương thích với USB 2.0 Full-Speed. Đặc điểm kỹ thuật (12Mbps) - Tương thích với USB thiết bị âm thanh kỹ thuật lớp 1.0 - Thông số kỹ thuật tương thích với USB HID lớp 1.1. - Hướng dẫn tóm tắt cách sử dụng USB âm thanh 7.1 - Bạn chỉ việc cắm USB to sound vào cổng USB máy tính, rồi sau đó cắm giản bạn đã có thể ngồi tận hưởng và nghe âm thanh của USB to sound. - USB sound 7.1 dùng để làm gì? + Khi máy tính bị hư hỏng cổng sound bạn không cần phải mang đi sửa. Điều chắc chắn hơn cả là Usb to sound 7.1 hơn usb to sound 2.1 rất nhiều + Quan trọng hơn là chất lượng âm thanh của USB to sound 7.1 chắc chắn + Âm thanh có độ linh hoạt cao và có thể sử dụng được với các hệ thống máy + Đi kèm với thiết bị là phần mềm mô phỏng âm thanh với Xear 3D, thanh 7.1của USB 2.0 có tốc độ tối đa là 12 Mbps Giá sản phẩm trên Tiki đã bao gồm thuế theo luật hiện hành. Bên cạnh đó, tuỳ vào loại sản phẩm, hình thức và địa chỉ giao hàng mà có thể phát sinh thêm chi phí khác như phí vận chuyển, phụ phí hàng cồng kềnh, thuế nhập khẩu (đối với đơn hàng giao từ nước ngoài có giá trị trên 1 triệu đồng).....",0,0,"https://salt.tikicdn.com/ts/product/ce/3a/19/1409c38415d95cda3a4a93dabaa87185.png, https://salt.tikicdn.com/ts/product/64/17/9c/fd10a0dc3844afb23443988b12a95884.png, https://salt.tikicdn.com/ts/product/5e/8b/0a/da6f1a43420eb58c6de4493dc38dd17c.png, https://salt.tikicdn.com/ts/product/7a/95/aa/9636b6939fd603c36bd2375370a34af8.jpg, https://salt.tikicdn.com/ts/product/12/e2/cd/21c74dc6bd8c816f46381d94015fc68d.jpg, https://salt.tikicdn.com/ts/product/28/a0/b1/12daac86d38e94a53cb26927da46fc4e.jpg, https://salt.tikicdn.com/ts/product/d1/fb/f4/943557298b3a3d8313d53135708e28c9.jpg, https://salt.tikicdn.com/ts/product/ee/44/48/baf7beaa114c132b595b08eb5b395b96.jpg, https://salt.tikicdn.com/ts/product/6c/ef/e0/8fc31e9996d95f4c3899c3f42471819e.jpg, https://salt.tikicdn.com/ts/product/68/76/5c/ab4b12bfc65c664ebdeac8af63cfd617.jpg","https://salt.tikicdn.com/cache/w1200/ts/product/ce/3a/19/1409c38415d95cda3a4a93dabaa87185.png, https://salt.tikicdn.com/cache/w1200/ts/product/64/17/9c/fd10a0dc3844afb23443988b12a95884.png, https://salt.tikicdn.com/cache/w1200/ts/product/5e/8b/0a/da6f1a43420eb58c6de4493dc38dd17c.png, https://salt.tikicdn.com/cache/w1200/ts/product/7a/95/aa/9636b6939fd603c36bd2375370a34af8.jpg, https://salt.tikicdn.com/cache/w1200/ts/product/12/e2/cd/21c74dc6bd8c816f46381d94015fc68d.jpg, https://salt.tikicdn.com/cache/w1200/ts/product/28/a0/b1/12daac86d38e94a53cb26927da46fc4e.jpg, https://salt.tikicdn.com/cache/w1200/ts/product/d1/fb/f4/943557298b3a3d8313d53135708e28c9.jpg, https://salt.tikicdn.com/cache/w1200/ts/product/ee/44/48/baf7beaa114c132b595b08eb5b395b96.jpg, https://salt.tikicdn.com/cache/w1200/ts/product/6c/ef/e0/8fc31e9996d95f4c3899c3f42471819e.jpg, https://salt.tikicdn.com/cache/w1200/ts/product/68/76/5c/ab4b12bfc65c664ebdeac8af63cfd617.jpg","https://salt.tikicdn.com/cache/w300/ts/product/ce/3a/19/1409c38415d95cda3a4a93dabaa87185.png, https://salt.tikicdn.com/cache/w300/ts/product/64/17/9c/fd10a0dc3844afb23443988b12a95884.png, https://salt.tikicdn.com/cache/w300/ts/product/5e/8b/0a/da6f1a43420eb58c6de4493dc38dd17c.png, https://salt.tikicdn.com/cache/w300/ts/product/7a/95/aa/9636b6939fd603c36bd2375370a34af8.jpg, https://salt.tikicdn.com/cache/w300/ts/product/12/e2/cd/21c74dc6bd8c816f46381d94015fc68d.jpg, https://salt.tikicdn.com/cache/w300/ts/product/28/a0/b1/12daac86d38e94a53cb26927da46fc4e.jpg, https://salt.tikicdn.com/cache/w300/ts/product/d1/fb/f4/943557298b3a3d8313d53135708e28c9.jpg, https://salt.tikicdn.com/cache/w300/ts/product/ee/44/48/baf7beaa114c132b595b08eb5b395b96.jpg, https://salt.tikicdn.com/cache/w300/ts/product/6c/ef/e0/8fc31e9996d95f4c3899c3f42471819e.jpg, https://salt.tikicdn.com/cache/w300/ts/product/68/76/5c/ab4b12bfc65c664ebdeac8af63cfd617.jpg","https://salt.tikicdn.com/cache/200x280/ts/product/ce/3a/19/1409c38415d95cda3a4a93dabaa87185.png, https://salt.tikicdn.com/cache/200x280/ts/product/64/17/9c/fd10a0dc3844afb23443988b12a95884.png, https://salt.tikicdn.com/cache/200x280/ts/product/5e/8b/0a/da6f1a43420eb58c6de4493dc38dd17c.png, https://salt.tikicdn.com/cache/200x280/ts/product/7a/95/aa/9636b6939fd603c36bd2375370a34af8.jpg, https://salt.tikicdn.com/cache/200x280/ts/product/12/e2/cd/21c74dc6bd8c816f46381d94015fc68d.jpg, https://salt.tikicdn.com/cache/200x280/ts/product/28/a0/b1/12daac86d38e94a53cb26927da46fc4e.jpg, https://salt.tikicdn.com/cache/200x280/ts/product/d1/fb/f4/943557298b3a3d8313d53135708e28c9.jpg, https://salt.tikicdn.com/cache/200x280/ts/product/ee/44/48/baf7beaa114c132b595b08eb5b395b96.jpg, https://salt.tikicdn.com/cache/200x280/ts/product/6c/ef/e0/8fc31e9996d95f4c3899c3f42471819e.jpg, https://salt.tikicdn.com/cache/200x280/ts/product/68/76/5c/ab4b12bfc65c664ebdeac8af63cfd617.jpg","https://salt.tikicdn.com/cache/200x280/ts/product/ce/3a/19/1409c38415d95cda3a4a93dabaa87185.png, https://salt.tikicdn.com/cache/200x280/ts/product/64/17/9c/fd10a0dc3844afb23443988b12a95884.png, https://salt.tikicdn.com/cache/200x280/ts/product/5e/8b/0a/da6f1a43420eb58c6de4493dc38dd17c.png, https://salt.tikicdn.com/cache/200x280/ts/product/7a/95/aa/9636b6939fd603c36bd2375370a34af8.jpg, https://salt.tikicdn.com/cache/200x280/ts/product/12/e2/cd/21c74dc6bd8c816f46381d94015fc68d.jpg, https://salt.tikicdn.com/cache/200x280/ts/product/28/a0/b1/12daac86d38e94a53cb26927da46fc4e.jpg, https://salt.tikicdn.com/cache/200x280/ts/product/d1/fb/f4/943557298b3a3d8313d53135708e28c9.jpg, https://salt.tikicdn.com/cache/200x280/ts/product/ee/44/48/baf7beaa114c132b595b08eb5b395b96.jpg, https://salt.tikicdn.com/cache/200x280/ts/product/6c/ef/e0/8fc31e9996d95f4c3899c3f42471819e.jpg, https://salt.tikicdn.com/cache/200x280/ts/product/68/76/5c/ab4b12bfc65c664ebdeac8af63cfd617.jpg",1000,0
275924437,"USB sound âm thanh cực chất 7.1- 5HV2 - Dùng cho máy tính, laptop - Hàng chính hãng",79000,"USB sound âm thanh cực chất 7.1- 5HV2 - Dùng cho máy tính, laptop - Hàng chính hãngHướng dẫn tóm tắt cách sử dụng USB to sound 7.1-    Bạn chỉ việc cắm USB to sound vào cổng USB máy tính, rồi sau đ...","USB sound âm thanh cực chất 7.1- 5HV2 - Dùng cho máy tính, laptop - Hàng chính hãng Hướng dẫn tóm tắt cách sử dụng USB to sound 7.1 -    Bạn chỉ việc cắm USB to sound vào cổng USB máy tính, rồi sau đó cắm tai nghe của bạn vào phía đầu ra của âm thanh. Chỉ với 1-2 bước đơn giản bạn đã có thể ngồi tận hưởng và nghe âm thanh của USB to sound. USB sound 7.1 dùng để làm gì? - Khi máy tính bị hư hỏng cổng sound  bạn  không cần phải mang đi sửa chữa tốn kém mà chỉ cần có USB to sound 7.1 là có thể giải quyết vấn đề nhức nhối này. - Điều chắc chắn hơn cả là Usb to sound 7.1  hơn usb to sound 2.1 rất nhiều với tính năng không bị gãy hay vỡ điều mà usb to sound 2.1 gặp rất nhiều - Quan trọng hơn nhất là chất lượng âm thanh của USB to sound 7.1 chắc là không phải bàn cãi tới nhiều là cực kỳ tốt. - Âm thanh có độ linh hoạt cao và có thể sử dụng được với các hệ thống máy tính để bàn, PC hay Laptop. Giá sản phẩm trên Tiki đã bao gồm thuế theo luật hiện hành. Bên cạnh đó, tuỳ vào loại sản phẩm, hình thức và địa chỉ giao hàng mà có thể phát sinh thêm chi phí khác như phí vận chuyển, phụ phí hàng cồng kềnh, thuế nhập khẩu (đối với đơn hàng giao từ nước ngoài có giá trị trên 1 triệu đồng).....",5,1,"https://salt.tikicdn.com/ts/product/dd/40/c7/78e518191471b1f44befd25c659f96a9.jpg, https://salt.tikicdn.com/ts/product/2b/0c/1d/ef48db9f66e6d70fb98956d0039d8839.jpg, https://salt.tikicdn.com/ts/product/1b/63/0b/1c8c2cdbd9cb50a5b75648aa5509136d.jpg, https://salt.tikicdn.com/ts/product/14/39/e7/21990857e2e1b01d37a2498fec667a41.jpg, https://salt.tikicdn.com/ts/product/ef/45/8c/c682484cc4831b59c3f5f712d9e3512d.jpg","https://salt.tikicdn.com/cache/w1200/ts/product/dd/40/c7/78e518191471b1f44befd25c659f96a9.jpg, https://salt.tikicdn.com/cache/w1200/ts/product/2b/0c/1d/ef48db9f66e6d70fb98956d0039d8839.jpg, https://salt.tikicdn.com/cache/w1200/ts/product/1b/63/0b/1c8c2cdbd9cb50a5b75648aa5509136d.jpg, https://salt.tikicdn.com/cache/w1200/ts/product/14/39/e7/21990857e2e1b01d37a2498fec667a41.jpg, https://salt.tikicdn.com/cache/w1200/ts/product/ef/45/8c/c682484cc4831b59c3f5f712d9e3512d.jpg","https://salt.tikicdn.com/cache/w300/ts/product/dd/40/c7/78e518191471b1f44befd25c659f96a9.jpg, https://salt.tikicdn.com/cache/w300/ts/product/2b/0c/1d/ef48db9f66e6d70fb98956d0039d8839.jpg, https://salt.tikicdn.com/cache/w300/ts/product/1b/63/0b/1c8c2cdbd9cb50a5b75648aa5509136d.jpg, https://salt.tikicdn.com/cache/w300/ts/product/14/39/e7/21990857e2e1b01d37a2498fec667a41.jpg, https://salt.tikicdn.com/cache/w300/ts/product/ef/45/8c/c682484cc4831b59c3f5f712d9e3512d.jpg","https://salt.tikicdn.com/cache/200x280/ts/product/dd/40/c7/78e518191471b1f44befd25c659f96a9.jpg, https://salt.tikicdn.com/cache/200x280/ts/product/2b/0c/1d/ef48db9f66e6d70fb98956d0039d8839.jpg, https://salt.tikicdn.com/cache/200x280/ts/product/1b/63/0b/1c8c2cdbd9cb50a5b75648aa5509136d.jpg, https://salt.tikicdn.com/cache/200x280/ts/product/14/39/e7/21990857e2e1b01d37a2498fec667a41.jpg, https://salt.tikicdn.com/cache/200x280/ts/product/ef/45/8c/c682484cc4831b59c3f5f712d9e3512d.jpg","https://salt.tikicdn.com/cache/200x280/ts/product/dd/40/c7/78e518191471b1f44befd25c659f96a9.jpg, https://salt.tikicdn.com/cache/200x280/ts/product/2b/0c/1d/ef48db9f66e6d70fb98956d0039d8839.jpg, https://salt.tikicdn.com/cache/200x280/ts/product/1b/63/0b/1c8c2cdbd9cb50a5b75648aa5509136d.jpg, https://salt.tikicdn.com/cache/200x280/ts/product/14/39/e7/21990857e2e1b01d37a2498fec667a41.jpg, https://salt.tikicdn.com/cache/200x280/ts/product/ef/45/8c/c682484cc4831b59c3f5f712d9e3512d.jpg",1000,1
212606899,[Thay Thế] USB Sound Card KhoNCC Hàng Chính Hãng Gắn Cho Máy Tính - Laptop Bị Lỗi Âm Thanh Gắn Qua Cổng USB - NLVQ-192-USBS,47000,* Giới Thiệu USB Sound Card- Một USB Sound Card là thiết bị tuy nhỏ nhưng rất hữu ích cho máy tính và laptop. USB Sound Card có nhiều chức năng cho phép nó biến bất kỳ máy tính thành một giải pháp âm ...,"* Giới Thiệu USB Sound Card - Một USB Sound Card là thiết bị tuy nhỏ nhưng rất hữu ích cho máy tính và laptop. USB Sound Card có nhiều chức năng cho phép nó biến bất kỳ máy tính thành một giải pháp âm thanh rạp hát tại nhà. - Mặc dù tên là USB Sound Card nhưng nó là một thiết bị trông giống như một chiếc hộp, giúp bạn kết nối với máy tính để thêm cổng âm thanh - USB Sound Gắn Cho Máy Bị Lỗi Âm Thanh - Nhỏ gọn, tiện dụng, âm thanh chất lượng - Có thể dùng cho laptop khi trên laptop chỉ có 1 cổng duy nhất gắn tai nghe điện thoại chứ không thể gắn tai nghe máy tính được * Công Dụng của USB Sound Card Máy tính sử dụng các bit để giao tiếp. Các bit này khi kết hợp lại với nhau có thể mang số lượng thông tin khổng lồ. USB Sound Card giúp dẫn truyền các bit âm thanh từ máy tính đến các thiết bị phát nhạc bên ngoài. Chẳng hạn như dàn loa ngoài và amply sẽ cần USB Sound Card để có thể đọc được tín hiệu từ máy tính truyền sang. Máy tính không tương thích với những thiết bị loại này, chính vì vậy chúng ta cần USB Sound Card để làm trung gian kết nối. USB Sound Card sẽ biến đổi các bit máy tính thành dạng sóng âm thanh truyền dẫn, sau đó được đầu thu của loa ngoài hoặc amply tiếp nhận thông qua các jack cắm. Từ đó, các vi mạch bên trong bộ amply sẽ giải mã các bit này và biến chúng thành các tín hiệu âm thanh tương thích. Từ đó, loa ngoài sẽ có thể phát nhạc đồng bộ với bài hát đang được mở trên laptop hoặc máy tính * Dễ dàng cài đặt - Bạn sẽ không phải làm gì ngoài việc cắm USB Sound Card vào máy tính, chờ máy tính tự nhận diện và cài đặt là xong. Đơn giản chỉ là “cắm-và-chơi” là xong. Vô cùng dễ dàng đúng không nào? * Không có nguy cơ bị sốc điện - Việc kết nối trực tiếp các thiết bị điện tử không tương thích với nhau sẽ gây ra tình trạng sốc điện (hay còn gọi là chập mạch) này. USB Sound Card sẽ giúp đảm bảo điều này không xảy ra khi kết nối laptop với những thiết bị loa ngoài và amply. * Kết nối với hệ thống âm thanh vòm - Cho phép laptop trở thành trung tâm phát nhạc Home Theater chất lượng cao cho gia đình, rất thích hợp cho những bạn muốn chơi game hoặc nghe nhạc và xem phim với những trải nghiệm âm thanh hoàn toàn mới. ------ * Lưu ý khác (nếu có) - Hình ảnh, màu sắc sản phẩm có thể khác ĐÔI CHÚT do ánh sáng, do thời trang mẫu mã sản phẩm, nhưng giống >98% - Hình ảnh không thể hiện đúng, ví dụ: Điện thoại thì không có Thẻ Nhớ, SIM, phải mua riêng hay Quần áo không có người mẫu, ma nơ canh rồi - Hộp bìa sản phẩm có thể đổi để bổ sung thông tin, thay đổi nhận dạng chu kỳ cũng như đẹp hơn - Trường hợp hết màu, chúng tôi sẽ lưu ý ở bao bì để quý khách cân nhắc * Khi mở hàng Chụp lại ảnh hộp hàng và quay video khi khui hộp hàng. Việc này có thể sẽ bất tiện cho quý khách, tuy nhiên sẽ giúp quý khách xử lý vấn đề về hàng hóa dễ dàng hơn vì qua nhiều công đoạn, nhiều trạm lưu trữ, khó tránh khỏi rủi ro, dù hàng hóa kiểm tra khi đóng gói Hãy MUA NGAY kẻo lỡ sản phẩm tuyệt vời này ! Cám Ơn Quý Khách Đã Quan Tâm Ủng Hộ Giá sản phẩm trên Tiki đã bao gồm thuế theo luật hiện hành. Bên cạnh đó, tuỳ vào loại sản phẩm, hình thức và địa chỉ giao hàng mà có thể phát sinh thêm chi phí khác như phí vận chuyển, phụ phí hàng cồng kềnh, thuế nhập khẩu (đối với đơn hàng giao từ nước ngoài có giá trị trên 1 triệu đồng).....",0,0,"https://salt.tikicdn.com/ts/product/7b/23/84/98f4d4c0f92ec925d902c1fc9ca8f230.jpg, https://salt.tikicdn.com/ts/product/76/6e/6d/e30d6ed6ff791fdb63833fb3ca126788.jpg, https://salt.tikicdn.com/ts/product/91/b5/73/536c78540f86833dc31d05b3dc3aea0f.jpg, https://salt.tikicdn.com/ts/product/3a/cc/40/fb397464e180a480b8f84e04177de4f3.jpg, https://salt.tikicdn.com/ts/product/4c/ce/4f/41154629080f63ac4c1334a321bc8b76.jpg, https://salt.tikicdn.com/ts/product/46/54/04/1a1b5590fb0a767639f4dc9e07f2f60d.jpg","https://salt.tikicdn.com/cache/w1200/ts/product/7b/23/84/98f4d4c0f92ec925d902c1fc9ca8f230.jpg, https://salt.tikicdn.com/cache/w1200/ts/product/76/6e/6d/e30d6ed6ff791fdb63833fb3ca126788.jpg, https://salt.tikicdn.com/cache/w1200/ts/product/91/b5/73/536c78540f86833dc31d05b3dc3aea0f.jpg, https://salt.tikicdn.com/cache/w1200/ts/product/3a/cc/40/fb397464e180a480b8f84e04177de4f3.jpg, https://salt.tikicdn.com/cache/w1200/ts/product/4c/ce/4f/41154629080f63ac4c1334a321bc8b76.jpg, https://salt.tikicdn.com/cache/w1200/ts/product/46/54/04/1a1b5590fb0a767639f4dc9e07f2f60d.jpg","https://salt.tikicdn.com/cache/w300/ts/product/7b/23/84/98f4d4c0f92ec925d902c1fc9ca8f230.jpg, https://salt.tikicdn.com/cache/w300/ts/product/76/6e/6d/e30d6ed6ff791fdb63833fb3ca126788.jpg, https://salt.tikicdn.com/cache/w300/ts/product/91/b5/73/536c78540f86833dc31d05b3dc3aea0f.jpg, https://salt.tikicdn.com/cache/w300/ts/product/3a/cc/40/fb397464e180a480b8f84e04177de4f3.jpg, https://salt.tikicdn.com/cache/w300/ts/product/4c/ce/4f/41154629080f63ac4c1334a321bc8b76.jpg, https://salt.tikicdn.com/cache/w300/ts/product/46/54/04/1a1b5590fb0a767639f4dc9e07f2f60d.jpg","https://salt.tikicdn.com/cache/200x280/ts/product/7b/23/84/98f4d4c0f92ec925d902c1fc9ca8f230.jpg, https://salt.tikicdn.com/cache/200x280/ts/product/76/6e/6d/e30d6ed6ff791fdb63833fb3ca126788.jpg, https://salt.tikicdn.com/cache/200x280/ts/product/91/b5/73/536c78540f86833dc31d05b3dc3aea0f.jpg, https://salt.tikicdn.com/cache/200x280/ts/product/3a/cc/40/fb397464e180a480b8f84e04177de4f3.jpg, https://salt.tikicdn.com/cache/200x280/ts/product/4c/ce/4f/41154629080f63ac4c1334a321bc8b76.jpg, https://salt.tikicdn.com/cache/200x280/ts/product/46/54/04/1a1b5590fb0a767639f4dc9e07f2f60d.jpg","https://salt.tikicdn.com/cache/200x280/ts/product/7b/23/84/98f4d4c0f92ec925d902c1fc9ca8f230.jpg, https://salt.tikicdn.com/cache/200x280/ts/product/76/6e/6d/e30d6ed6ff791fdb63833fb3ca126788.jpg, https://salt.tikicdn.com/cache/200x280/ts/product/91/b5/73/536c78540f86833dc31d05b3dc3aea0f.jpg, https://salt.tikicdn.com/cache/200x280/ts/product/3a/cc/40/fb397464e180a480b8f84e04177de4f3.jpg, https://salt.tikicdn.com/cache/200x280/ts/product/4c/ce/4f/41154629080f63ac4c1334a321bc8b76.jpg, https://salt.tikicdn.com/cache/200x280/ts/product/46/54/04/1a1b5590fb0a767639f4dc9e07f2f60d.jpg",1000,0
